Unnamed: 0,abstract,author1,author2,author3,author4,author5,author6,author7,author8,author9,author10,author11,author12,author13,author14,author15,author16,author17,author18,author19,author20,author21,author22,author23,author24,author25,author26,author27,author28,author29,author30,author31,author32,author33,author34,author35,author36,author37,author38,author39,author40,author41,citation,conference,journal/book,keyword1,keyword2,keyword3,keyword4,keyword5,keyword6,keyword7,keyword8,keyword9,keyword10,keyword11,keyword12,keyword13,keyword14,keyword15,keyword16,publish time,title
Row_99,"We consider a broad class of spatial models where there are many types of interactions across a large number of locations. We provide a new theorem that offers an iterative algorithm for calculating an equilibrium and sufficient and ""globally necessary"" conditions under which the equilibrium is unique. We show how this theorem enables the characterization of equilibrium properties for one important spatial system: an urban model with spillovers across a large number of different types of agents. An online appendix provides 12 additional examples of both spatial and nonspatial economic frameworks for which our theorem provides new equilibrium characterizations. ( JEL C21, R15, R23)","Allen, Treb","Arkolakis, Costas","Li, Xiangliang",,,,,,,,,,,,,,,,,,,,,,,,,,,,,,,,,,,,,,,0,,AMERICAN ECONOMIC REVIEW-INSIGHTS,,,,,,,,,,,,,,,,,DEC 2024,On the Equilibrium Properties of Spatial Models
Row_100,"Urban green spaces assume a pivotal role in city-level nature-based solutions for sustainable development. Parks, street greening, and community greens play a significant role in regulating the urban microenvironment, enhancing subjective well-being, and increasing regional attractiveness. Additionally, urban greenbelts have the capacity to control urban sprawl, thereby influencing housing prices and population distribution. However, the exisiting urban models have typically addressed greenbelts and other green spaces in isolation, resulting in fragmented planning strategies. This study aims to establish a novel spatial equilibrium model that accurately assesses the socio-economic effects resulting from the combined impact of various urban green spaces. This model encompasses green infrastructure components and carefully balances their appeal against the consequent rise in housing costs. The proposed model can elucidate the latent synergistic interactions among multiple urban green policies, which enables urban policymakers to access the multifaceted impacts of greening policy combinations. and suggests that combining different urban greening policies can mitigate the negative effects of a single policy type, such as population redistribution. A case study based on empirical data from Shanghai, China, has been employed to identify the additional value associated with diverse urban green spaces. The scenario analysis suggests that combining different urban greening policies can alleviate the negative impacts of urban population relocation. These findings furnish urban planners and policymakers with novel insights to develop the distribution strategy of urban green spaces via judicious policy integration. Consequently, the proposed model furnishes a novel academic standpoint on the role of urban green spaces within the context of nature-based solution for sustainable development of metropolitan conglomerates and nascent urban agglomerations amidst the evolving post-COVID-19 environment.","Li, Yi-Bin","Wang, Qian-Cheng","Chang, Ruidong",,,,,,,,,,,,,,,,,,,,,,,,,,,,,,,,,,,,,,,6,,JOURNAL OF CLEANER PRODUCTION,,,,,,,,,,,,,,,,,JUL 10 2024,Nature-based solutions for fast-growing city regions: A new spatial equilibrium model for complementary urban green space planning
Row_102,"With the rapid pace of urbanization, urban sprawl has become a prevalent phenomenon, particularly in the global South, leading to the emergence of peri-urban spaces where rural-urban interfaces occur. These peri-urban areas exhibit dynamic and continuous interactions among social, economic, and environmental systems, offering valuable insights for fostering resilient futures. However, this aspect remains largely unexplored in current research due to a lack of innovative methodological approaches that effectively capture the complementarities, potentialities, and contestations inherent in the dynamics of peri-urban areas. We contend that peri-urbanisation needs to be reconceptualized as an alternative socio-spatial framework that extends the predominantly Eurocentric discourse on counterurbanisation, making it more inclusive of the emerging urban-rural transformations in the global South. By doing so, we can better understand and address the complex dynamics and challenges associated with peri-urban areas and develop strategies to foster resilience in these contexts.","Rajendran, Lakshmi Priya","Raul, Leal","Chen, Mingze","Andrade, Juan Carlos Guerrero","Akhtar, Rakib","Mngumi, Lazaro Eliyah","Chander, Sheeba","Srinivas, Sudhan","Roy, Maria Rinya",,,,,,,,,,,,,,,,,,,,,,,,,,,,,,,,,5,,HABITAT INTERNATIONAL,,,,,,,,,,,,,,,,,APR 2024,The 'peri-urban turn': A systems thinking approach for a paradigm shift in reconceptualising urban-rural futures in the global South
Row_110,"While mounting studies highlight the detrimental consequences of insufficient state governance on urban sprawl, there remains a scarcity of literature addressing the issue of robust state -led urban sprawl within the context of inadequate market discipline. This study investigates the institutional factors driving urban sprawl in China through a case study of Wuhan, exploring the impact of influential governmental bodies on the spatiotemporal characteristics of urban sprawl as reflected in stringent policy implementations and top -down planning institutions. By employing spatial measurements, statistical analysis, and policy interpretation based on extensive fieldwork data, we observed a marked intensification of leapfrogging urban land expansion accompanied by the encroachment of agricultural land between 1996 and 2014 in Wuhan. These transformations are predominantly attributable to a two-tiered institutional mechanism comprised of central -local and intra-city institutional changes. Temporal shifts in spatial expansion have been heavily influenced by the interplay between central transitional development policies and corresponding local planning responses. The choice of specific locations for land sprawl is governed by the interaction of different government levels, each focusing on local development strategies and land institutional arrangements. These findings offer novel insights into the global discourse surrounding the state -market relations in addressing urban sprawl and achieving sustainable urbanization.","Zhu, Jiren","Tu, Yong","Zhu, Jieming",,,,,,,,,,,,,,,,,,,,,,,,,,,,,,,,,,,,,,,2,,CITIES,Institution-driven urban sprawl,State-market relations,Transitional development policy,Intra-city institutional change,Local planning response,Wuhan,,,,,,,,,,,MAY 2024,Institution-driven urban sprawl in China: Evidence from Wuhan
Row_112,"The COVID-19 pandemic has significantly affected individuals' daily lives. The reduction in mobility, decreased social interactions, and heightened uncertainty, negatively affected the public's emotional well-being. As restrictions eased, many countries transitioned towards a new normal. Understanding the connection between public attitude and urban mobility during the recovery phase is crucial for the planning of resilience urban environment. This study investigates the changes in urban mobility and public attitudes by analyzing public transportation and social media data. Findings indicate a significant increase in mobility during the recovery compared to the semi-lockdown period, with better resilience to subsequent outbreaks. Commercial areas and major public transit interchanges exhibited stronger recovery in mobility after new (sub)variants waves. Train mobility demonstrated robust recovery. Relaxation in April 2022 played a crucial role in increased mobility and reduced negative feelings. This policy shift contributed to a surge in positive emotions, particularly in locations where individuals could engage in social and recreational activities. Moreover, the increased beyond- neighborhood mobility was related to decreased negative emotions during the easing of restrictions. Commuting behaviors exhibited long-term changes after 30 months from the initial outbreak, e.g., preference shifted to trains from buses and reduced visits to destinations for international travel.","Tian, Haoyu","Chin, Wei Chien Benny","Feng, Chen-Chieh",,,,,,,,,,,,,,,,,,,,,,,,,,,,,,,,,,,,,,,0,,CITIES,Human dynamics,Spatial big data,COVID-19 recovery,Urban mobility,Public attitude,Social interaction,,,,,,,,,,,DEC 2024,The recovery from the pandemic: A spatial-temporal analysis on the changes in mobility and public attitude in Singapore
Row_116,"Urban land use patterns can be more accurately mapped by fusing multimodal data. However, many studies only consider socioeconomic and physical attributes within land parcels, neglecting spatial interaction and uncertainty caused by multimodal data. To address these issues, we constructed a multimodal data fusion model (MDFNet) to extract natural physical, socioeconomic, and spatial connectivity ancillary information from multimodal data. We also established an uncertainty analysis framework based on a generalized additive model and learnable weight module to explain data -driven uncertainty. Shenzhen was chosen as the demonstration area. The results demonstrated the effectiveness of the proposed method, with a test accuracy of 0.882 and a Kappa of 0.858. Uncertainty analysis indicated the contributions in overall task of 0.361, 0.308, and 0.232 for remote sensing, social sensing, and taxi trajectory data, respectively. The study also illuminates the collaborative mechanism of multimodal data in various land use categories, offering an accurate and interpretable method for mapping urban distribution patterns.","Yan, Xiaoqin","Jiang, Zhangwei","Luo, Peng","Wu, Hao","Dong, Anning","Mao, Fengling","Wang, Ziyin","Liu, Hong","Yao, Yao",,,,,,,,,,,,,,,,,,,,,,,,,,,,,,,,,3,,INTERNATIONAL JOURNAL OF APPLIED EARTH OBSERVATION AND GEOINFORMATION,Urban land use mapping,Multimodal data fusion,Uncertainty analysis,Feature extraction,Deep learning,,,,,,,,,,,,MAY 2024,A multimodal data fusion model for accurate and interpretable urban land use mapping with uncertainty analysis
Row_117,"An interactive confluence of top -down state interventions and bottom -up market forces has driven a surge of plastic -mulched farmland (PMF), especially in dynamic peri-urban agricultural landscapes, with significant implications for global food security. Nevertheless, there is a dearth of literature regarding the comprehensive policy -market mechanisms on the diffusion of plastic greenhouses. We combine the strength of spatial lag Tobit and BRT models to examine respective roles of policy and market as well as their intrinsic interactions in facilitating PMF growth. Our analysis reveals that both state promotion of food localization policies and spatial proximity to markets increase the intensity of PMF, and market -driven forces are confirmed to be the preponderant determinant. State investments in city -region vegetable production bases exert moderating effect on market-PMF linkages by alleviating market constraints on greenhouses adoption in remote farming regions, while direct policy effects show heterogeneity with different road accessibility, signaling a complex interplay in the interaction mechanism. The counterfactual simulation further emphasize a synergistic effect of policy -market confluence on PMF expansion, suggesting a robust combination of state interventions and market mechanisms. We conclude with insights for planning strategies of greenhouse agriculture and peri-urban farmland use, which shed light on the spatial management framework for regional food systems.","Zhang, Yingnan","Wu, Lan","Ma, Li","Wang, Sensen","Shen, Mingyang",,,,,,,,,,,,,,,,,,,,,,,,,,,,,,,,,,,,,0,,LANDSCAPE AND URBAN PLANNING,Greenhouse agriculture,State intervention,Market -driven,Food system transition,China,,,,,,,,,,,,AUG 2024,"Bent by the market or driven by the policy? Cracking the code of plastic-mulched farmland expansion in peri-urban Hangzhou, China"
Row_127,"Due to rapid urbanization and globalization, urban functions are increasingly segregated in cities comprising centers of population aggregation and economic activity. Urban development yields intertwining and interdependent functional areas for residence, commerce, and education, which leads to complex but regular population mobility patterns. Population mobility spaces can effectively represent the actual service scopes of urban functions. Therefore, in this study, we propose a function-associated population mobility network (FPMN) to dynamically delineate the service capacities of urban functions, and to quantify the driving effects of urban functions on population mobility under spatial interaction conditions. By integrating the cumulative opportunities of geographic nodes with the potential opportunities reflected by population mobility, k-step function accessibility with population mobility (k-step PFA) is defined in FPMN to characterize the accessibility relationships between geographic nodes and function nodes. Based on k-step PFA, considering the complementarity and intervention opportunities, the function-driven index (FDI) is proposed to quantify the driving effects of urban functions on population mobility. Our experimental results indicated that FPMN could effectively represent the actual service scopes and capabilities of urban functions. Compared with general location-based accessibility indicators, k-step PFA has a higher numerical distribution and less spatial disparity, and it aligns more closely with the actual service scopes of urban functions. In addition, compared with intervening opportunities models, FDI delineates the functional driving effects of population mobility with greater precision, as well as revealing the travel propensity traits of a population relative to various urban functions through propensity parameters.","Liu, Xinrui","Li, Rui","Cai, Jing","Li, Bosen","Li, Yanhao",,,,,,,,,,,,,,,,,,,,,,,,,,,,,,,,,,,,,0,,INTERNATIONAL JOURNAL OF APPLIED EARTH OBSERVATION AND GEOINFORMATION,Urban function,Population mobility network,Accessibility,Transferability,Complementarity,Intervention opportunities,,,,,,,,,,,DEC 2024,Quantifying urban function accessibility and its effect on population mobility based on function-associated population mobility network
Row_131,"Innovation is an intrinsic driver of high -quality urban development, and construction land expansion (CLE) is an important challenge that cities must address to achieve sustainable development; however, the existing literature mainly examines urban innovation and CLE from a static perspective. The extant research lacks an in-depth analysis of the relationship and impact between urban innovation network linkage intensity (UINLI) and CLE from the perspective of intercity interaction. This study establishes a new mechanistic framework for the impact of UINLI on CLE from the network linkage perspective based on panel data of 10 national -level urban agglomerations in China from 2007 to 2019. Using a modified gravity model and a spatial econometric model, we empirically estimate the impact of UINLI on CLE for different regions and structures. The results show that (1) UINLI in each urban agglomeration is increasing, gradually forming a ""multinode, multiaxis, gradient"" network connection characteristics. (2) UINLI has a significant inhibitory effect on CLE; the largest inhibiting effect is on the residential land, followed by the commercial land, and less on the industrial land. (3) The inhibiting effect of UINLI on CLE in the eastern, central, and western urban agglomerations gradually increases from east to west. (4) The negative effect of UINLI on CLE in network -style, group -style, and point -axis -style urban agglomerations decreases with the increasing tightness of the innovation network structure.","Shi, Haimeng","Li, Qiao","Zhang, Sun","Chen, Wei",,,,,,,,,,,,,,,,,,,,,,,,,,,,,,,,,,,,,,4,,EXPERT SYSTEMS WITH APPLICATIONS,Urban agglomeration,Innovation network linkage intensity,Construction land expansion,Modified gravity model,Spatial econometric model,,,,,,,,,,,,SEP 1 2024,How does urban innovation affect construction land use change in China? An analysis based on the network linkage perspective
Row_149,"Streets, vital for vehicular and pedestrian traffic, are increasingly repurposed to enhance urban vibrancy beyond transport needs. This paper explores intentional and spontaneous street experiments, drawing on Henri Lefebvre's rhythmanalysis. Streets are seen as hosts to intersecting rhythms shaped by daily routines and mobility, with users as performers in rhythmic interactions. While initially disruptive, these experiments strive to integrate innovative elements for cohesive urban compositions. Through a musical metaphor, the paper promotes a holistic approach to identifying rhythms influenced and introduced by street experiments. It examines how these rhythms interact, presenting as synchronised dynamics, disruptive discordance, or coexistence in dissonant compositions. Combining rhythmanalysis with spatial discourse analysis, the study 'reads' and 'listens' to temporary spaces through historical records (N = 55) of seven street experiments in Hong Kong from 2016 to 2020. Findings uncover the overly abstract agendas of these experiments - exemplified through narratives involving chairs, railings, and traffic signals - often oversimplify and exclude possibilities. The paper calls for open dialogue to capture power dynamics in street infrastructure and embodied lived experiences during the transition from vehicle-centred to people-oriented streets. It suggests rhythmanalysis as an initial tool for urban planners to envision streetscapes as symphonies, fostering sensitivity to time-space dynamics.","Chan, Tommy H. Y.",,,,,,,,,,,,,,,,,,,,,,,,,,,,,,,,,,,,,,,,,3,,CITIES,Urban street experiment,Rhythmanalysis,Spatial discourse analysis,Tactical urbanism,Walkability,Conviviality,,,,,,,,,,,SEP 2024,Rethinking urban street experiments through Lefebvre's rhythmanalysis: From vehicles and vibrancy to virtuosos
Row_151,"Green infrastructure (GI), as one type of ecological stormwater management practices, can potentially alleviate water problems and deliver a wide range of environmental benefits in urban areas. GIs are often planned and designed to reduce runoff and mitigate pollution. However, the influence of GI on groundwater hydrology and that of shallow groundwater on GI performance was seldom considered. This study utilized a calibrated surfacesubsurface hydrological model, i.e., Storm Water Management Model coupled with USGS 's modular hydrologic model (SWMM-MODFLOW) to consider the interaction between GI and groundwater into the process of GI planning. The optimal implementation ratio, aggregation level and upstream-downstream location of bioretention cells (BC, one type of GI) under different planning objectives and hydrogeologic conditions was explored. The consideration of groundwater management exerted a significant impact on the optimal spatial allocation of BCs. The results showed that when groundwater management was more concerned than runoff control, BCs were recommended to be allocated more apart from each other and more upstream in the catchment because more-distributed and upstream BCs can result in lower groundwater table rise which is beneficial. BCs were overall recommended to be allocated in areas of deeper groundwater tables, coarser soils, and flatter topographies. However, the spatial features of BCs are related to each other, the choice of them are affected by various hydrogeologic factors simultaneously. The exact location of BCs should be determined by considering the trade-off between runoff control efficiency and groundwater impact. The findings obtained in this study can provide guidance on GI planning in shallow groundwater areas.","Zhang, K","Chui, TFM",,,,,,,,,,,,,,,,,,,,,,,,,,,,,,,,,,,,,,,,1,,SCIENCE OF THE TOTAL ENVIRONMENT,,,,,,,,,,,,,,,,,JUL 20 2024,Spatial allocation of bioretention cells considering interaction with shallow groundwater: A simulation-optimization approach
Row_155,"Groundwater-surface water (GW-SW) interactions are complex phenomena that vary naturally over space and time and are being influenced by environmental change. The Whitson River watershed is a mixed land-use Precambrian shield watershed located in Northeastern Ontario, Canada in which groundwater is a source of municipal water supply and in which groundwater and surface waters are at risk of potential impacts from urban runoff, ongoing municipal drainage projects, periodic flooding, and climate change. This study used watershed-scale synoptic surveys of stable isotopes (delta O-18 and delta H-2) and geochemistry, and corresponding mixing-model approaches (two-component and three-component) to quantify the seasonal and spatial variation in surface water, ambient, and urban groundwater contributions to streamflow. Multiple mixing models were generated based on isotope and geochemical source water identification, and the performance of these models was compared. Mixing-model analyses showed that groundwater contributes a critical, sustaining source to streamflow (> 50 % or more) during summer baseflow conditions, dropping to similar to 15 % in fall when connection to shield lakes and wetlands dominate. Three-component mixing models showed similar results to the two-component models, refining groundwater contributions into ambient and urban groundwater sources. Estimated urban groundwater contributed 30 % or more to summer baseflow, dropping to similar to 4 % in the fall. Baseflow estimates derived from graphical hydrograph separation were similar to mixing model groundwater estimates in the summer but suggest this approach overestimates groundwater contributions during the fall. These results demonstrate the complexity of source water contributions to streamflow and the challenges in their determination in mixed-land-use Precambrian Shield landscapes where communities are largely located. Assessment of source water contributions to streamflow across the Whitson River sub-watershed has generated a region-specific conceptualization (e.g. urban versus ambient groundwater) of a basin that is experiencing increased urban development, providing information that will be of value for long term management.","Montgomery, Kimberly","James, April L.","Macrae, Merrin","Tafvizi, Arghavan","Snider, Rebecca","Goel, Pradeep","Zhang, Helen","Yao, Huaxia","Wachowiak, Mark",,,,,,,,,,,,,,,,,,,,,,,,,,,,,,,,,0,,JOURNAL OF HYDROLOGY,Groundwater-surface water interactions,Hydrograph separation,Tracer-based mixing model,Isotope hydrology,Tracer,Chloride,Mixed land-use,,,,,,,,,,NOV 2024,Constraining seasonal and spatial ambient and urban groundwater contributions to streamflow across a mixed land-use regional-scale Precambrian Shield watershed
Row_158,"Digital economy is fundamentally changing the production, life, and governance of cities and reshaping benign interactions between urban systems. Consequently, it has profound implications for exploring resilient city building in the Chinese context. Using panel data of 274 cities in China from 2011 to 2020, this research explores the impact mechanisms and spatial effects of the digital economy on urban economic resilience. The results suggest that digital economy facilitates the building of urban economic resilience. The digital economy is effective in enhancing the economic resilience of smart cities and cities in eastern and central China. The economic resilience of urban agglomerations in the Yangtze River Delta and Pearl River Delta is prominently affected by the digital economy, while the impact of Beijing-Tianjin-Hebei is not obvious. The digital economy mainly enhances urban economic resilience by activating innovation dynamics, catalyzing industrial structure diversification, and accelerating human resource accumulation. Finally, the digital economy has a significant positive spillover effect on urban economic resilience. This research provides valuable guidance for cities to grasp the growth opportunities of the digital economy, scientifically coordinate the synergistic building of urban systems and improve the economic resilience of cities.","Xu, Qiong","Zhong, Meirui","Dong, Yu",,,,,,,,,,,,,,,,,,,,,,,,,,,,,,,,,,,,,,,2,,CITIES,Digital economy,Urban economic resilience,Impact mechanisms,,,,,,,,,,,,,,DEC 2024,Digital economy and risk response: How the digital economy affects urban resilience
