,author1,author2,author3,author4,title,journal/book,publish time,citation,abstract,keyword1,keyword2,keyword3,keyword4,conference,keyword5,keyword6,author5,keyword7,author6,keyword8,keyword9,keyword10,keyword11,keyword12,keyword13,keyword14,keyword15,keyword16,keyword17,author7,author8,author9,author10
Row_106,"Xiao, Longzhu","Xu, Wangtu",,,Urban spatial cluster structure in metro travel networks: An explorative study of Wuhan using big and open data,FRONTIERS OF ENGINEERING MANAGEMENT,JUN 2024,3,"Rail transit plays a crucial role in improving urban sustainability and livability. In many Chinese cities, the planning of rail transit routes and stations is focused on facilitating new developments rather than revitalizing existing built-up areas. This approach reflects the local governments' expectations of substantial growth to reshape the urban structure. However, existing research on transit-oriented development (TOD) rarely explores the spatial interactions between individual transit stations and investigates how they can be integrated to achieve synergistic effects and balanced development. This study proposes that rail transit systems impact urban structure through two ""forces"": the provision of additional and reliable carrying capacity and the reduction of travel time between locations. Metro passenger flow is used as a proxy for these forces, and community detection techniques are employed to identify the actual and optimal spatial clusters in Wuhan, China. The results reveal that the planned sub-centers align reasonably well with the optimal spatial clusters in terms of spatial configuration. However, the actual spatial clusters tend to have longer internal travel times compared to the optimal clusters. Further exploration suggests the need for equalizing land use density within planned spatial clusters served by the metro system. Additionally, promoting concentrated, differentiated, and mixed functional arrangements in metro station areas with low passenger flows within the planned clusters could be beneficial. This paper presents a new framework for investigating urban spatial clusters influenced by a metro system.",urban spatial clusters,metro travel flows,land use,metro smartcard data,,Wuhan,,,,,,,,,,,,,,,,,,
Row_107,"Saqib, Ehsan","Gidofalvi, Gyozo",,,Dynamic Adaptive Charging Network Planning Under Deep Uncertainties,ENERGIES,NOV 2024,0,"Charging infrastructure is the backbone of electromobility. Due to new charging behaviors and power distribution and charging space constraints, the energy demand and supply patterns of electromobility and the locations of current refueling stations are misaligned. Infrastructure developers (charging point operators, fleet operators, grid operators, vehicle manufacturers, and real-estate developers) need new methodologies and tools that help reduce the cost and risk of investments. To this extent we propose a transport-energy-demand-centric, dynamic adaptive planning approach and a data-driven Spatial Decision Support System (SDSS). In the SDSS, with the help of a realistic digital twin of an electrified road transport system, infrastructure developers can quickly and accurately estimate key performance measures (e.g., charging demand, Battery Electric Vehicle (BEV) enablement) of a candidate charging location or a network of locations under user-specified transport electrification scenarios and constraints and interactively and continuously calibrate and/or expand their network plans as facts about the deep uncertainties about the supply side of transport electrification (i.e., access to grid capacity and real-estate and presence of competition) are gradually discovered/observed. This paper describes the components and the planning support of the SDSS and how these can be used in competitive and collaborative settings. Qualitative user evaluations of the SDSS with 33 stakeholder organizations in commercial discussions and pilots have shown that both transport-energy-demand-centric and dynamic adaptive planning of charging infrastructure planning are useful.",charging infrastructure planning,deep uncertainties,dynamic adaptive planning,route-based network effects,,spatial decisions support,,,,,,,,,,,,,,,,,,
Row_108,"Huang, Di","Peng, Xinyi","Liu, Zhiyuan","Chen, Jun",Understanding the route choice behavior of metro passenger using the smartphone applications,TRAVEL BEHAVIOUR AND SOCIETY,JUL 2024,1,"Understanding the distribution of passenger flow is one of the crucial prerequisites for improving operational efficiency and implementing travel demand management strategies. This paper proposes an improved Random Regret Minimization (i-RRM) model based on the regret theory, where the passenger's regret on selecting routes is minimized. Considering the growing trend of passengers relying on smartphone apps for route planning and navigation, three factors are investigated, namely, travel time, the number of transfer stations, and the total number of stations traveled. Automatic Fare Collection (AFC) is used to get the proportion of each route, and mobile phone signaling data is used to obtain the ground truth of passengers' routes proportions for parameter calibration and model validation. The results show that, compared to the ground truth data, the average errors of the proposed i-RRM model, the classic RRM model, and the direct path matching algorithm are 6.03%, 8.96%, and 10.45%, respectively.",Urban metro system,Travel behavior,Route choice model,Regret theory,,Mobile signaling data,,"Liu, Pan",,,,,,,,,,,,,,,,
Row_109,"Zhang, Jin","Guo, Rongrong","Li, Wenquan",,Research on Dynamic Scheduling and Route Optimization Strategy of Flex-Route Transit Considering Travel Choice Preference of Passenger,SYSTEMS,APR 2024,0,"In this paper, to improve the operational service capability and attractiveness of the flex-route transit system, the real dynamic interaction scenario between passenger travel choice preference and system operation scheme in the post-pandemic era is described and quantified. The key technologies, operation mode, system framework, and interactive events required for dynamic interactive scheduling and route planning of flex-route transit are summarized. According to different choice preferences, the corresponding dynamic interaction scheduling strategies and route mixed integer programming model are proposed. An optimization scheme to improve the service capability of the system is introduced and analyzed. The computational results based on real-world cases show that the proposed strategy can better handle the relationship between requirements of transit system operation and requests of passengers without increasing operating costs, significantly improving the service performance of flex-route transit and the choice rate of passengers. We also find that the introduction of optimization schemes and the adjustment of passenger fares constitute a win-win strategy that benefits both passengers and transit operators.",public transit,flex-route transit,travel choice behavior,interaction strategy,,operation scheduling,,,,,,,,,,,,,,,,,,
Row_110,"Wang, Yong","Wei, Zikai","Luo, Siyu","Zhou, Jingxin",Collaboration and resource sharing in the multidepot time-dependent vehicle routing problem with time windows,TRANSPORTATION RESEARCH PART E-LOGISTICS AND TRANSPORTATION REVIEW,DEC 2024,1,"Concerns about energy conservation and emission reduction have highlighted the importance of environmentally sound logistics networks in urban areas. These networks are deeply intertwined with urban traffic systems, where variations in transit speeds can significantly increase the energy consumption and carbon emissions of delivery vehicles, compromising the environmental sustainability of urban deliveries. To address this, we propose a multidepot time-dependent vehicle routing problem with time windows, enhancing route planning flexibility and resource configuration. Our approach begins with a route spatiotemporal decomposition method to estimate vehicle travel times and emissions based on varying vehicle speeds. We then develop a multiobjective mixed integer linear programming model that aims to minimize total operating costs, the number of vehicles, and carbon dioxide emissions. A hybrid heuristic algorithm combining spectral clustering, multiobjective ant colony optimization, and variable neighborhood search is proposed to solve the model. This algorithm incorporates collaboration and resource sharing strategies, a pheromone initialization mechanism, a novel heuristic operator that accounts for time dependency, and a self-adaptive update mechanism, enhancing both solution quality and algorithm convergence. We compare the performance of our algorithm with that of the CPLEX solver, multiobjective ant colony optimization, non-dominated sorting genetic algorithm-III, and multiobjective particle swarm optimization. The results demonstrate the superior convergence, uniformity, and spread of our proposed algorithm. Furthermore, we apply our model and algorithm to a real-world case in Chongqing, China, analyzing optimized results for different time intervals and vehicle speeds. This study offers robust methodologies for theoretically and practically addressing the multidepot time-dependent vehicle routing problem with time windows, contributing to the development of economical, efficient, collaborative, and sustainable urban logistics networks.",Urban logistics networks,Multidepot time-dependent vehicle routing problem,Collaboration and resource sharing,Improved multiobjective ant colony,,optimization with variable neighborhood search,Self-adaptive update mechanism,"Zhen, Lu",Self-adaptive update mechanism,,,,,,,,,,,,,,,
Row_111,"Lee, Geontak","Kim, Soongyu","Seo, Dayeon","Kang, Yeonsik",Inverse Reinforcement Learning with Dynamic Occupancy Grid Map for Urban Local Path Planning: A CNN Model Approach,,2024,0,"In urban environments characterized by various dynamic variables such as moving vehicles, pedestrians, and bicycles, path planning for collision avoidance is essential for autonomous driving. Enhancing the stability of the route can be achieved by incorporating not only information about recognized surrounding objects but also dynamic information during the path planning process. Therefore, this study proposes a convolutional neural network-based local path planning technique for autonomous vehicles in urban environments using a dynamic occupancy grid map (DOGM). This approach ensures precision in path generation by considering the occupancy and speed of various objects. During the learning process, we implemented inverse reinforcement learning by combining trajectory information driven by expert intentions with environmental information obtained from DOGM through a combination of convolution layers. This demonstrates the feasibility of designing stable paths with low collision rates in urban areas. Particularly noteworthy is the superior performance achieved when DOGM is used as input data for deep learning, surpassing conventional algorithms.",,,,,"2024 35TH IEEE INTELLIGENT VEHICLES SYMPOSIUM, IEEE IV 2024",,,,,,,,,,,,,,,,,,,
Row_112,"Fazekas, Zoltan","Obaid, Mohammed","Karim, Lamia","Gaspar, Peter",Urban Traffic Congestion Alleviation Relying on the Vehicles' On-board Traffic Congestion Detection Capabilities,ACTA POLYTECHNICA HUNGARICA,2024,0,"Traffic simulation experiments were carried out for an urban road network to explore the effect of road vehicles' individual traffic congestion avoidance efforts, in which on -board visual line -of -sight (LoS) exteroceptive sensors (ECSs) and related on -board traffic congestion detection (OTCD) capabilities are put to use on the network level traffic situation. OTCD requires a visual LoS constellation between the subject vehicle and some vehicles in the vehicle queue ahead. The experiments concern themselves with the comparison of undisturbed, disturbed and mitigated traffic. PTV Vissim traffic simulator was used in the experiments. The process of congestion detection, avoidance and mitigation was tentatively modelled via proxy parameters. Two series of experiments are reported herein. A new approach to route planning has been identified and earmarked for future research.",traffic simulation,traffic congestion,driver assistance systems,exteroceptive sensors,,route planning,,,,,,,,,,,,,,,,,,
Row_113,"Meng, Zhiyi","Yu, Ke","Qiu, Rui",,Location-routing optimization of UAV collaborative blood delivery vehicle distribution on complex roads,COMPLEX & INTELLIGENT SYSTEMS,AUG 2024,0,"To address the protracted blood transportation time prevalent in contemporary urban settings, we proposed a location-routing optimization problem tailored to the distribution of blood within intricate road networks. This involved a comprehensive assessment that encompassed the judicious selection of sites for both stations and blood centers, coupled with the meticulous planning of delivery routes for unmanned aerial vehicles (UAVs) that orchestrate the transportation of blood. First, a model was formulated to minimize the overall cost, including transportation expenses, costs associated with the site, and other relevant costs related to blood transportation vehicles coordinated by UAVs. Subsequently, a two-stage hybrid heuristic algorithm was designed based on the distinctive characteristics of the problem at hand. Moreover, an enhanced k-means algorithm was employed to generate clustering schemes, utilizing the centroid method to address the challenge of location selection for delivery sites effectively. A genetic algorithm enhanced with adaptive operators was employed to address the challenging large-scale NP-hard problem associated with route planning in intricate urban road networks. The results indicated that, compared to the traditional blood delivery model using vehicles, the total blood transportation cost decreased by 12.65% and the overall delivery time was reduced by 37.5% with the adoption of drone-assisted delivery; ultimately, case and sensitivity analyses were conducted to investigate the impact of variables including the number of blood transportation vehicles, UAVs, driver wages, and unit costs of blood transportation vehicles on the location-routing problem.",Intricate networks,Two-stage hybrid heuristic algorithm,Location of distribution site,Vehicle-UAV routing,,,,,,,,,,,,,,,,,,,,
Row_114,"Kocaaslan, Hatice","Pouya, Sima","Sonmez, Sahar",,Finding the optimal route for people with mobility impairments: A case study of the Inonu University campus,URBANI IZZIV-URBAN CHALLENGE,JUN 2024,0,"Students with mobility impairments have the right to move independently throughout university campuses. This study presents a model to evaluate routes based on accessibility criteria to determine the most suitable paths for disabled individuals navigating a university. First, the main factors of accessible mobility were determined and rated by students with physical disabilities. Within this context, this study used the analytical hierarchy process (AHP) to weight criteria and route alternatives. Inonu University was selected for quantifying the path network of its campus by physically handicapped students. Three main campus routes were evaluated to find the most ac Students with mobility impairments have the right to move independently throughout university campuses. This study presents a model to evaluate routes based on accessibility criteria to determine the most suitable paths for disabled individuals navigating a university. First, the main factors of accessible mobility were determined and rated by students with physical disabilities. Within this context, this study used the analytical hierarchy process (AHP) to weight criteria and route alternatives. Inonu University was selected for quantifying the path network of its campus by physically handicapped students. Three main campus routes were evaluated to find the most ac cessible route for students. Based on the results, among ten key factors, ramp slope and paving are the most important. Furthermore, on-site analyses demonstrated the accuracy of the AHP method for this research. Contributions of the study include a model for determining the optimal route with the fewest physical obstacles to facilitate disabled individuals' daily movement.",university campuses,urban design,analytical hierarchy process (AHP),mobility impairment,,naviga- tion,Turkey,,,,,,,,,,,,,,,,,
Row_115,"Li, Weilian","Haunert, Jan-Henrik","Forsch, Axel","Zhu, Jun",Informed sampling and recommendation of cycling routes: leveraging crowd-sourced trajectories with weighted-latent Dirichlet allocation,INTERNATIONAL JOURNAL OF GEOGRAPHICAL INFORMATION SCIENCE,DEC 1 2024,0,"Attractive cycling routes can effectively promote active mobility, thus reducing the twin pressures of the population boom and the greenhouse effect. However, the existing approaches for cycling route recommendation primarily concentrate on identifying the most efficient routes while ignoring the urban spatial context, which is essential to meet the user's particular preferences. This article proposes a novel method for informed sampling and recommending cycling routes leveraging crowd-sourced trajectories with weighted-latent Dirichlet allocation (WLDA). Precisely, spatial context mapping, incorporating a weighting mechanism into LDA, latent topics mining, and cycling route recommendation based on informed sampling are introduced. We collected 1,016 cycling trajectories around Cologne, Germany, for experimental analysis. The experimental results show that the three latent topics within the trajectories, leisure, city, and green tours, are clearly presented in the line density analysis. The insightful recommendation for unfamiliar cyclists could also be actively sampled upon the WLDA model. These findings suggest that our approach could shift the route recommendation paradigm from GIS analysis to a semantic mining perspective, yielding highly interpretable results and offering novel research avenues for applying machine learning in route planning.",Cycling route recommendation,weighted-latent Dirichlet allocation,crowd-sourced trajectories,spatial context mapping,,natural language processing,,"Zhu, Qing",,"Dehbi, Youness",,,,,,,,,,,,,,
Row_116,"Iamtrakul, Pawinee","Padon, Apinya","Chayphong, Sararad","Hayashi, Yoshitsugu","Unlocking Urban Accessibility: Proximity Analysis in Bangkok, Thailand's Mega City",SUSTAINABILITY,APR 2024,1,"Accessibility serves as the fundamental link for mode shifts, enabling access to activity areas and facilitating connections to other forms of travel. However, navigating the transportation network in urban areas of Bangkok, Thailand, reveals persistent inconveniences, discomfort, and safety concerns, thereby failing to adequately meet the needs of users. This study aims to examine urban accessibility, focusing on multi-travel connections to amenities and public transport. It focuses on understanding how the level of engagement of road users in social activities contributes to well-being by addressing proximity access through a multidisciplinary approach aimed at enhancing accessibility and integrating the built environment. The comprehensive and inclusive Accessibility by Proximity Index (API) is proposed as a tool to evaluate the level of access to essential services and activities for residents. Additionally, this study acknowledges the impact of the physical and utilization characteristics of urban space and active trajectories by considering various travel needs and daily route patterns. Consequently, the API can inform the development of planning and urban design strategies aimed at enhancing walkability and cycling as non-motorization infrastructures, thereby improving accessibility through active modes of transportation. It was observed that areas with a higher concentration of urban amenities exhibit greater accessibility by walking, cycling, and public transport, particularly in inner-city areas. Thus, envisioning a more sustainable and inclusive city with adequate development of public transportation access is essential in urban areas, prompting policy-level initiatives to enhance the environment and elevate the overall commuting experience.",non-motorization,physical activity,urban vibrancy,vulnerable road users,,walking and cycling,,,,,,,,,,,,,,,,,,
Row_117,"Govea, Jaime","Gaibor-Naranjo, Walter","Sanchez-Viteri, Santiago","Villegas-Ch, William",Integration of Data and Predictive Models for the Evaluation of Air Quality and Noise in Urban Environments,SENSORS,JAN 2024,2,"This work addresses assessing air quality and noise in urban environments by integrating predictive models and Internet of Things technologies. For this, a model generated heat maps for PM2.5 and noise levels, incorporating traffic data from open sources for precise contextualization. This approach reveals significant correlations between high pollutant/noise concentrations and their proximity to industrial zones and traffic routes. The predictive models, including convolutional neural networks and decision trees, demonstrated high accuracy in predicting pollution and noise levels, with correlation values such as R2 of 0.93 for PM2.5 and 0.90 for noise. These findings highlight the need to address environmental issues in urban planning comprehensively. Furthermore, the study suggests policies based on the quantitative results, such as implementing low-emission zones and promoting green spaces, to improve urban environmental management. This analysis offers a significant contribution to scientific understanding and practical applicability in the planning and management of urban environments, emphasizing the relevance of an integrated and data-driven approach to inform effective policy decisions in urban environmental management.",air quality,urban noise,urban planification,,,,,,,,,,,,,,,,,,,,,
Row_118,"Mandzuka, Bia","Vidovic, Kresimir","Skorput, Pero",,Barriers to Smart Mobility Implementation in Urban Context,,2024,0,"This paper thoroughly explores and identifies the existing barriers and challenges of smart (urban) mobility (especially multimodal mobility), including issues such as the integration of diverse travel modes, technological barriers (data openness problems), the user (passenger) experience related to informational support systems in planning multimodal journeys (Multimodal Journey Planners - MJPs) and critical segments of multimodal routes (e.g., transitioning to other modes of travel). Finally, the paper presents recommendations for ongoing research and development in smart urban mobility, tailored to the evolving needs and affinities of today's travellers.",smart urban mobility,multimodal mobility,barriers,user experience,"NEW TECHNOLOGIES, DEVELOPMENT AND APPLICATION VII, VOL 2, NT-2024",sustainability,,,,,,,,,,,,,,,,,,
Row_119,"Zhao, Bingyu","Soga, Kenichi","Iwama, Masahiko",,"Spatial system perspective of understanding ""fuel-sensitive routes""using regional-scale case studies",TRANSPORTATION RESEARCH PART D-TRANSPORT AND ENVIRONMENT,JUN 2024,0,"Eco-routing is widely researched as a promising way to reduce traffic -related environmental externalities. Past studies indicate that fuel -sensitive eco-routing trades the fastest routes with shorter, slower urban roads to take advantage of the ""optimal fuel economy"". However, past studies focusing on individual routes often fail to depict the spatial redistribution of traffic being closer to the residential areas when eco-routing is adopted at a large scale. This research conducts city -scale fuel -sensitive routing simulations for two large metropolitan areas: the San Francisco Bay Area case and the Tokyo Area case. Combining agent -based simulations with datadriven fuel model, it is revealed that fuel -sensitive routing exerts heavier traffic on the local streets and increases residents' direct exposure to traffic. Furthermore, by comparing different sub -areas, the varied degrees of traffic redistribution are found to be mainly dependent on the availability of major roads as alternative routes, and existing traffic congestion levels in an area.",Eco-routing,City-scale traffic simulations,Semi-dynamic traffic assignment,Spatial inequality,,,,,,,,,,,,,,,,,,,,
