,author1,author2,author3,author4,title,journal/book,publish time,citation,abstract,keyword1,keyword2,keyword3,keyword4,conference,keyword5,keyword6,author5,keyword7,author6,keyword8,keyword9,keyword10,keyword11,keyword12,keyword13,keyword14,keyword15,keyword16,keyword17,author7,author8,author9,author10
Row_52,"Fei, Chen","Lu, Zhuo","Jiang, Weiwei",,Heuristic Optimization-Based Trajectory Planning for UAV Swarms in Urban Target Strike Operations,DRONES,DEC 2024,0,"Unmanned aerial vehicle (UAV) swarms have shown substantial potential to enhance operational efficiency and reduce strike costs, presenting extensive applications in modern urban warfare. However, achieving effective strike performance in complex urban environments remains challenging, particularly when considering three-dimensional obstacles and threat zones simultaneously, which can significantly degrade strike effectiveness. To address this challenge, this paper proposes a target strike strategy using the Electric Eel Foraging Optimization (EEFO) algorithm, a heuristic optimization method designed to ensure precise strikes in complex environments. The problem is formulated with specific constraints, modeling each UAV as an electric eel with random initial positions and velocities. This algorithm simulates the interaction, resting, hunting, and migrating behaviors of electric eels during their foraging process. During the interaction phase, UAVs engage in global exploration through communication and environmental sensing. The resting phase allows UAVs to temporarily hold their positions, preventing premature convergence to local optima. In the hunting phase, the swarm identifies and pursues optimal paths, while in the migration phase the UAVs transition to target areas, avoiding threats and obstacles while seeking safer routes. The algorithm enhances overall optimization capabilities by sharing information among surrounding individuals and promoting group cooperation, effectively planning flight paths and avoiding obstacles for precise strikes. The MATLAB(R2024b) simulation platform is used to compare the performance of five optimization algorithms-SO, SCA, WOA, MFO, and HHO-against the proposed Electric Eel Foraging Optimization (EEFO) algorithm for UAV swarm target strike missions. The experimental results demonstrate that in a sparse undefended environment, EEFO outperforms the other algorithms in terms of trajectory planning efficiency, stability, and minimal trajectory costs while also exhibiting faster convergence rates. In densely defended environments, EEFO not only achieves the optimal target strike trajectory but also shows superior performance in terms of convergence trends and trajectory cost reduction, along with the highest mission completion rate. These results highlight the effectiveness of EEFO in both sparse and complex defended scenarios, making it a promising approach for UAV swarm operations in dynamic urban environments.",urban environment,UAV swarms,target strike,trajectory planning,,electric eel foraging optimization,,,,,,,,,,,,,,,,,,
Row_53,"Sridhar, Madhavan","Partheeban, Pachaivannan","Kamalakannan, Jothi Prakash","Baskaran, Anuradha",Risk analysis of route choices for construction and demolition waste disposal planning using geospatial technology,ENVIRONMENTAL MONITORING AND ASSESSMENT,DEC 6 2024,0,"Construction and demolition waste (C&DW) is increasing at an alarming rate globally. It is estimated that worldwide, C&DW occupies over 17,420,000 km2 of land with an average depth of around 15.25 m, amounting to an astonishing 2.7 billion cubic meters of landfill space. The annual generation of C&D debris in India is up to 150 million tons. This study examines the use of geospatial technology to effectively manage C&DW disposal in the legal dumping yards of Chennai. Data were collected on C&DW in Chennai, which has 15 legal dumping sites and two recycling units in Perungudi and Kodungaiyur. Geospatial technology was applied to analyze optimal route planning, considering sources, and C&DW disposal locations, with two scenarios: the stationary container system and the hauled container system. The results suggest that the hauled container system is Chennai's most suitable debris collection method, providing an optimal route with reduced environmental pollution. These findings are helpful for urban planners and environmental engineers, assisting in transforming old urban areas into new smart cities through effective planning and design.",Construction and demolition waste,Geospatial technology,Optimal route,Recycling facilities,,Dumping yards,Collection systems,,,,,,,,,,,,,,,,,
Row_54,"Tang, Hongxia","Li, Ya","Li, Mengdi","Shao, Zhiguo","Accessibility and Equity Analysis of Highway-Railway Traffic Network Based on Real-Time Route Planning Data: A Case Study of Shandong Peninsula Urban Agglomeration, China",TRANSPORTATION RESEARCH RECORD,NOV 2024,0,"As a bond of geospatial and socioeconomic ties, transport supports the development of regions. With the rapid development of the economy, the coordinated development of regional transport has become a concern. To narrow the gap in transport development between cities and achieve sustainable development in regional transport, this study took the Shandong Peninsula urban agglomeration as the research object and using real-time path planning data assessed accessibility of the traffic network under two travel scenarios: cars and car-connected train. Based on the results of accessibility calculations, the Gini coefficient and Theil index were used to measure the equity of regional traffic networks. The results showed that (1) overall accessibility under the two travel scenarios showed a pattern of gradual decay from the center to the periphery; (2) both the accessibility and equity of the highway network were better than those of the railway network; (3) differences in regional development were the main sources of overall regional transport inequity. The research results provide a useful reference for the planning and construction of urban agglomeration traffic networks.",planning and analysis,route choice modeling,sustainability and resilience,transportation and society,,equity in transportation,accessibility,,transportation equity,,,,,,,,,,,,,,,
Row_55,"Jiru, Jiang","Long, Zhang",,,Citywalk in China: analysis of regional and route characteristics,JOURNAL OF ASIAN ARCHITECTURE AND BUILDING ENGINEERING,AUG 2024,0,"The West introduced Citywalk to China; since then, the concept has undergone a significant transformation from mere walking or hiking activities, impacting people's choices in transportation and urban spatial experiences. However, the defining characteristics of Citywalk remain unclear. To address this gap, this study considers representative cities in China as examples and employs a comprehensive approach including website information retrieval, SPSS software, and word frequency analysis to collect and analyze data on 611 Citywalk routes in 48 cities. The study objective is to examine the regional characteristics of Citywalk routes and elucidate the factors that shape Citywalk characteristics. Descriptive statistics are used to describe the regional characteristics of Citywalk routes, and three indicators - urban attributes, route features, and node types - are identified. Subsequently, correlation analysis is applied within and between groups. The results indicate a significant correlation among urban attributes, route features, and certain node types with high reliability. This study provides bottom-up data support for the design of linear spatial experiences in Chinese cities and the improvement of tourist route planning, thus offering valuable references for future endeavors in this field.",Citywalk,regional characteristics,tourism planning,China,,,,,,,,,,,,,,,,,,,,
Row_56,"Mercade-Aloy, Josep","Cervera-Alonso-de-Medina, Marina",,,Enhancing Access to Urban Hill Parks: The Montjuc Trail Masterplan and the 360 Route Design in Barcelona,LAND,JAN 2024,0,"The 2030 United Nations Sustainable Development Goals (SDGs) include ensuring universal and safe access to green spaces. Some cities feature extensive green areas on hills or elevated terrains integrated into the urban landscape. In such cases where the benefits for users are highly pronounced (e.g., views, isolation, etc.), it is challenging and particularly complex to design strategies to ensure accessible and spatial routes due to multiple slopes and a challenging topography. In Barcelona, the iconic Montjuic mountain has been the focal point of a trail masterplan aimed at rethinking its various access points and internal network of routes. Furthermore, the city has committed to implementing an initial project from this plan, the so-called 360 degrees route. This study presents an in-depth analysis of the Montjuic mountain case, encompassing both the plan and the 360 degrees project in hilly urban parks. The analysis reveals the values and transferability of the set of strategies proposed in the plan, such as activating inherent location characteristics by connecting the surrounding urban fabric with elements of recreational potential within the underlying traces of heritage value. Additionally, a quantitative assessment of the impact of the proposed accesses on the population is presented. The study highlights the improvements in quality of life for the diverse users of this type of green infrastructure.",urban park,trail masterplan,green infrastructure,accessible green spaces,,Montjuic hill,Barcelona,,,,,,,,,,,,,,,,,
Row_57,"Zhang, Hongyu","Huang, Zhuoxuan","Jiang, Zixu","Ma, Hua",Collaborative Route Planning of Road Trips in Regional Central Cities of China: An Approach Based on E-CARGO Model,IEEE TRANSACTIONS ON COMPUTATIONAL SOCIAL SYSTEMS,OCT 2024,1,"Recently, the road trip in regional central cities has become one of the mainstream travel styles for Chinese tourists. However, existing research fails to plan the road trip route in Chinese regional central cities due to its flexibility, complexity, and long-term characteristic. A collaborative route planning approach for road trips, namely CoRPoRT, is proposed. This approach decomposes the route planning of a road trip into two role-based collaboration subproblems to alleviate the complexity issue. Then, the environments-classes, agents, roles, groups, and objects (E-CARGO) model is innovatively employed to formalize the problems and guide the optimization process for dealing with the long-term characteristic of road trips. Moreover, we identify the complex constraints affecting point of interest selections and propose an efficient solution via the IBM CPLEX solver to handle the flexibility of road trips. Finally, a case study and simulation experiments verify the effectiveness of CoRPoRT. CoRPoRT presents a general problem modeling method and a novel research paradigm for the route planning of road trips.",Collaborative optimization,environments-classes,agents,roles,,groups,and objects (E-CARGO) model,"Zhu, Haibin",regional central city,,road trip,route planning,,,,,,,,,,,,
Row_58,"Zhang, Hongyu","Huang, Zhuoxuan","Jiang, Zixu","Ma, Hua",Collaborative Route Planning of Road Trips in Regional Central Cities of China: An Approach Based on E-CARGO Model,IEEE TRANSACTIONS ON COMPUTATIONAL SOCIAL SYSTEMS,OCT 2024,1,"Recently, the road trip in regional central cities has become one of the mainstream travel styles for Chinese tourists. However, existing research fails to plan the road trip route in Chinese regional central cities due to its flexibility, complexity, and long-term characteristic. A collaborative route planning approach for road trips, namely CoRPoRT, is proposed. This approach decomposes the route planning of a road trip into two role-based collaboration subproblems to alleviate the complexity issue. Then, the environments-classes, agents, roles, groups, and objects (E-CARGO) model is innovatively employed to formalize the problems and guide the optimization process for dealing with the long-term characteristic of road trips. Moreover, we identify the complex constraints affecting point of interest selections and propose an efficient solution via the IBM CPLEX solver to handle the flexibility of road trips. Finally, a case study and simulation experiments verify the effectiveness of CoRPoRT. CoRPoRT presents a general problem modeling method and a novel research paradigm for the route planning of road trips.",Collaborative optimization,environments-classes,agents,roles,,groups,and objects (E-CARGO) model,"Zhu, Haibin",regional central city,,road trip,route planning,,,,,,,,,,,,
Row_59,"Montenegro, Alexandra L.","Rey-Gozalo, Guillermo","Arenas, Jorge P.","Suarez, Enrique",Streets classification models by urban features for road traffic noise estimation,SCIENCE OF THE TOTAL ENVIRONMENT,JUL 1 2024,1,"Road traffic is the primary source of environmental noise pollution in cities. This problem is also spreading due to inadequate urban expansion planning. Hence, integrating road traffic noise analysis into urban planning is necessary for reducing city noise in an effective, adaptable, and sustainable way. This study aims to develop a methodology that applies to any city for the stratification of urban roads by their functionality through only their urban features. It is intended to be a tool to cluster similar streets and, consequently, traffic noise to enable urban and transportation planners to support the reduction of people's noise exposure. Three multivariate ordered logistic regression statistical models (Model 1, 2, and 3) are presented that significantly stratify urban roads into five, four, and three categories, respectively. The developed models exhibit a McFadden pseudo-R-2 between 0.5 and 0.6 (equivalent to R-2 >0.8). The choice between Model 1 or 2 depends on the scale of the city. Model 1 is recommended for developed cities with an extensive road network, while Model 2 is most suitable in intermediate and growing cities. On the other hand, Model 3 could be applied at any city scale but focused on local management of transit routes and for designing acoustic sensor installations, urban soundwalks, and identification of quiet areas. Urban features related to road width and length, presence of transport infrastructure, and public transport routes are associated with increased traffic noise in all three models. These models prove useful for future action plans aimed at reducing noise through strategic urban planning.",Road traffic noise,Urban sound environment,Sustainable urban planning,Multinomial ordered logistic regression,,,,,,,,,,,,,,,,,,,,
Row_60,"Foshag, Kathrin","Rupp, Saskia","Burst, Patrick","Betsch, Marco",HOW TO ASSESS THE NEEDS OF VULNERABLE POPULATION GROUPS TOWARDS HEAT-SENSITIVE ROUTING? AN EVIDENCE-BASED AND PRACTICAL APPROACH TO REDUCING URBAN HEAT STRESS,ERDKUNDE,JAN-MAR 2024,0,"Heat poses a significant risk to human health, particularly for vulnerable populations, such as pregnant women, older individuals, young children and people with pre-existing medical conditions. In view of this, we formulated a heat stress-avoidant routing approach in Heidelberg, Germany, to ensure mobility and support day-to-day activities in urban areas during heat events. Although the primary focus is on pedestrians, it is also applicable to cyclists. To obtain a nuanced understanding of the needs and demands of the wider population, especially vulnerable groups, and to address the challenge of reducing urban heat stress, we used an inter- and transdisciplinary approach. The needs of vulnerable groups, the public, and the city administration were identified through participatory methods and various tools, including interactive city walks. Solution approaches and adaptation measures to prevent heat stress were evaluated and integrated into the development of a heat-avoiding route service through a co-design process. The findings comprise the identification of perceived hotspots for heat (such as large public spaces in the city centre with low shading levels), the determination of commonly reported symptoms resulting from severe heat (e.g., fatigue or lack of concentration), and the assessment of heat adaptation measures that were rated positively, including remaining in the shade and delaying errands. Additionally, we analysed and distinguished between individual and community adaptation strategies. Overall, many respondents did not accurately perceive the risk of heat stress in hot weather, despite severe limitations. As a result, the heat-sensitive routing service (available in prototype form during publication) that has been created serves as a readily available and accessible source of assistance to combat the effects of heat stress in individuals' daily lives during periods of intense heat. The findings served as input for the calibration of heat stress-avoidant routing and supported the development of local heat protection plans without investing in large-scale adaptation of the built environment. It is crucial to involve the population, particularly vulnerable groups, in the development of the tool to ensure it meets their needs. This study employed a transdisciplinary multi-method approach, which considers practical framework conditions by involving the city administration.",Climatic change,urban climate,urban planning,GIS,,applied geography,Baden-Wuerttemberg,"Fuerle, Johannes",,"Ludwig, Christina",,,,,,,,,,,"Fallmann, Joachim","Lautenbach, Sven","Zipf, Alexander","Aeschbach, Nicole"
Row_61,"Zhuo, Siyu","Zhu, Xiaoning","Shang, Pan","Liu, Zhengke",Behavior-Adaptive Sync-Flow Framework: Integrating frequency setting and passenger routing in oversaturated urban rail transit networks,TRANSPORTATION RESEARCH PART E-LOGISTICS AND TRANSPORTATION REVIEW,SEP 2024,1,"Urban rail transit (URT) networks serve a large amount of travel demand in metropolitan areas. One of the fundamental challenges in URT demand management is the dynamic interaction between train frequencies and passenger routing behaviors, which becomes even more complicated in oversaturated scenarios. Introducing the behavior-adaptive sync-flow (BASF) framework, this study holistically addresses the tactical frequency settings (train flows) for URT networks and the responsive route choice behaviors of passengers (passenger flows). The proposed integrated model incorporates a schedule-based passenger assignment within space - time networks to model passengers ' routing behaviors based on time-dependent route travel costs. In addition to travel time, the often-overlooked factors such as in-train congestion, number of passengers being left behind, and number of transfers are considered as components influencing travel costs and, consequently, routing behaviors at an individual level. A gradient descent-based heuristic iterative solution approach is developed to address the integrated model by dividing it into three subproblems. In this iterative process, passengers respond according to a logit-based route choice model based on time-dependent route travel costs, while frequencies are updated using a gradient descent-based strategy. Central to the proposed BASF framework are the mutual adaptations between URT line frequencies and passenger route choices. Numerical examples and a case study of the Beijing URT network highlight the effectiveness and scalability of the model framework in tackling complex, large-scale URT networks, particularly in oversaturated conditions, thus revealing the significance of supply - demand matching.",Oversaturated urban rail transit network,Behavior-adaptive sync-flow,Gradient descent-based heuristic iterative,approach,,Time-dependent route travel costs,Left behind passengers,"Yao, Yu",,"Liao, Feixiong",,,,,,,,,,,,,,
Row_62,"Radford, Stella","Davidson, Kathryn",,,The Spatial Geographies of Women Urban Runners,URBAN POLICY AND RESEARCH,OCT 2024,0,"Taking the northern suburbs of Melbourne, Australia, as a case study, we researched the running experiences of women through a feminist geography lens. Interviews with runners informed the design and interpretation of a spatial analysis of women's running patterns in Strava Metro data. Our study showed how women runners are limited in where they run, and illuminated features of urban environments that can contribute to gendered limitations running women experience. Our approach took us beyond critiques of park management (e.g. lighting, toilets, trail surface), to eventually form findings about how urban form influences the spatial geographies of women runners. HIGHLIGHTSWomen restrict where they run alone more than men do because of fear of being attacked by a man, avoiding isolated places in particular.Running is an activity in which women can feel at their most vulnerable in urban public space, as they are often alone, outside beyond daylight hours, and are seeking soft surfaced paths away from motor traffic, places where real-life passive surveillance is usually lower.Gendered differences in the use of urban space by runners can be observed in Strava Metro data.A key feature of women's running route decision-making is that women will avoid and seek certain places based on how many other people they expect to be present there.Women runners benefit from urban forms which encourage high pedestrian activity, including medium-high urban density and pedestrian prioritised links to greenspaces that are separated from key traffic routes.",Women runners,running,feminist geography,Strava,,urban planning,,,,,,,,,,,,,,,,,,
Row_63,"Zhou, Qiang","Feng, Houze","Liu, Yueyang",,Multigene and Improved Anti-Collision RRT* Algorithms for Unmanned Aerial Vehicle Task Allocation and Route Planning in an Urban Air Mobility Scenario,BIOMIMETICS,MAR 2024,1,"Compared to terrestrial transportation systems, the expansion of urban traffic into airspace can not only mitigate traffic congestion, but also foster establish eco-friendly transportation networks. Additionally, unmanned aerial vehicle (UAV) task allocation and trajectory planning are essential research topics for an Urban Air Mobility (UAM) scenario. However, heterogeneous tasks, temporary flight restriction zones, physical buildings, and environment prerequisites put forward challenges for the research. In this paper, multigene and improved anti-collision RRT* (IAC-RRT*) algorithms are proposed to address the challenge of task allocation and path planning problems in UAM scenarios by tailoring the chance of crossover and mutation. It is proved that multigene and IAC-RRT* algorithms can effectively minimize energy consumption and tasks' completion duration of UAVs. Simulation results demonstrate that the strategy of this work surpasses traditional optimization algorithms, i.e., RRT algorithm and gene algorithm, in terms of numerical stability and convergence speed.",UAVs,UAM scenario,task allocation,path planning,,multigene algorithm,RRT* algorithm,,,,,,,,,,,,,,,,,
Row_64,"Sengupta, Debjyoti","Satpathy, Anurag","Das, Sajal K.",,POSCA: Path Optimization for Solar Cover Amelioration in Urban Air Mobility,"EXPERIMENTAL ALGORITHMS, SEA 2014",2024,0,"Urban Air Mobility (UAM) encompasses both piloted and autonomous aerial vehicles, spanning from small unmanned aerial vehicles (UAVs) like drones 10 passenger-carrying personal air vehicles (PAVs), to revolutionize smart transportation in congested urban areas. This emerging paradigm is anticipated to offer disruptive solutions to the mobility challenges in congested cities. In this context, a pivotal concern centers on the sustainability of transitioning to this mode of transportation, especially with the focus on incorporating clean technology into developing innovative solutions from the ground up. Recent studies highlight that a significant portion of the total energy consumption in UAM can be attributed to the Right operations of the aircraft. To address this challenge, Ibis paper introduces a framework POSCA aimed at meeting the energy requirements of UAM flights. It delves into a complex and dynamic route-planning problem. It introduces a novel concept called the Phototropic Index, calculated by considering the traversal distance and solar coverage along the route. To solve the path planning problem, we propose two solutions, S-POSCA and D-POSCA, catering to static and dynamic setups. Simulation results confirm an average increase of 8.81% in static conditions and 10.64% in the dynamic condition for the cumulative Global Horizontal Irradiance (GHI) compared to the baseline approaches.",Urban air mobility,vertical lake-off and landing vehicles,dynamic route-planning,path optimization,,solar energy,,,,,,,,,,,,,,,,,,
Row_65,"Pensado, Enrique Aldao","Carrera, Gabriel Fontenla","Lopez, Fernando Veiga","Jorge, Higinio Gonzalez",Turbulence-aware UAV path planning in urban environments,TRANSPORTATION RESEARCH PART C-EMERGING TECHNOLOGIES,2024,1,"Wind turbulence is a critical factor for the safety of Urban Air Mobility operations. In urban environments, buildings and structures can generate irregular wind currents that may compromise the stability of aircraft. This poses a high risk due to the potential severity of an accident in these areas. For these reasons, this paper introduces a risk-aware path planning solution for Urban Air Mobility applications, including Computational Fluid Dynamics (CFD) simulations that predict atmospheric wind at urban environments. The generated algorithm provides safe and efficient routes, avoiding flight through regions with significant turbulence. A practical case study was conducted to demonstrate the strong capabilities of the proposed solution.",,,,,,,,"Ortega, Elena Martin",,,,,,,,,,,,,,,,
