,author1,author2,author3,author4,title,journal/book,publish time,citation,abstract,keyword1,keyword2,keyword3,keyword4,conference,keyword5,keyword6,author5,keyword7,author6,keyword8,keyword9,keyword10,keyword11,keyword12,keyword13,keyword14,keyword15,keyword16,keyword17,author7,author8,author9,author10
Row_172,"Alvarez-Ripado, Ariadna","Bruzon, Adrian G.","Alvarez-Garcia, David","Arrogante-Funes, Patricia",Assessing urban ecosystem condition account with object-based methods,ECOLOGICAL INDICATORS,NOV 2024,0,"We present a methodology based on the System of Environmental-Economic Accounting-Ecosystems Accounting (SEEA-EA) framework to measure urban ecosystem condition accounts. This methodology allows the condition accounts of urban ecosystems to be spatially and explicitly evaluated at a detailed scale. The reference area is determined using object-based evaluation, where the reference value for each variable is set in a real geographic context rather than individual pixels. This methodology consists of the following steps: 1. Delimitation of the urban categories to be evaluated; 2. Selection of the variables that characterize the abiotic and biotic environment; 3. Establishment of the reference polygon with which to compare the condition values; 4. Calculation of weighted condition indicators; 5. Generation of a single condition index from the aggregation of the indicators. In Madrid, the areas with the highest condition levels are characterised by a significant density of trees and bird species richness. In contrast, areas with the lowest condition levels are defined by high contamination, impervious surfaces, built-up areas and major communication routes. This innovative approach to calculating urban conditions represents an advancement in local-scale urban condition accounting and offers a potentially compatible tool with current urban policy frameworks. Its applications can be various, from identifying urban problems to reviewing the effectiveness of a plan already implemented. Several advantages have been identified over other ecosystem accounting metrics. These advantages include lower operating costs, a more integrative vision, adaptability to different spatial scales, flexibility in modifying its structure, the capacity to incorporate complex urban dynamics, reduced dependence on human judgment and easier interpretation of results.",Urban ecosystem accounting,Natural capital,Condition account,SEEA-EA,,Madrid,,,,,,,,,,,,,,,,,,
Row_173,"Zysk, Elzbieta","Zalewska, Katarzyna",,,The Methodology for Assessing the 15 Minute Age-Friendly Walkability (AFW) of Urban Public Spaces,SUSTAINABILITY,AUG 2024,1,"Recent decades have witnessed noticeable demographic changes around the world. The global population has continued to increase steadily and, according to forecasts, the trend will be maintained in the coming decades. An increase in the 60+ population is yet another important demographic change. These determinants pose new challenges for socio-economic, spatial, and transport policies in most, if not all, cities in the world. These policies should be aligned with the global development paradigm to promote sustainable development and sustainable improvement of the quality of life of the present and future generations. In the coming years, the potential of cities should be recognized, resources should be managed rationally, effective spatial policies should be implemented, and user-friendly spaces should be created to promote the development of effectively managed urban areas. Cities are often compared to living organisms, which is why social mobility is a crucial determinant of urban development and is often used in assessments of cities. To address the above needs, a universal and innovative methodology for assessing the age-friendly walkability (AFW) of urban public spaces was developed and tested in the present study. The methodology was developed based on a review of the current trends in age-friendly cities, a survey of the target population, and a self-designed concept for evaluating the walkability of pedestrian routes in public space. The proposed methodology not only contributes to the existing knowledge but also has practical implications because it was tested in a Polish city to classify the 15 minute walkability of pedestrian routes and to identify Strategic Intervention Areas for the 60+ population (SAI 60+). This innovative approach to walkable urban public spaces is a simple tool for developing senior-friendly planning solutions in cities. The developed paper constitutes a basis for precise spatial planning it is based on reliable data by conducting a full and comprehensive spatial inventory of mobility trajectories of older people walkability. The aim of the undertaken research was to improve the quality of urban residents' lives in the context of Sustainable Development Goal 11 (to make cities and human settlements safe, stable, and sustainable). Above all, the study is congruous with the sustainable urban mobility vision.",urban public spaces,age-friendly walkability,age-friendly city,15 minute city,,older people,Strategic Intervention Areas for the 60+population,,,,,,,,,,,,,,,,,
Row_174,"Illes, Juraj","Kristianova, Katarina","Joklova, Viera","Shayegani, Aida",Potential of Former Mill Race Corridors for Urban Regeneration Strategies-A Case Study from Podolnec in Preov Region (Slovakia),LAND,JUL 2024,0,"In the past, mill races were part of the urban structure of many towns in Slovakia. As regulated and artificially created waterways, they served to drive mills, rollers, or hammers. With the use of new sources of energy, they lost their functions, and most of them were dried, filled, or buried underground. In our research, we examine the former mill race corridor in Podol & iacute;nec (Pre & scaron;ov region, Slovakia) and its potential to contribute to urban regeneration strategies. The research steps included the following, namely 1. Identification of the route of the mill race corridor according to historical sources, 2. survey of its current state and its spatial preservation in the urban structure, 3. evaluation of the possibilities of its new uses, which could increase the quality and attractiveness of urban public spaces. The research results show that the fragments of the corridor of the extinct mill race are still identifiable in the urban fabric, and in the cadaster, they are in public ownership and suitable for new uses. The fragments of the corridor of the extinct mill race in Podol & iacute;nec represent a potential for strengthening the blue and green infrastructure, pedestrian and cycling greenways, and a potential for the presentation of cultural heritage values, which could contribute to the improvement of the qualities of the urban environment.",mill race,blue and green infrastructure,greenways,cultural heritage,,urban regeneration strategies,urban streams,,,,,,,,,,,,,,,,,
Row_175,"Hamzei, Ehsan","De Cock, Laure","Tomko, Martin","van de Weghe, Nico",Indoor view graph: A model to capture route and configurational information,ENVIRONMENT AND PLANNING B-URBAN ANALYTICS AND CITY SCIENCE,NOV 2024,1,"This paper presents a graph model that simultaneously stores route and configurational information about indoor spaces. Existing indoor information models either capture route information to compute shortest paths and to generate route descriptions (i.e., answering how-to-get-to questions), or they store configurational information about objects and places and their spatial relationships to enable spatial querying and inference (i.e., answering where-questions). Consequently, multiple representations of an indoor environment must be stored in information systems to address the various information needs of their users. In this paper, we propose a graph that can capture both configurational and route information in a unified manner. The graph is the dual representation of connected lines of sight, or views. Views can represent continuous movement in an indoor environment, and at the same time, the visible configurational information of each view can be explicitly captured. In this paper, we discuss the conceptual design of the model and an automatic approach to derive the view graph from floorplans. Finally, we demonstrate the capabilities of our model in performing different tasks such as calculating shortest paths, generating route descriptions, and deriving place graphs.",Indoor model,visibility-based graph model,route graph,place graph,,,,"Winter, Stephan",,,,,,,,,,,,,,,,
Row_176,"Lungu, Mihai Adrian",,,,Smart Urban Mobility: The Role of AI in Alleviating Traffic Congestion,,JUN 1 2024,0,"This article delves into the impact of intelligence (AI), on easing traffic congestion as cities strive to become more intelligent. It highlights advancements in AI technologies like networks (ANNs) and genetic algorithms (GAs), within the context of urban transportation and movement. The incorporation of intelligence, into transportation systems is motivated by the necessity to adapt to evolving circumstances while emphasizing improvements, in the effectiveness and environmental friendliness of transportation networks. Mobility as a Service (MaaS) combines options like transit, ride-sharing and bike rentals. Through the use of networks AI enhances urban traffic management by predicting congestion and optimizing traffic signal control at intersections. Genetic algorithms play a role, in optimizing vehicle routes by taking into account variables such as travel time and associated expenses. The research indicates a rise in the use of AI in the transportation industry signaling a change, in commuting patterns. This study highlights the significance of progressing AI technologies to meet changing infrastructure requirements and fluctuating traffic trends emphasizing the impact of AI on shaping the urban transportation landscape.",reducing traffic congestion,smart city solutions,artificial intelligence-based urban planning,motivating urban mobility,PROCEEDINGS OF THE INTERNATIONAL CONFERENCE ON BUSINESS EXCELLENCE,artificial intelligence in transport,intelligent transport systems,,,,,,,,,,,,,,,,,
Row_177,"Li, Wei","Chen, Siqian","Fan, Wei","Luo, Qin",Optimization of Periodic Train Schedule with Flexible Train Composition during Off-Peak Periods for Urban Rail Transit,JOURNAL OF TRANSPORTATION ENGINEERING PART A-SYSTEMS,OCT 1 2024,0,"Focusing on the insufficient passenger demand during off-peak periods in urban rail transit, a new train operation mode with flexible train composition considering trains couple/decouple at intermediate stations is proposed. An optimized two-phase nonlinear model is formulated in order to design a periodic train schedule, where train headways remain constant over a specific period. This model takes into account the flexible train composition. The objective function aims to minimize total passenger waiting time and train operating costs while considering constraints such as maximum line passing capacity, passenger flow demand, and the number of train units in the composition. Linearization techniques are applied to convert nonlinear constraints into linear equivalents, and the CPLEX solver is employed to solve the model. An illustrative real-case example is presented to validate the effectiveness of the proposed model. The results demonstrate that the operation mode with flexible train composition during off-peak periods offers significant advantages over traditional train composition modes, including single train routes, long-short train routes, and multiple train compositions. This mode enables better alignment between passenger demand and capacity, reduces operating costs, and enhances passenger service levels. The proposed operation mode is particularly suitable for urban rail transit lines with low passenger demand but requiring high passenger service, such as suburban lines or common lines during off-peak periods.",Urban rail transit,Train operation plan,Flexible train composition,Online coupling/decoupling mode,,Linearization techniques,,,,,,,,,,,,,,,,,,
Row_178,"Tang, Zhihai","Huang, Aiwen","Chang, Le",,Provisioning edge computing services in urban areas through the chaining of unmanned aerial vehicles: A genetic approach,ELECTRONICS LETTERS,MAR 2024,0,"Edge computing has been proved an efficient approach to provisioning computation offloading service to vehicles on road through Road-Side Units (RSUs). However, the traffic volume on road is highly dynamic, while RSU-based edge servers are static in terms of geographical location and computation capacity. To address this problem, this paper proposes a mobile edge server placement strategy using cruising UAVs along the roads based on the genetic algorithm. A mathematical model is first built to characterize the deployment cost of these UAV-mounted servers and their routes. Next, a heuristic UAV-mounted edge server deployment scheme based on K-medoid clustering and genetic algorithms is designed. Experimental results verify that the proposed UAV deployment scheme satisfies the offloading demand of IoV nodes while reducing the total deployment cost by 17.05-48.94% compared with existing popular approaches.Determine a variety of cruising routes of the UAV mounted edge servers to offer offloading services, and place a number of charge stations on the map that each route must go through a charge station. The problem is to find the locations of these UAV charge stations and plan the cruising routes of the UAVs with minimum deployment cost. image",Edge computing,Unmanned Aerial Vehicles (UAVs),Route plan,Internet of Vehicles (IoV),,,,,,,,,,,,,,,,,,,,
Row_179,"Chen, Weiyang","Liu, Bingyi","Han, Weizhen","Li, Gaolei",Dynamic Path Planning Based on Traffic Flow Prediction and Traffic Light Status,"ALGORITHMS AND ARCHITECTURES FOR PARALLEL PROCESSING, ICA3PP 2023, PT I",2024,0,"Traffic flow prediction and path planning are crucial components of effective intelligent transportation systems research. The intelligent transportation system can optimize vehicle driving routes by utilizing predicted traffic flow data for each road segment and considering the periodic changes in traffic light patterns at intersections. However, most studies on traffic flow prediction have overlooked the frequency domain information of traffic flow sequences, resulting in a lack of effective modeling of this vital frequency domain information. Furthermore, existing path planning approaches only consider factors such as traffic density and road length in decision-making, neglecting the influence of traffic light status on vehicle travel time. We propose a traffic flow prediction model called mWDN-LSTM-ARIMA to address these issues, incorporating frequency feature extraction and residual testing. Additionally, we present a path planning method that leverages the traffic flow predictions from mWDN-LSTM-ARIMA and takes into account the periodic transformation law of traffic lights at urban intersections. Our experimental results validate the effectiveness of the proposed approach in reducing the average travel time and waiting count of vehicles.",Deep Reinforcement Learning,Traffic Flow Prediction,Path Planning,Traffic Light Status,,,,"Song, Bin",,,,,,,,,,,,,,,,
Row_180,"Wen, Wen","Deng, Hongxing",,,Comprehensive Evaluation of Urban Road Network Capacity Using Fractal Theory in the Context of the Internet of Things,JOURNAL OF TESTING AND EVALUATION,MAY 2024,1,"In order to make a good assessment of road traffic status, this paper proposes a comprehensive evaluation method of urban road network capacity based on soft computing under the background of Internet of Things. The focus of the research is to use a variety of soft computing technologies such as Hausdorff dimension simplification method, branch dimension measurement algorithm, multifractal method, etc., to analyze the overall traffic load and guide the traffic channelization in an optimal way, considering various factors comprehensively. The model helps to optimize infrastructure and reduce road traffic congestion. This avoids traffic congestion, ultimately reducing the carbon footprint and promoting a green environment. This method analyzes the network capacity, network load and corresponding conversion coefficient of all levels of highway. Based on the multi -component linear regression method, this paper evaluates the urban road network capacity, and constructs the urban road network capacity planning model according to the traffic volume constraints and travel time constraints. The test results show that under the application of this method, the road capacity of the planned route exceeds 4000 pcu. The pcu is a passenger vehicle unit that measures the extent to which different types of vehicles have an impact on road capacity. When the capacity of a planned road exceeds 4000 pcu, it means that the road can carry a large number of different types of vehicles at the same time, and the average operating speed of the line can reach 42.3 km/h. After 5 years of planning, the efficiency of road use is still above 75 %. It can be proved that this method can obtain the optimal traffic path through better route planning and avoid traffic congestion and pollution.",Hausdorff dimension simplification,multifractal,multiple linear regression,urban road network,,traffic capacity,,,,,,,,,,,,,,,,,,
Row_181,"Chung, Jaehoon","Yao, Enjian","Pan, Long","Ko, Joonho","Understanding the route choice preferences of private and dock-based public bike users using GPS data in Seoul, South Korea",JOURNAL OF TRANSPORT GEOGRAPHY,APR 2024,1,"Analyzing route preferences is crucial for comprehending how individuals choose their travel paths, assessing road facilities, and anticipating upcoming traffic conditions. This study aimed to explore the factors influencing route selections made by private and public bike users and compare their decisions during peak and off-peak hours. Global positioning system (GPS) traces of 12,106 private bike users and 74,397 public bike users from a single weekday in Seoul, South Korea, were used. A map-matching process aligned the GPS data with a comprehensive cycling network encompassing bikeways, sidewalks, neighborhood roads, and their street attributes such as urban, park, and river streets. Choice sets composed of the shortest and 10th alternative routes were created to compare various road features with actual routes. By employing a path-size logit model to address overlapping issues among the routes, the results showed that buffered bike lanes separated from car flows positively influenced the route selection of bicyclists. Bike boulevards and shared sidewalk bikeways negatively impacted route decisions made by public bike users, with a more pronounced effect during peak hours. Furthermore, private bike users showed a decreased preference for routes in residential areas during peak hours, while an increased preference during off-peak hours. Moreover, public bike users preferred selecting routes in the presence of shopping -stores or amenities as well as public transit stations, with these effects being more pronounced during peak hours. These findings are expected to contribute to capturing valuable insights into the route preferences of bicyclists for the improvement of bicycle infrastructures.",Route choice preferences,Private and public bike users,GPS traces,Choice sets,,,,,,,,,,,,,,,,,,,,
Row_182,"Barma, Rhidi","Reza, Farhadur","Kabir, Zobaidul","Shammi, Mashura",Implementation of environmental management plans in the transport sector development projects: A case study of two mega projects in Bangladesh,CASE STUDIES ON TRANSPORT POLICY,DEC 2024,1,"This study assesses the Environmental Management Plans (EMPs) of two major urban transport megaprojects in Bangladesh, MRT Line-6 and BRT Line-3, implemented in Dhaka City to alleviate traffic congestion. The EMPs were evaluated using content analysis, SWOT analysis, and key informant interviews with environmental impact assessment experts. This research identifies the challenges and strengths of these projects, including occupational health and safety management, compensation measures for resettlement, handling cash grievances, emergency response plans, and organized environmental maintenance. The EMPs demonstrate efforts to compensate for greenspace loss by creating new ground coverage along the routes and planting trees and shrubs beneath elevated tracks. Notable weaknesses were observed, including a lack of integration between project proponents and regulatory authorities, absence of monitoring and reporting of impacts, health hazards caused by dust and emissions from equipment and project activities, insufficient traffic management plans, and inadequate health and safety measures for pedestrians during the construction phase. Several measures have been proposed for monitoring the operational phases by designated authorities, such as an environmental treatment plan for wastewater, solid waste management, water supply and sanitation, noise pollution control, and other emission control measures. Unfortunately, the study revealed that the restoration of blue spaces, such as water bodies and wetlands, affected by the megaprojects, was not adequately planned. This study further suggests that transparency and public participation should be ensured during preparation and implementation of EMPs of megaprojects. It also emphasizes the need for an adequate workforce and resources in the Department of Environment (DoE) to monitor EMP implementation effectively.",Environmental impact assessment (EIA),environmental management plan (EMP),Transport projects,Bangladesh,,,,"Tareq, Shafi M.",,,,,,,,,,,,,,,,
Row_183,"Yang, Xiaochun","Jiang, Huiyuan",,,Research on Urban Cold Chain Logistics Path Optimization Considering Multi-Center and Time-Varying Road Networks,IEEE ACCESS,2024,0,"This paper aims to address the time-dependent multi-depot vehicle routing problem with time windows (MDVRPTW) in urban cold chain logistics under a dynamic road network. The study considers the impact of carbon emissions and traffic congestion on urban cold chain logistics distribution activities. It proposes a cross-period road segment travel time calculation method, constructs a multi-objective optimization model that minimizes total costs encompassing comprehensive transportation costs, carbon emission costs, time penalty costs, cargo damage costs, and refrigeration costs. An adaptive large neighborhood search ant colony optimization algorithm (ALNS_ACO) is designed, which combines the exploration capability of ant colony optimization algorithm (ACO) with the local search capability of adaptive large neighborhood search algorithm (ALNS) to optimize and solve the model. Finally, the model is optimized and solved through simulation using six sets of C-type, R-type, and RC-type instances from the Solomon test database. The results indicate that: 1) The planned routes can reasonably avoid peak congestion periods in the morning and evening. Compared to the single-center scenario, the multi-center approach achieves superior solutions in terms of the total cost, carbon emissions, and total travel time in urban cold chain logistics distribution; 2) The exacerbation of traffic congestion leads to increased costs, and different optimization objectives have a significant impact on the model solutions; 3) Finally, through multidimensional comparisons of simulation performance with ACO and GA algorithms, the effectiveness of the proposed optimization algorithm is validated.",Multi-depot,time-varying speeds,urban cold chain logistics,multi-objective optimization,,ALNS_ACO algorithm,,,,,,,,,,,,,,,,,,
Row_184,"Nugraha, Ramdhan","Masuduzzaman, Md","Shin, Soo Young",,Collaborative Routing With Multi-Heuristic Algorithm for Enhanced Delivery Efficiency in Truck-Multi Unmanned Aerial Vehicles Systems,IEEE ACCESS,2024,0,"This paper proposes the integration of Unmanned Aerial Vehicles (UAVs) into conventional delivery trucks as a solution to the challenges caused by the growing requirements of e-commerce and the congestion in urban areas in the logistics sector. The variable neighborhood priority routing problem using truck and multi-UAV (VNPRPTmD) is presented as a multi-heuristic technique aimed at minimizing delivery delays by utilizing both terrestrial and aerial delivery methods. The VNPRPTmD model improves delivery efficiency by utilizing consumer segregation and clustering, routing optimization, and multi-vehicle collaborative routing. The concept enables UAVs to operate with flexibility, departing from and returning to any specified spot, hence eliminating the requirement to return to their original location. This approach minimizes operational expenses and enhances the efficiency of delivering parcels by effectively leveraging the capabilities of trucks and multiple UAVs. The research provides an elaborate mathematical model, evaluates the materials and methods employed, and concludes with findings that clearly establish the effectiveness of this innovative delivery system.",Autonomous aerial vehicles,Routing,Batteries,Logistics,,Vehicle routing,Mathematical models,,Payloads,,Collaboration,Search problems,Roads,Vehicle routing problem,unmanned aerial vehicle,synchronization heuristic algorithm,K-nearest neighbor,variable neighborhood search,,,,,,
