,author1,author2,author3,author4,author5,title,journal/book,publish time,citation,abstract,keyword1,keyword2,keyword3,keyword4,keyword5,keyword6,keyword7,keyword8,keyword9,keyword10,keyword11,author6,author7,author8,author9,author10,keyword12,keyword13,keyword14,conference,keyword15
Row_943,"Liu, Ruizhong","Luo, Tingzhang","Huang, Shaoguang","Wu, Yuwei","Jiang, Zhen",CrossMatch: Cross-View Matching for Semi-Supervised Remote Sensing Image Segmentation,IEEE TRANSACTIONS ON GEOSCIENCE AND REMOTE SENSING,2024,0,"Recently, weak-to-strong consistency-based methods have yielded a remarkable performance for remote sensing image segmentation. However, they are designed within a single view, which encounters the problems of unreliable pseudo-label supervision and insufficient ability to capture informative features for the segmentation of complex remote sensing data. In this article, we propose a cross-view weak-to-strong consistency-based method, which aggregates rich information from two irrelevant views. We employ two subnets for the two views to generate view-specific features while encouraging them to yield the same prediction. Within each view, we enhance the perturbation space of data at the image level and feature level for a more robust representation. To leverage the information from unlabeled data, we propose a cross-view weak-to-strong consistency scheme, which employs the pseudo-label of the weakly augmented data in one view to supervise the model training in another view, facilitating an effective information exchange across views. To avoid identical information extraction from the two views, we propose a cross-view contrastive loss to maximize the dissimilarity of the feature representations across views, which ensures that the learned complementary information from one view provides additional helpful information for the model training in another view. Finally, we propose a cross-view discrepancy-based supervised constraint by imposing a larger weight on the areas that exist discrepant predictions across views in the cross-entropy loss, allowing the model to focus more on the hard-to-classify regions of the images. Extensive experimental results on several benchmark datasets demonstrate that our method outperforms the state-of-the-art.",Remote sensing,Perturbation methods,Semantic segmentation,Data models,Training,Predictive models,Feature extraction,Sensors,Reliability,Deep learning,image segmentation,"Zhang, Hongyan",,,,,remote sensing,semi-supervised learning (SSL),,,
Row_944,"Gu, Xingjian","Yu, Supeng","Huang, Fen","Ren, Shougang","Fan, Chengcheng",Consistency Self-Training Semi-Supervised Method for Road Extraction from Remote Sensing Images,REMOTE SENSING,NOV 2024,0,"Road extraction techniques based on remote sensing image have significantly advanced. Currently, fully supervised road segmentation neural networks based on remote sensing images require a significant number of densely labeled road samples, limiting their applicability in large-scale scenarios. Consequently, semi-supervised methods that utilize fewer labeled data have gained increasing attention. However, the imbalance between a small quantity of labeled data and a large volume of unlabeled data leads to local detail errors and overall cognitive mistakes in semi-supervised road extraction. To address this challenge, this paper proposes a novel consistency self-training semi-supervised method (CSSnet), which effectively learns from a limited number of labeled data samples and a large amount of unlabeled data. This method integrates self-training semi-supervised segmentation with semi-supervised classification. The semi-supervised segmentation component relies on an enhanced generative adversarial network for semantic segmentation, which significantly reduces local detail errors. The semi-supervised classification component relies on an upgraded mean-teacher network to handle overall cognitive errors. Our method exhibits excellent performance with a modest amount of labeled data. This study was validated on three separate road datasets comprising high-resolution remote sensing satellite images and UAV photographs. Experimental findings showed that our method consistently outperformed state-of-the-art semi-supervised methods and several classic fully supervised methods.",semi-supervised,semantic segmentation,generative adversarial network,road extraction,remote sensing image,,,,,,,,,,,,,,,,
Row_945,"Li, Yazhou","Cheng, Zhiyou","Wang, Chuanjian","Zhao, Jinling","Huang, Linsheng",RCCT-ASPPNet: Dual-Encoder Remote Image Segmentation Based on Transformer and ASPP,REMOTE SENSING,JAN 2023,18,"Remote image semantic segmentation technology is one of the core research elements in the field of computer vision and has a wide range of applications in production life. Most remote image semantic segmentation methods are based on CNN. Recently, Transformer provided a view of long-distance dependencies in images. In this paper, we propose RCCT-ASPPNet, which includes the dual-encoder structure of Residual Multiscale Channel Cross-Fusion with Transformer (RCCT) and Atrous Spatial Pyramid Pooling (ASPP). RCCT uses Transformer to cross fuse global multiscale semantic information; the residual structure is then used to connect the inputs and outputs. ASPP based on CNN extracts contextual information of high-level semantics from different perspectives and uses Convolutional Block Attention Module (CBAM) to extract spatial and channel information, which will further improve the model segmentation ability. The experimental results show that the mIoU of our method is 94.14% and 61.30% on the datasets Farmland and AeroScapes, respectively, and that the mPA is 97.12% and 84.36%, respectively, both outperforming DeepLabV3+ and UCTransNet.",remote image,deep learning,semantic segmentation,CNN,multiscale feature fusion,Transformer,,,,,,,,,,,,,,,
Row_946,"Chen, Bo","Zhang, Jiahao","Zhou, Jianbang","Chen, Zhong","Yang, Tian",Semantic image segmentation network based on deep learning,,2020,1,"Semantic segmentation is one of the basic themes in computer vision. Its purpose is to assign semantic tags to each pixel of an image, which has been applied in many fields such as medical field, intelligent transportation and remote sensing image. In this paper, we use deep learning to solve the task of remote sensing semantic image segmentation. We propose an algorithm for semantic segmentation of the Attention Seg-Net network combined with SegNet and attention gate. Our proposed network can better segment vegetation, buildings, water bodies and roads in the test set of remote sensing images.",Semantic Segmentation,Attention Seg-Net,Deep Learning,Attention gate,,,,,,,,"Zhang, Yanna",,,,,,,,MIPPR 2019: AUTOMATIC TARGET RECOGNITION AND NAVIGATION,
Row_947,"Xia, Liegang","Liu, Ruiyan","Su, Yishao","Mi, Shulin","Yang, Dezhi",Crop field extraction from high resolution remote sensing images based on semantic edges and spatial structure map,GEOCARTO INTERNATIONAL,JAN 1 2024,2,"Crop field boundary extraction is crucial to remote sensing images attained to support agricultural production and planning. In recent years, deep convolutional neural networks (CNNs) have gained significant attention for edge detection tasks. Moreover, transformers have shown superior feature extraction and classification capabilities compared to CNNs due to their self-attention mechanism. We proposed a novel structure that combines full edge extraction with CNNs and enhances connectivity with transformers, consisting of three stages: a) preprocessing the training data; b) training the semantic edge and spatial structure graph models; and c) vectorizing the fusion of semantic edge and spatial structure graph outputs. To cater specifically to high-resolution remote sensing image crop-field boundary extraction, we developed a CNN model called Densification D-LinkNet. Its full-scale skip connections and edge-guided module adapted well to different crop-field boundary features. Additionally, we employed a spatial graph structure generator (Relationformer) based on object detection that directly outputs the structural graph of the crop field boundary. This method relies on good connectivity to repair fragmented edges that may appear in semantic edge detection. Through multiple experiments and comparisons with other edge-detection methods, such as BDCN, DexiNed, PidiNet, and EDTER, we demonstrated that our proposed method can achieve at least 9.77% improvement in boundary intersection over union (IoU) and 2.07% improvement in polygon IoU on two customized datasets. These results indicate the effectiveness and robustness of our approach.",High-resolution remote sensing images,image segmentation,semantic edge detection,transformer,,,,,,,,"Chen, Jun","Shen, Zhanfeng",,,,,,,,
Row_948,"Yan, Zhiyuan","Li, Junxi","Li, Xuexue","Zhou, Ruixue","Zhang, Wenkai",RingMo-SAM: A Foundation Model for Segment Anything in Multimodal Remote-Sensing Images,IEEE TRANSACTIONS ON GEOSCIENCE AND REMOTE SENSING,2023,24,"The proposal of the segment anything model (SAM) has created a new paradigm for the deep-learning-based semantic segmentation field and has shown amazing generalization performance. However, we find it may fail or perform poorly on multimodal remote-sensing scenarios, especially synthetic aperture radar (SAR) images. Besides, SAM does not provide category information for objects. In this article, we propose a foundation model for multimodal remote-sensing image segmentation called RingMo-SAM, which can not only segment anything in optical and SAR remote-sensing data, but also identify object categories. First, a large-scale dataset containing millions of segmentation instances is constructed by collecting multiple open-source datasets in this field to train the model. Then, by constructing an instance-type and terrain-type category-decoupling mask decoder (CDMDecoder), the categorywise segmentation of various objects is achieved. In addition, a prompt encoder embedded with the characteristics of multimodal remote-sensing data is designed. It not only supports multibox prompts to improve the segmentation accuracy of multiobjects in complicated remote-sensing scenes, but also supports SAR characteristics prompts to improve the segmentation performance on SAR images. Extensive experimental results on several datasets including iSAID, ISPRS Vaihingen, ISPRS Potsdam, AIR-PolSAR-Seg, and so on have demonstrated the effectiveness of our method.",Remote sensing,Task analysis,Semantic segmentation,Feature extraction,Radar polarimetry,Training,Adaptation models,Multimodal remote-sensing images,prompt learning,segment anything model (SAM),semantic segmentation,"Feng, Yingchao","Diao, Wenhui","Fu, Kun","Sun, Xian",,,,,,
Row_949,"Zhang, Zhen","Huang, Xin","Li, Jiayi",,,DWin-HRFormer: A High-Resolution Transformer Model With Directional Windows for Semantic Segmentation of Urban Construction Land,IEEE TRANSACTIONS ON GEOSCIENCE AND REMOTE SENSING,2023,17,"In this article, a deep neural network for semantic segmentation of high-resolution remote sensing images is proposed for urban construction land classification. The network follows a high-resolution network (HRNet) architecture. Specifically, a directional self-attention on the paths of different resolutions is proposed, aiming to correct the directional bias caused by the attention of strip windows during the model learning, while also reducing the computational complexity, and allowing the model to improve both the accuracy and the speed. At the end of the network, a distributed alignment module with spatial information is constructed to train additional learnable parameters, to adjust the biased decision boundaries through a two-stage learning strategy, and alleviate the problem of accuracy degradation due to the unbalanced training data. We tested the proposed method and compared it with the current state-of-the-art (SOTA) semantic segmentation methods on the Luojia-fine-grained land cover (FGLC) dataset and the Wuhan Dense Labeling Dataset (WHDLD), and the proposed one obtained the best performance. We also verified the effectiveness of each component of the network through ablation experiments.",Transformers,Semantic segmentation,Computational modeling,Task analysis,Windows,Monitoring,Remote sensing,Deep learning,remote sensing imagery,semantic segmentation,transformer,,,,,,urban construction land,,,,
Row_950,"Pang, Shuai","Gao, Lianxue",,,,Multihead attention mechanism guided ConvLSTM for pixel-level segmentation of ocean remote sensing images,MULTIMEDIA TOOLS AND APPLICATIONS,JUL 2022,5,"Semantic segmentation of ocean remote sensing images classifies each pixel in the image according to the ocean background and island type, and is an important research direction in the field of remote sensing image processing. Due to large differences in the scale of islands in ocean remote sensing images and the complexity of island boundaries, it is difficult to accurately extract features of ocean remote sensing images, which makes it difficult to accurately segment ocean remote sensing images. Convolutional neural networks have gradually become the mainstream algorithm in the field of image processing due to their autonomous hierarchical extraction of image features. In this paper, the MAGC-Net neural network model, which is based on the multihead attention mechanism and ConvLSTM, is used to segment ocean remote sensing images to improve the accuracy of semantic segmentation. First, shallow features are obtained via multiscale convolution, and multiple weights are assigned to features by the multihead attention mechanism (global, local, maximum). Then, the semantic relationship between the features is described through the integrated ConvLSTM module, and deep features are generated. Finally, deep features are filtered through residual blocks, reducing redundant features and improving segmentation accuracy. Experimental results with the NWPU-RESISC45 dataset demonstrate the effectiveness and robustness of the proposed algorithm.",Ocean remote sensing,Deep learning,Multihead attention mechanism,Multiscale convolutional,,,,,,,,,,,,,,,,,
Row_951,"Niu, Mengjia","Zhang, Yongjun","Yang, Gang","Wang, Zewei","Liu, Junwen",Semantic segmentation for remote sensing images via dense feature extraction and companion loss neural network,INTERNATIONAL JOURNAL OF REMOTE SENSING,NOV 17 2021,2,"Semantic segmentation models with good performance are crucial for the practical application of high-resolution remote-sensing images (RSI). Compared with nature images, in most cases the RSI dataset has the problem of unbalanced sample distribution between classes and unbalanced target size ratio. Using semantic segmentation to pixel-wise classify and identification RSI can solve this problem to some extent. At present, most semantic segmentation models based on mainstream networks solve these problems from the object scale and super-pixel perspective, whereas the accuracy still needs to be improved. To enhance the quality of the predicted feature maps, the Dense-Inception Net (D-INet) model is proposed based on the idea of DenseNet feature reuse and combined with the attention mechanism, which enables the network to maintain depth while widening the width to obtain more advanced semantic information. The connection of contextual information is strengthened by connecting RFB multi-scale modules at the shallow level, and shallow features with more spatial features are extracted for feature fusion with the decoder. To further lift the segmentation accuracy, a companion loss is introduced in the encoder, and the model is trained to have better segmentation performance for small sample objects by adaptively adjusting the loss coefficients. Experimental results show that the proposed method significantly increases the accuracy and mean Intersection Over Union (mIOU) scores.",,,,,,,,,,,,"Cui, Zhongwei",,,,,,,,,
Row_952,"Pang, Shiyan","Lan, Jingjing","Zuo, Zhiqi","Chen, Jia",,SFGT-CD: Semantic Feature-Guided Building Change Detection From Bitemporal Remote-Sensing Images With Transformers,IEEE GEOSCIENCE AND REMOTE SENSING LETTERS,2024,6,"High-resolution remote-sensing-image change detection is widely used in urban dynamic monitoring, geographic information updating, natural disaster monitoring, illegal building investigation, and land resource surveys. Common change-detection algorithms are mainly implemented in a fully supervised manner that relies on a large number of high-quality samples. Compared with a building change-detection dataset, a building semantic-segmentation dataset is easier to accumulate and obtain. Making full use of this semantic information in the design of a building change-detection network can effectively reduce the sample size required to train a change-detection model. In view of this, a semantic feature-guided Siamese change-detection framework is devised in this letter. The framework effectively exploits the prior information of building semantic features and uses the popular transformer structure to improve the change analysis module. The results of extensive experiments on two public datasets show that the framework is more accurate than the other state-of-the-art change detection algorithms and can effectively reduce the dependence of data on change detection samples in the model training process.",Feature extraction,Semantics,Transformers,Convolutional neural networks,Training,Remote sensing,Decoding,Change detection,high-resolution optical remote-sensing images,prior semantic information,transformers,,,,,,,,,,
Row_953,"Yin, Hao","Zhang, Chengming","Han, Yingjuan","Qian, Yonglan","Xu, Tao",Improved semantic segmentation method using edge features for winter wheat spatial distribution extraction from Gaofen-2 images,JOURNAL OF APPLIED REMOTE SENSING,MAY 25 2021,3,"In the final feature map obtained using a convolutional neural network for remote sensing image segmentation, there are great differences between the feature values of the pixels near the edge of the block and those inside the block; ensuring consistency between these feature values is the key to improving the accuracy of segmentation results. The proposed model uses an edge feature branch and a semantic feature branch called the edge assistant feature network (EFNet). The EFNET model consists of one semantic branch, one edge branch, one shared decoder, and one classifier. The semantic branch extracts semantic features from remote sensing images, whereas the edge branch extracts edge features from remote sensing images and edge images. In addition, the two branches extract five-level features through five sets of feature extraction units. The shared decoder sets up five levels of shared decoding units, which are used to further integrate edge features and deep semantic features. This strategy can reduce the feature differences between the edge pixels and the inner pixels of the object, obtaining a per-pixel feature vector with high inter-class differentiation and intra-class consistency. Softmax is used as the classifier to generate the final segmentation result. We selected a representative winter wheat region in China (Feicheng City) as the study area and established a dataset for experiments. The comparison experiment included three original models and two models modified by adding edge features: SegNet, UNet, and ERFNet, and edge-UNet and edge-ERFNet, respectively. EFNet's recall (91.01%), intersection over union (81.39%), and F1-Score (91.68%) were superior to those of the other methods. The results clearly show that EFNET improves the accuracy of winter wheat extraction from remote sensing images. This is an important basis not only for crop monitoring, yield estimation, and disaster assessment but also for calculating land carrying capacity and analyzing the comprehensive production capacity of agricultural resources. (C) The Authors. Published by SPIE under a Creative Commons Attribution 4.0 Unported License.",convolutional neural network,remote sensing,semantic segmentation,winter wheat,edge feature,Gaofen-2,,,,,,"Zhang, Ziyun","Kong, Ailing",,,,,,,,
Row_954,"Yang, Junliang","Chen, Guorong","Huang, Jiaming","Ma, Denglong","Liu, Jingcheng",GLE-net: global-local information enhancement for semantic segmentation of remote sensing images,SCIENTIFIC REPORTS,OCT 25 2024,0,"Remote sensing (RS) images contain a wealth of information with expansive potential for applications in image segmentation. However, Convolutional Neural Networks (CNN) face challenges in fully harnessing the global contextual information. Leveraging the formidable capabilities of global information modeling with Swin-Transformer, a novel RS images segmentation model with CNN (GLE-Net) was introduced. This integration gives rise to a revamped encoder structure. The subbranch initiates the process by extracting features at varying scales within the RS images using the Multiscale Feature Fusion Module (MFM), acquiring rich semantic information, discerning localized finer features, and adeptly handling occlusions. Subsequently, Feature Compression Module (FCM) is introduced in main branch to downsize the feature map, effectively reducing information loss while preserving finer details, enhancing segmentation accuracy for smaller targets. Finally, we integrate local features and global features through Spatial Information Enhancement Module (SIEM) for comprehensive feature modeling, augmenting the segmentation capabilities of model. We performed experiments on public datasets provided by ISPRS, yielding notably remarkable experimental outcomes. This underscores the substantial potential of our model in the realm of RS image segmentation within the context of scientific research.",Remote sening,Multiscale feature,Swin-transformer convolutional neural networks,,,,,,,,,"Zhu, Huazheng",,,,,,,,,
Row_955,"Yang, Peiqi","Wang, Mingjun","Yuan, Hao","He, Ci","Cong, Li",Using contour loss constraining residual attention U-net on optical remote sensing interpretation,VISUAL COMPUTER,SEP 2023,5,"Using deep learning in remote sensing interpretation could reduce a lot of human and material costs. Semantic segmentation is the main method for this task. It can automatically outline the objects and it has recently achieved great success in remote sensing images. However, in the appliance of remote sensing interpretation, the accuracy of contour largely determines the evaluation of remote sensing interpretation. Though the current loss functions reflect the segmentation performance, they could not guide the model to optimize itself toward a more precise contour. This paper proposed an exactly defined contour loss (CL) for remote sensing interpretation with Residual Attention U-Net (RA U-Net) as the main framework. The RA U-Net uses the residual attention module as the skip connection layer. It enhances the judgment of U-Net. In CL, image processing methods are used to extract the contours of the foreground. And elements-sum and elements-subtract operations are used to transfer the contour information to a matrix of the same size as label images. Then, these matrices would be the weights for CE. By assigning different weights for different elements in different regions, this function will guide the model to reach a balance between accurate segmentation results and precise contours. The experiment on open datasets shows a good performance. The proposed model was also trained on the Construction Disturbance Dataset collected from Jiang Xi Province, China. The dataset was labeled manually. The evaluation enhanced a lot on the Construction Disturbance Dataset and the IoU on two datasets increased 1% to 2% when using CL as the loss function. This paper also compared the proposed method with other state-of-the-art methods and the results showed extensive effectiveness.",Remote sensing,Image interpretation,Loss function,Semantic segmentation,U-Net,Residual attention mechanism,,,,,,,,,,,,,,,
