,author1,author2,author3,author4,author5,title,journal/book,publish time,citation,abstract,keyword1,keyword2,keyword3,keyword4,keyword5,keyword6,keyword7,keyword8,keyword9,keyword10,keyword11,author6,author7,author8,author9,author10,keyword12,keyword13,keyword14,conference,keyword15
Row_854,"Zhang, Xiangrong","Weng, Zhenhang","Zhu, Peng","Han, Xiao","Zhu, Jin",ESDINet: Efficient Shallow-Deep Interaction Network for Semantic Segmentation of High-Resolution Aerial Images,IEEE TRANSACTIONS ON GEOSCIENCE AND REMOTE SENSING,2024,1,"Semantic segmentation of high-resolution remote sensing images is essential in many fields. Nevertheless, in practical applications, constrained by limited computational resources and complex network structures, many advanced models on semantic segmentation often fail to show efficient performance, prompting research on lightweight models. For lightweight semantic segmentation models, the two-branch architecture has been shown to work well in speed and performance. However, such two-branch architectures usually do not utilize enough information for shallow structures to efficiently provide richer multiscale information for the two branches. The lightweight modules it uses are difficult to extract the global context information of the features effectively. Compared with the current advanced semantic segmentation models, lightweight models still have some differences in performance. In order to solve these problems, we propose a new lightweight dual-branch architecture efficient shallow-deep interaction network (ESDINet), which can quickly extract low-level spatial and high-level semantic information of images through the detail branch and semantic branch. Specifically, we have constructed an efficient double-branch structure with shallow and deep different interactions to achieve multiscale information interaction. At the same time, we optimize the semantic branch and propose a new linear attention block to effectively improve the global perception of the semantic branch. We performed extensive experiments and the results show that our model achieves a good balance between segmentation accuracy and inference speed. In particular, ESDINet achieves 82.03% mean intersection over union (mIoU) on the Vaihingen test set, while the proposed model achieves an inference speed of 116 frames/s (FPS) for 512 chi 512 inputs on a single NVIDIA GTX 2080Ti GPU.",High-resolution remote sensing image,lightweight,multiscale,semantic segmentation,,,,,,,,"Jiao, Licheng",,,,,,,,,
Row_855,"Chen, Canyu","Zhu, Guobin","Chen, Xiliang",,,Wetland Scene Segmentation of Remote Sensing Images Based on Lie Group Feature and Graph Cut Model,IEEE JOURNAL OF SELECTED TOPICS IN APPLIED EARTH OBSERVATIONS AND REMOTE SENSING,2025,0,"Given the increasingly severe destruction of wetlands in recent years, research and monitoring for wetland protection are urgently needed. However, wetland monitoring still faces significant challenges such as high manual costs and low image monitoring accuracy, primarily due to the complex composition of wetland terrain and diverse spectral characteristics, especially located in remote suburban areas. With their rich semantic and spectral features, studying wetlands as scenes in remote sensing images and segmenting them effectively can address these challenges. To address the issue of low segmentation accuracy on remote sensing image with GrabCut, this study proposes a remote sensing image segmentation extraction method, named SceneCut, based on feature extraction and multifeature joint graph cuts. The method consists of three parts: feature extraction, feature fusion, and multifeature joint graph cuts. In the first part, image features are calculated using a sliding window approach. In the second part, region covariance calculation and matrix eigenvalue decomposition are used to generate a multichannel feature image from the extracted feature vectors. Finally, in the third part, GrabCut is applied to the multichannel image to perform graph cuts, considering multiple features, and the segmentation result is mapped back to the original image to generate the segmented image. Experimental analysis and field exploration validation of wetland images conducted in this study demonstrate that compared to algorithms that only use RGB features for segmentation or those that do not consider the relationship between multiple features, SceneCut performs well in wetland scene extraction, especially in extracting boundaries with significant blending.",Wetlands,Feature extraction,Image segmentation,Remote sensing,Monitoring,Semantics,Accuracy,Object oriented modeling,Lie groups,Deep learning,Graph cut model,,,,,,lie group,remote sensing,scene segmentation,,wetland
Row_856,"Lian, Renbao","Huang, Liqin",,,,Weakly Supervised Road Segmentation in High-Resolution Remote Sensing Images Using Point Annotations,IEEE TRANSACTIONS ON GEOSCIENCE AND REMOTE SENSING,2022,19,"Road segmentation methods based on deep neural networks have achieved great success in recent years, but creating accurate pixel-wise training labels is still a boring and expensive task, especially for large-scale high-resolution remote sensing images (HRSIs). Inspired by the stacked hourglass model for human joints detection, we propose a weakly supervised road segmentation method using point annotations in this article. First, we design a patch-based deep convolutional neural network (DCNN) model for road seeds and background points detection and train the model using point annotations. Then, in the process of road segmentation, the DCNN model detects a series of road and background points that are used to train a Support Vector Machine Classifier (SVC) for classifying each pixel into road or nonroad. According to the local geometry of road and the inaccurate classification of SVC, a multiscale and multidirection Gabor filter (MMGF) is put forward to estimate the road potential. Finally, the active contour model based on local binary fitting energy (LBF-Snake) is introduced to extract the road regions from the inhomogeneous road potential. Qualitative and quantitative comparisons show that our method achieves results close to the fully supervised semantic methods without considering the annotation cost and outperforms them given a fixed budget.",Roads,Image segmentation,Annotations,Semantics,Training,Remote sensing,Estimation,Active contour model,Gabor filter,point annotation,remote sensing images,,,,,,road segmentation,weakly supervised segmentation,,,
Row_857,"Huan, Hai","Liu, Yuan","Xie, Yaqin","Wang, Chao","Xu, Dongdong",MAENet: Multiple Attention Encoder-Decoder Network for Farmland Segmentation of Remote Sensing Images,IEEE GEOSCIENCE AND REMOTE SENSING LETTERS,2022,14,"With the rapid development of computer vision, semantic segmentation as an important part of the technology has made some achievements in different applications. However, in the farmland segmentation scenario of remote sensing images, the capability of common semantic segmentation methods in restoring the farmland edge and identifying narrow farmland ridges needs to be improved. Therefore, in this letter a semantic segmentation method-multiple attention encoder-decoder network (MAENet)-for farmland segmentation is proposed. The design of a dual-pooling efficient channel attention (DPECA) module and its embedment in the backbone to improve the efficiency of feature extraction is described; secondly, a dual-feature attention (DFA) module is proposed to extract contextual information of high-level features; finally, a global-guidance information upsample (GIU) module is added to the decoder to reduce the influence of redundant information on feature fusion. We use three self-made farmland image datasets representing UAV data to train MAENet and compare them with other methods. The results show that the performances of segmentation and generalization of MAENet are improved compared with other methods. The MIoU and Kappa coefficient in the farmland multi-classification test set can reach 93.74% and 96.74%.",Feature extraction,Image segmentation,Semantics,Data mining,Convolution,Remote sensing,Decoding,Attention module,farmland segmentation,feature fusion,pyramid,"Zhang, Yi",,,,,UAV images,,,,
Row_858,"Li, Shuo","Liu, Fang","Jiao, Licheng","Liu, Xu","Chen, Puhua",Mask-Guided Correlation Learning for Few-Shot Segmentation in Remote Sensing Imagery,IEEE TRANSACTIONS ON GEOSCIENCE AND REMOTE SENSING,2024,4,"Few-shot segmentation aims to segment specific objects in a query image based on a few densely annotated images and has been extensively studied in recent years. In remote sensing, image segmentation faces challenges such as less training data, large intraclass diversity, and low foreground-background contrast. In this work, we propose a novel few-shot segmentation method in remote sensing imagery based on mask-guided correlation learning (MGCL) to alleviate the above challenges. In our MGCL, a novel mask-guided feature enhancement (MGFE) module is proposed, which makes features have intramask consistency by leveraging oversegmented masks. In order to enhance the contrast between foreground and background, a novel foreground-background correlation (FBC) module is proposed, which enhances background correlation representation by learning foreground correlation and background correlation separately. Furthermore, a novel mask-guided correlation decoder (MGCD) module is proposed to guide the decoder to focus on the consistency within the mask, thereby learning how to segment complete objects and improving segmentation accuracy. Sufficient experiments on the iSAID-5(i )and DLRSD-5(i )datasets show that our MGCL outperforms all comparative methods. In particular, in the one-shot setting of the iSAID-5(i )dataset, we achieve an mIoU of 39.92 based on ResNet50, which is an improvement of 4.25 over the state-of-the-art (SOAT) method. The visualization of features before and after the MGFE module further concretely demonstrates the motivation and advantages of our MGCL. The code is available at https://github.com/LiShuo1001/MGCL.",Image segmentation,Correlation,Remote sensing,Feature extraction,Prototypes,Accuracy,Semantics,Correlation learning,few-shot learning,few-shot segmentation,segment anything,"Li, Lingling",,,,,semantic segmentation,,,,
Row_859,Wang Xi,Yu Ming,Ren Hong-e,,,Remote sensing image semantic segmentation combining UNET and FPN,CHINESE JOURNAL OF LIQUID CRYSTALS AND DISPLAYS,MAR 2021,10,"The traditional remote sensing image segmentation method is inefficient and the segmentation fineness is not enough in complex scenes. The UNET model is well-known for its good segmentation effect, but it does not perform well for the smaller objects contained in the image and the edge segmentation of larger objects. In order to solve this problem, a method combining UNET structure with FPN structure is proposed in this paper to improve the ability of UNET model to integrate multi-scale information. At the same time, the BLR loss function which can better capture the edge of the target edge is used to improve the segmentation effect of UNET model on the target boundary. The experimental results show that the method used in this paper effectively improves the accuracy of semantic segmentation and alleviates the problem of poor edge segmentation of small-scale targets and large-scale targets. The target edge segmentation can be more accurate to achieve better segmentation results.",deep learning,UNET,FPN,BLR,,,,,,,,,,,,,,,,,
Row_860,"Sun, Weiwei","Wang, Ruisheng",,,,Fully Convolutional Networks for Semantic Segmentation of Very High Resolution Remotely Sensed Images Combined With DSM,IEEE GEOSCIENCE AND REMOTE SENSING LETTERS,MAR 2018,225,"Recently, approaches based on fully convolutional networks (FCN) have achieved state-of-the-art performance in the semantic segmentation of very high resolution (VHR) remotely sensed images. One central issue in this method is the loss of detailed information due to downsampling operations in FCN. To solve this problem, we introduce the maximum fusion strategy that effectively combines semantic information from deep layers and detailed information from shallow layers. Furthermore, this letter develops a powerful backend to enhance the result of FCN by leveraging the digital surface model, which provides height information for VHR images. The proposed semantic segmentation scheme has achieved an overall accuracy of 90.6% on the ISPRS Vaihingen benchmark.",Fully convolutional networks (FCN),deep learning,semantic segmentation,remote sensing,very high resolution (VHR),,,,,,,,,,,,,,,,
Row_861,"Ma, Xianping","Zhang, Xiaokang","Pun, Man-On","Liu, Ming",,MSFNET: MULTI-STAGE FUSION NETWORK FOR SEMANTIC SEGMENTATION OF FINE-RESOLUTION REMOTE SENSING DATA,,2022,3,"This work proposes a Multi-Stage Fusion Network (MSFNet) for semantic segmentation of fine-resolution remote sensing data by exploiting a multi-stage transformer architecture. The proposed MSFNet fuses information of different scales and modalities using a multi-stage scheme based on cross-attention mechanism. More specifically, the proposed MSFNet is composed of two Multi-Level Transformers (ML-Trans), one Crossmodal Fusion Transformer (CFTrans) and one Global-Context Augmented Transformer (GCATrans). DMLTrans and CFTrans are designed to fuse features in different levels in each modality and high-level crossmodal abstract features, respectively, whereas GCATrans enhances the fusion feature of the main modal. Capitalizing on MSFNet, this work demonstrates the fusion of red-green-blue (RGB) remote sensing images and digital surface model (DSM) data. Extensive experiments on large-scale fine-resolution remote sensing data sets, namely the ISPRS Vaihingen, confirm the excellent performance of the proposed architecture as compared to conventional multimodal methods.",,,,,,,,,,,,,,,,,,,,2022 IEEE INTERNATIONAL GEOSCIENCE AND REMOTE SENSING SYMPOSIUM (IGARSS 2022),
Row_862,"Ma, Xianping","Zhang, Xiaokang","Wang, Zhiguo","Pun, Man-On",,Unsupervised Domain Adaptation Augmented by Mutually Boosted Attention for Semantic Segmentation of VHR Remote Sensing Images,IEEE TRANSACTIONS ON GEOSCIENCE AND REMOTE SENSING,2023,31,"This work investigates unsupervised domain adaptation (UDA)-based semantic segmentation of very high-resolution (VHR) remote sensing (RS) images from different domains. Most existing UDA methods resort to generative adversarial networks (GANs) to cope with the domain shift problem caused by the discrepancies across different domains. However, these GAN-based UDA methods directly align two domains in the appearance, latent, or output space based on convolutional neural networks (CNNs), making them ineffective in exploiting long-range dependencies across the high-level feature maps derived from different domains. Unfortunately, such high-level features play an essential role in characterizing RS images with complex content. To circumvent this obstacle, a mutually boosted attention transformer (MBATrans) is proposed to capture cross-domain dependencies of semantic feature representations in this work. Compared with conventional UDA methods, MBATrans can significantly reduce domain discrepancies by capturing transferable features using global attention. More specifically, MBATrans utilizes a novel mutually boosted attention (MBA) module to align cross-domain feature maps while enhancing domain-general features. Furthermore, a novel GAN-based network with improved discriminative capability is devised by integrating an additional discriminator to learn domain-specific features. Extensive experiments on two large-scale VHR RS datasets, namely, International Society for Photogrammetry and Remote Sensing (ISPRS) Potsdam and Vaihingen, confirm the superior performance of the proposed MBATrans-augmented GAN (MBATA-GAN) architecture. The source code in this work is available at https://github.com/sstary/SSRS.",Generative adversarial networks (GANs),mutually boosted attention (MBA),remote sensing (RS) image,unsupervised domain adaptation (UDA),,,,,,,,,,,,,,,,,
Row_863,"Guo, Rui","Liu, Jianbo","Li, Na","Liu, Shibin","Chen, Fu",Pixel-Wise Classification Method for High Resolution Remote Sensing Imagery Using Deep Neural Networks,ISPRS INTERNATIONAL JOURNAL OF GEO-INFORMATION,MAR 2018,34,"Considering the classification of high spatial resolution remote sensing imagery, this paper presents a novel classification method for such imagery using deep neural networks. Deep learning methods, such as a fully convolutional network (FCN) model, achieve state-of-the-art performance in natural image semantic segmentation when provided with large-scale datasets and respective labels. To use data efficiently in the training stage, we first pre-segment training images and their labels into small patches as supplements of training data using graph-based segmentation and the selective search method. Subsequently, FCN with atrous convolution is used to perform pixel-wise classification. In the testing stage, post-processing with fully connected conditional random fields (CRFs) is used to refine results. Extensive experiments based on the Vaihingen dataset demonstrate that our method performs better than the reference state-of-the-art networks when applied to high-resolution remote sensing imagery classification.",high resolution imagery,remote sensing,convolution neural network,semantic segmentation,data augmentation,deep learning,,,,,,"Cheng, Bo","Duan, Jianbo","Li, Xinpeng","Ma, Caihong",,,,,,
Row_864,"He, Shuang","Lu, Xia","Gu, Jason","Tang, Haitong","Yu, Qin",RSI-Net: Two-Stream Deep Neural Network for Remote Sensing Images-Based Semantic Segmentation,IEEE ACCESS,2022,16,"For semantic segmentation of remote sensing images (RSI), trade-off between representation power and location accuracy is quite important. How to get the trade-off effectively is an open question, where current approaches of utilizing very deep models result in complex models with large memory consumption. In contrast to previous work that utilizes dilated convolutions or deep models, we propose a novel two-stream deep neural network for semantic segmentation of RSI (RSI-Net) to obtain improved performance through modeling and propagating spatial contextual structure effectively and a decoding scheme with image-level and graph-level combination. The first component explicitly models correlations between adjacent land covers and conduct flexible convolution on arbitrarily irregular image regions by using graph convolutional network, while densely connected atrous convolution network (DenseAtrousCNet) with multi-scale atrous convolution can expand the receptive fields and obtain image global information. Extensive experiments are implemented on the Vaihingen, Potsdam and Gaofen RSI datasets, where the comparison results demonstrate the superior performance of RSI-Net in terms of overall accuracy (91.83%, 93.31% and 93.67% on three datasets, respectively), F1 score (90.3%, 91.49% and 89.35% on three datasets, respectively) and kappa coefficient (89.46%, 90.46% and 90.37% on three datasets, respectively) when compared with six state-of-the-art RSI semantic segmentation methods.",Semantics,Image segmentation,Feature extraction,Decoding,Convolutional neural networks,Neural networks,Streaming media,Convolutional neural network (CNN),graph convolutional network (GCN),encoder,decoder,"Liu, Kaiyue","Ding, Haozhou","Chang, Chunqi","Wang, Nizhuan",,feature fusion,semantic segmentation,,,
Row_865,"Zhang, Tong","Zhuang, Yin","Wang, Guanqun","Dong, Shan","Chen, He",Multiscale Semantic Fusion-Guided Fractal Convolutional Object Detection Network for Optical Remote Sensing Imagery,IEEE TRANSACTIONS ON GEOSCIENCE AND REMOTE SENSING,2022,44,"Optical remote sensing object detection is a challenging task, because of the complex background interference, ambiguous appearances of tiny objects, densely arranged circumstances, and multiclass object with vaster scale variances and irregular aspect ratios. The performance of object detection is seriously restricted. Thus, in this article, inspired by the anchor-free object detection framework, and aiming to solve these difficulties to improve the optical remote sensing object detection performance, a powerful one-stage detector of multiscale semantic fusion-guided fractal convolution network (MSFC-Net) is proposed. First, facing these strong-coupled semantic relations in each complex scene, a compound semantic feature fusion (CSFF) way is designed for generating an effective semantic description, which is a benefit to pixel-wise object center point interpretation. In addition, it can be easily extended into a semantic segmentation task. Second, in view of accurate multiclass pixel-wise center point predictions based on an effective compound semantic description, a novel fractal convolution (FC) regression layer is designed, which adaptively achieves the regression of multiscale bounding boxes (bboxes) with irregular aspect ratio under no priori information. Third, related to the set up FC regression layer, a specific hybrid loss is designed to make the proposed MSFC-Net converge better. Finally, the extensive experiments on challenge data sets of large-scale dataset for object detection in aerial images (DOTA) and object detection in optical remote sensing images (DIOR) datasets are carried out, and comparisons indicate that the proposed MSFC-Net can perform the remarkable performance than other state-of-the-art one-stage detectors, as it can reach 80.26% mean average precision (mAP) and 79.33% mF1 on DOTA and 70.08% mAP and 73.45% mF1 on DIOR. Then, our work is available at https://github.com/ZhAnGToNG1/MSFC-Net.",Object detection,Detectors,Semantics,Remote sensing,Optical imaging,Optical detectors,Feature extraction,Anchor-free,compound semantic description,fractal convolution (FC),multiscale feature fusion,"Li, Lianlin",,,,,object detection,optical remote sensing,,,
Row_866,"Li, Xuemei","Wang, Xing","Ye, Huping","Qiu, Shi","Liao, Xiaohan",Multinetwork Algorithm for Coastal Line Segmentation in Remote Sensing Images,IEEE TRANSACTIONS ON GEOSCIENCE AND REMOTE SENSING,2024,1,"The demarcation between the sea and the land, commonly referred to as the coastline, is of paramount importance for the dynamic monitoring of its alterations. This monitoring is essential for the effective utilization of marine resources and the conservation of the ecological environment. Addressing the challenges posed by the extensive expanse of coastal lines, which can complicate their acquisition and processing, this study utilizes remote sensing imagery to introduce an algorithm for coastal line segmentation. The algorithm integrates multiple networks to enhance its effectiveness. Innovations encompass the development of an extraction algorithm for coastal lines that are as follows. First, utilize an attention-guided conditional generative adversarial network (AC-GAN) model, which redefines the task of image segmentation by framing it as a style transformation problem. Second, a strategy for coastal line segmentation utilizes Dense Swin Transformer Unet (DSTUnet) to construct a densely structured model. This approach integrates Transformer to prioritize focal regions, thereby enhancing image and semantic interpretation. Third, a transfer learning framework is proposed to integrate multiple features, leveraging the strengths of different networks to achieve accurate segmentation of coastal lines. The study introduced two datasets, and the experimental results confirm that parallel network configurations and asymmetric weighting are superior in achieving optimal results, with an area overlap measure (AOM) score of 85%, outperforming the Unet by 5%.",Sea measurements,Image segmentation,Feature extraction,Remote sensing,Transformers,Training,Generators,Coastal line,generative adversarial network (GAN),remote sensing,segmentation,,,,,,transformer,Unet,,,
