,author1,author2,author3,author4,author5,title,journal/book,publish time,citation,abstract,keyword1,keyword2,keyword3,keyword4,keyword5,keyword6,keyword7,keyword8,keyword9,keyword10,keyword11,author6,author7,author8,author9,author10,keyword12,keyword13,keyword14,conference,keyword15
Row_906,"Shamsolmoali, Pourya","Zareapoor, Masoumeh","Wang, Ruili","Zhou, Huiyu","Yang, Jie",A Novel Deep Structure U-Net for Sea-Land Segmentation in Remote Sensing Images,IEEE JOURNAL OF SELECTED TOPICS IN APPLIED EARTH OBSERVATIONS AND REMOTE SENSING,SEP 2019,91,"Sea-land segmentation is an important process for many key applications in remote sensing. Proper operative sea-land segmentation for remote sensing images remains a challenging issue due to complex and diverse transition between sea and land. Although several convolutional neural networks (CNNs) have been developed for sea-land segmentation, the performance of these CNNs is far from the expected target. This paper presents a novel deep neural network structure for pixel-wise sea-land segmentation, a residual Dense U-Net (RDU-Net), in complex and high-density remote sensing images. RDU-Net is a combination of both downsampling and upsampling paths to achieve satisfactory results. In each downsampling and upsampling path, in addition to the convolution layers, several densely connected residual network blocks are proposed to systematically aggregate multiscale contextual information. Each dense network block contains multilevel convolution layers, short-range connections, and an identity mapping connection, which facilitates features reuse in the network and makes full use of the hierarchical features from the original images. These proposed blocks have a certain number of connections that are designed with shorter distance backpropagation between the layers and can significantly improve segmentation results while minimizing computational costs. We have performed extensive experiments on two real datasets, Google-Earth and ISPRS, and compared the proposed RDU-Net against several variations of dense networks. The experimental results show that RDU-Net outperforms the other state-of-the-art approaches on the sea-land segmentation tasks.",Deep neural network (DNN),dense network (DenseNet),remote sensing images,sea-land segmentation,U-Net,,,,,,,,,,,,,,,,
Row_907,"Wang, Pan","Zhao, Hengqian","Yang, Zihan","Jin, Qian","Wu, Yanhua",Fast Tailings Pond Mapping Exploiting Large Scene Remote Sensing Images by Coupling Scene Classification and Sematic Segmentation Models,REMOTE SENSING,JAN 2023,6,"In the process of extracting tailings ponds from large scene remote sensing images, semantic segmentation models usually perform calculations on all small-size remote sensing images segmented by the sliding window method. However, some of these small-size remote sensing images do not have tailings ponds, and their calculations not only affect the model accuracy, but also affect the model speed. For this problem, we proposed a fast tailings pond extraction method (Scene-Classification-Sematic-Segmentation, SC-SS) that couples scene classification and semantic segmentation models. The method can map tailings ponds rapidly and accurately in large scene remote sensing images. There were two parts in the method: a scene classification model, and a semantic segmentation model. Among them, the scene classification model adopted the lightweight network MobileNetv2. With the help of this network, the scenes containing tailings ponds can be quickly screened out from the large scene remote sensing images, and the interference of scenes without tailings ponds can be reduced. The semantic segmentation model used the U-Net model to finely segment objects from the tailings pond scenes. In addition, the encoder of the U-Net model was replaced by the VGG16 network with stronger feature extraction ability, which improves the model's accuracy. In this paper, the Google Earth images of Luanping County were used to create the tailings pond scene classification dataset and tailings pond semantic segmentation dataset, and based on these datasets, the training and testing of models were completed. According to the experimental results, the extraction accuracy (Intersection Over Union, IOU) of the SC-SS model was 93.48%. The extraction accuracy of IOU was 15.12% higher than the U-Net model, while the extraction time was shortened by 35.72%. This research is of great importance to the remote sensing dynamic observation of tailings ponds on a large scale.",tailings ponds,large scene remote sensing images,deep learning,fast mapping,,,,,,,,"Xia, Pengjiu","Meng, Lingxuan",,,,,,,,
Row_908,"Long, Jiang","Li, Mengmeng","Wang, Xiaoqin",,,Integrating Spatial Details With Long-Range Contexts for Semantic Segmentation of Very High-Resolution Remote-Sensing Images,IEEE GEOSCIENCE AND REMOTE SENSING LETTERS,2023,13,"This letter presents a cross-learning network (i.e., CLCFormer) integrating fine-grained spatial details within long-range global contexts based upon convolutional neural networks (CNNs) and transformer, for semantic segmentation of very high-resolution (VHR) remote-sensing images. More specifically, CLCFormer comprises two parallel encoders, derived from the CNN and transformer, and a CNN decoder. The encoders are backboned on SwinV2 and EfficientNet-B3, from which the extracted semantic features are aggregated at multiple levels using a bilateral feature fusion module (BiFFM). First, we used attention gate (ATG) modules to enhance feature representation, improving segmentation results for objects with various shapes and sizes. Second, we used an attention residual (ATR) module to refine spatial features's learning, alleviating boundary blurring of occluded objects. Finally, we developed a new strategy, called auxiliary supervise strategy (ASS), for model optimization to further improve segmentation performance. Our method was tested on the WHU, Inria, and Potsdam datasets, and compared with CNN-based and transformer-based methods. Results showed that our method achieved state-of-the-art performance on the WHU building dataset (92.31% IoU), Inria building dataset (83.71% IoU), and Potsdam dataset (80.27% MIoU). We concluded that CLCFormer is a flexible, robust, and effective method for the semantic segmentation of VHR images. The codes of the proposed model are available at https://github.com/long123524/CLCFormer.",Feature extraction,Transformers,Semantics,Convolutional neural networks,Convolution,Buildings,Tiles,Auxiliary supervise,CLCFormer,convolutional neural networks (CNNs),semantic segmentation,,,,,,transformer,very high-resolution (VHR) images,,,
Row_909,"Wang, Yiwen","Lyn, Ye","Cao, Yanpeng","Yang, Michael Ying",,DEEP LEARNING FOR SEMANTIC SEGMENTATION OF UAV VIDEOS,,2019,4,"As one of the key problems in both remote sensing and computer vision, video semantic segmentation has been attracting increasing amounts of attention. Using video segmentation technique for Unmanned Aerial Vehicle (UAV) data processing is also a popular application. Previous methods extended single image segmentation approaches to multiple frames. The temporal dependencies are ignored in these methods. This paper proposes a novel segmentation method to solve this problem. Combining the fully convolutional networks (FCN) and the Convolution Long Short Term Memory (Conv-LSTM) together, we segment the sequence of the video frames instead of segmenting each individual frame separately. FCN serves as the frame-based segmentation method. Conv-LSTM makes use of the temporal information between consecutive frames. Experimental results show the superiority of this method especially in some classes compared to the single image segmentation model using video dataset from UAV.",FCN,Conv-LSTM,video semantic segmentation,UAV,,,,,,,,,,,,,,,,2019 IEEE INTERNATIONAL GEOSCIENCE AND REMOTE SENSING SYMPOSIUM (IGARSS 2019),
Row_910,"Tang, Kai","Xu, Fei","Chen, Xuehong","Dong, Qi","Yuan, Yuheng",The ClearSCD model: Comprehensively leveraging semantics and change relationships for semantic change detection in high spatial resolution remote sensing imagery,ISPRS JOURNAL OF PHOTOGRAMMETRY AND REMOTE SENSING,MAY 2024,7,"The Earth has been undergoing continuous anthropogenic and natural change. High spatial resolution (HSR) remote sensing imagery provides a unique opportunity to accurately reveal these changes on a planetary scale. Semantic change detection (SCD) with HSR imagery has become a common technique for tracking the evolution of land surface types at a semantic level. However, existing SCD methods rarely model the dependency between semantics and changes, resulting in suboptimal accuracy in detecting complicated surface changes. To address this limitation, we propose ClearSCD, a multi-task learning model that leverages the mutual gain relationship between semantics and change through three innovative modules. The first module interprets semantic features at different times into posterior probabilities for surface types to detect binary change information; the second module learns the correlation between surface types over time and the binary change information; a semantic augmented contrastive learning module is used as the third module to improve the performance of the other two modules. We tested ClearSCD's performance against state-of-the-art methods on benchmark datasets and a real- world scenario (named LsSCD dataset), showing that ClearSCD outperformed the alternatives on mIoUscmetrics sc metrics by 1.23% to 19.34%. Furthermore, ablation experiments demonstrated the unique contribution of the three innovative modules to performance improvement. The high computational efficiency and robust performance over diverse landscapes demonstrate that ClearSCD is an operational tool for detecting detailed land surface changes from HSR imagery. Code and LsSCD dataset available at https://github.com/tangkai-RS/ClearSCD.",Remote sensing,Change detection,Semantic change detection,Semantic segmentation,Deep learning,Multi-task learning,,,,,,"Chen, Jin",,,,,,,,,
Row_911,"Zhang, Di","Zhao, Jiaqi","Chen, Jingyang","Zhou, Yong","Shi, Boyu",Edge-aware and spectral-spatial information aggregation network for multispectral image semantic segmentation,ENGINEERING APPLICATIONS OF ARTIFICIAL INTELLIGENCE,SEP 2022,13,"Semantic segmentation is a fundamental task in the field of remote sensing image intelligent interpretation and computer vision. Multispectral remote sensing images have attracted more and more researchers' attention because they can accurately describe different types of reflection spectra. However, inaccurate multispectral feature description leads to edge semantic ambiguity and misclassification of small objects. In this article, we propose a novel network named edge-aware and spectral-spatial information aggregation net (ESSANet) to capture both high-level semantic features and low-level edge details for semantic segmentation of remote sensing images. Specifically, on the one hand, in order to improve the representation ability of discriminant features, we design a two-stream spectral-spatial feature extraction network via 3D hybrid convolution and multi-level aggregation network. On the other hand, in order to eliminate the effect of edge semantic ambiguity, we develop a siamese edge-aware structure and multi-stage edge loss function. Experimental results show that our method achieved 3.5% and 4.09% mean intersection over union (mIoU) score improvements and 2.59% and 3.32% Kappa score improvements compared with the competitive baseline algorithm on the SEN12MS and US3D datasets, respectively. In addition, the method proposed in this paper also achieves a better trade-off between speed and accuracy.",Spectral&ndash,spatial information,Edge-aware,Remote sensing,Multispectral semantic segmentation,,,,,,,"Yao, Rui",,,,,,,,,
Row_912,"Wang, Guoying","Chen, Jiahao","Mo, Lufeng","Wu, Peng","Yi, Xiaomei",Border-Enhanced Triple Attention Mechanism for High-Resolution Remote Sensing Images and Application to Land Cover Classification,REMOTE SENSING,AUG 2024,2,"With the continuous development and popularization of remote sensing technology, remote sensing images have been widely used in the field of land cover classification. Since remote sensing images have complex spatial structure and texture features, it is becoming a challenging problem to accurately categorize them. Land cover classification has practical application value in various fields, such as environmental monitoring and protection, urban and rural planning and management, and climate change research. In recent years, remote sensing image classification methods based on deep learning have been rapidly developed, in which semantic segmentation technology has become one of the mainstream methods for land cover classification using remote sensing image. Traditional semantic segmentation algorithms tend to ignore the edge information, resulting in poor classification of the edge part in land cover classification, and there are numerous attention mechanisms to make improvements for these problems. In this paper, a triple attention mechanism, BETAM (Border-Enhanced Triple Attention Mechanism), for edge feature enhancement of high-resolution remote sensing images is proposed. Furthermore, a new model on the basis of the semantic segmentation network model DeeplabV3+ is also introduced, which is called DeepBETAM. The triple attention mechanism BETAM is able to capture feature dependencies in three dimensions: position, space, and channel, respectively. Through feature importance weighting, modeling of spatial relationships, and adaptive learning capabilities, the model BETAM pays more attention to edge features, thus improving the accuracy of edge detection. A remote sensing image dataset SMCD (Subject Meticulous Categorization Dataset) is constructed to verify the robustness of the attention mechanism BETAM and the model DeepBETAM. Extensive experiments were conducted on the two self-built datasets FRSID and SMCD. Experimental results showed that the mean Intersection over Union (mIoU), mean Pixel Accuracy (mPA), and mean Recall (mRecall) of DeepBETAM are 63.64%, 71.27%, and 71.31%, respectively. These metrics are superior to DeeplabV3+, DeeplabV3+(SENet), DeeplabV3+(CBAM), DeeplabV3+(SAM), DeeplabV3+(ECANet), and DeeplabV3+(CAM), which are network models that incorporate different attention mechanisms. The reason is that BETAM has better edge segmentation results and segmentation accuracy. Meanwhile, on the basis of the self-built dataset, the four main classifications of buildings, cultivated land, water bodies and vegetation were subdivided and detected, and good experimental results were obtained, which verified the robustness of the attention mechanism BETAM and the model DeepBETAM. The method has broad application prospects and can provide favorable support for research and application in the field of surface classification.",semantic segmentation,remote sensing image,BETAM,triple attention mechanism,edge detection,,,,,,,,,,,,,,,,
Row_913,"Nunes de Castro, Heitor da Rocha","de Carvalho Junior, Osmar Abilio","Ferreira de Carvalho, Osmar Luiz","Trancoso Gomes, Roberto Arnaldo","Fontes Guimaraes, Renato",DETECTION OF KARST DEPRESSIONS IN BRAZIL USING DEEP SEMANTIC SEGMENTATION,,2023,0,"This research aims to investigate the use of semantic segmentation and Shuttle Radar Topography Mission (SRTM) data in detecting natural karst depressions developed on the carbonate rocks of the Neoproterozoic Bambui Group in Western Bahia, Brazil. The study area is a karst landscape containing depressions enclosed in limestone, many forming lakes. The methodology had the following steps: (a) visual interpretation of karst depressions from Sentinel-2 and OLI-Landsat 8 images; (b) generation of DEM-based sink depth plus nine morphometric attributes; (c) selection of 128x128-pixel samples for training (1600), validation (400), and testing (400) considering two channels (DEM and sink depth based on DEM) and eleven channels (the two previous ones and the morphometric attributes); and (d) semantic segmentation using U-Net architecture with EfficientNet-B7 backbone. The accuracy metrics were 98.26, 72.82, 79.50, 79.16, and 65.51 for OA, precision, recall, F-score, and IoU when considering SRTM plus morphometric attributes (11 channels).",Semantic segmentation,sparse annotation,iterative learning,remote sensing,,,,,,,,,,,,,,,,IGARSS 2023 - 2023 IEEE INTERNATIONAL GEOSCIENCE AND REMOTE SENSING SYMPOSIUM,
Row_914,"Ye, Wenhui","Lei, Weimin","Zhang, Wei","Yu, Tingting","Feng, Xiang",GFSCompNet: remote sensing image compression network based on global feature-assisted segmentation,MULTIMEDIA TOOLS AND APPLICATIONS,JAN 2024,1,"The proliferation of remote sensing image data in recent years has posed a pressing need for efficient compression techniques due to constrained transmission bandwidth. While lossless compression preserves image fidelity, it falls short of meeting real-time demands. Conversely, conventional lossy compression methods can attain high compression ratios for real-time applications, but often introduce issues like block artifacts, blurring, and distortions in the decompressed images. Hence, we propose the Global Feature-Assisted Segmentation Compression Network (GFSCompNet) as a solution for high compression ratio lossy compression. Initially, we design a segmentation network utilizing a dual-branch global feature-assisted segmentation approach to precisely detect small targets in remote sensing images. On the compression side of the network, we leverage an attention mechanism and code rate allocation technique to seamlessly merge the segmented small target information with the original image, thereby allocating a higher compression code rate to the small target region. Furthermore, a joint hyper-priority decoding and entropy coding estimation network is proposed to further remove the redundancy in the potential representation and improve the compression ratio. Experimental results conducted under conditions of high compression ratios and comparable bit rates demonstrate that our approach yields higher-quality reconstructed images compared to the JPEG algorithm and outperforms other deep learning-based image compression methods. Additionally, it effectively preserves small target information, thereby enhancing the interpretability of machine learning models.",Remote sensing image,Image compression,Semantic segmentation,Feature fusion,Separate hyperprior decoders,,,,,,,,,,,,,,,,
Row_915,"Shen, Zhengwei","Shang, Yongheng","Zhang, Xiaoyu","Yin, Jianwei","Han, Jun",CMMSNet:A Multi-modal Semantic Segmentation Network for Rooftop Extraction based on SAR and Optical Images,INTERNATIONAL JOURNAL OF APPLIED EARTH OBSERVATION AND GEOINFORMATION,2024,0,"Distributed rooftop photovoltaic systems hold immense potential for renewable energy generation, and accurate extraction of building roofs from high-resolution remote sensing imagery is crucial for their development. While current semantic segmentation methods primarily rely on single-modality optical images, Synthetic Aperture Radar (SAR) offers complementary ground information that can significantly enhance segmentation accuracy. However, the modality disparities arising from different imaging mechanisms pose challenges in feature fusion between SAR and optical images, existing approaches rely on simplistic fusion methods to exploit the complementary information of each modality, ignoring the correlative information between the different modalities during feature extraction, this results in an insufficient integration of complementary information.To address these challenges, we introduce CMMSNet, a novel multi-modal fusion semantic segmentation network specifically designed for building roof extraction. The main architecture of CMMSNet is constituted by three three core modules: the feature extraction encoder module, the heterogeneous modality alignment module, and the modality fusion decoder module. Initially, dual independent pyramid-structured encoders are employed by CMMSNet to separately extract feature pyramids from SAR and optical images at various scales, this strategy is intended to capture multi-scale semantic contexts and address the issue of large spatial scale variations among different objects in remote sensing images. Furthermore, an Adaptive Feature Alignment Module (AFAM) is introduced, tasked with identifying correlative information between the two modalities from a spatial dimension and aligning the modal features accordingly, this process is crucial for facilitating cross-modal learning and in enhancing the feature representation of each modality. In addition, a Cross-Modal Multi-Scale Feature Fusion (CMMSFF) module is designed to effectively integrates multi-scale and multi-modal heterogeneous features from both modalities, this module employs a channel self-attention mechanism, which adaptively fuses discriminative features by applying weights to each modality and selectively discarding irrelevant components, thus enhancing the selection and fusion of key channels within the multimodal features set. This innovative approach allows us to harness the complementary information provided by SAR and optical images, enhancing the overall segmentation performance. A series of comprehensive experiments conducted on the DFC23 dataset demonstrate that our proposed CMMSNet outperforms other existing mainstream semantic segmentation methods in both stability and effectiveness, including both single-modal and multi-modal approaches. This achievement sets a new benchmark for the extraction of building rooftop through the use of multi-modal remote sensing images. Our findings highlight the importance of leveraging multi-modal data fusion in addressing real-world challenges in remote sensing image analysis and offer valuable insights for future research in this domain.",Building extraction,Multi-modal fusion,Remote sensing,semantic segmentation,,,,,,,,"Cai, Chao",,,,,,,,,
Row_916,"Lekavicius, Justinas","Gruzauskas, Valentas",,,,Data Augmentation with Generative Adversarial Network for Solar Panel Segmentation from Remote Sensing Images,ENERGIES,JUL 2024,2,"With the popularity of solar energy in the electricity market, demand rises for data such as precise locations of solar panels for efficient energy planning and management. However, these data are not easily accessible; information such as precise locations sometimes does not exist. Furthermore, existing datasets for training semantic segmentation models of photovoltaic (PV) installations are limited, and their annotation is time-consuming and labor-intensive. Therefore, for additional remote sensing (RS) data creation, the pix2pix generative adversarial network (GAN) is used, enriching the original resampled training data of varying ground sampling distances (GSDs) without compromising their integrity. Experiments with the DeepLabV3 model, ResNet-50 backbone, and pix2pix GAN architecture were conducted to discover the advantage of using GAN-based data augmentations for a more accurate RS imagery segmentation model. The result is a fine-tuned solar panel semantic segmentation model, trained using transfer learning and an optimal amount-60% of GAN-generated RS imagery for additional training data. The findings demonstrate the benefits of using GAN-generated images as additional training data, addressing the issue of limited datasets, and increasing IoU and F1 metrics by 2% and 1.46%, respectively, compared with classic augmentations.",deep learning,solar panels,semantic segmentation,data augmentation,generative adversarial network,remote sensing,transfer learning,,,,,,,,,,,,,,
Row_917,"Xiao, Tao","Liu, Yikun","Huang, Yuwen","Yang, Gongping",,MFRNet: A Multipath Feature Refinement Network for Semantic Segmentation in High-Resolution Remote Sensing Images,REMOTE SENSING LETTERS,DEC 2 2022,3,"Deep convolutional neural networks have made significant progress in the field of intelligent analysis of remote-sensing images. However, the semantic segmentation task in high-resolution remote-sensing (HRRS) images always faces the problem of large-scale variation and complex background samples, which causes difficulties in distinguishing confusable ground objects. In this letter, we propose a novel multipath feature refinement network (MFRNet) to alleviate the above problems. We design the feature refinement module (FRM) to fuse features at various scales, which helps to capture different levels of spatial information. It also alleviates the boundary ambiguity problem by enhancing the learning of features with boundary information. The multiscale feature attention module (MFAM) combines atrous convolution and non-local block to obtain larger receptive fields and long-range contextual information, while the feature fusion module (FFM) balances semantic and spatial information, further improving the embedding of locally discriminative features. Experimental results on ISPRS Potsdam and LoveDA datasets indicate that the proposed MFRNet outperforms other semantic segmentation methods and excels in the accuracy and consistency of object boundary segmentation.",,,,,,,,,,,,,,,,,,,,,
