,author1,author2,author3,title,journal/book,publish time,citation,abstract,keyword1,keyword2,keyword3,keyword4,keyword5,author4,conference,author5,keyword6,author6,author7,keyword7,keyword8,keyword9,keyword10,keyword11,keyword12,author8,author9,author10,author11,keyword13,keyword14,keyword15,keyword16,author12
Row_1053,"Li, Jiayi","Hu, Yuping","Huang, Xin",CaSaFormer: A cross- and self-attention based lightweight network for large-scale building semantic segmentation,INTERNATIONAL JOURNAL OF APPLIED EARTH OBSERVATION AND GEOINFORMATION,JUN 2024,1,"Buildings play a crucial role in geographic information systems, and advancements in the resolution of remote sensing imagery have facilitated their extraction on a larger scale. However, this progress has simultaneously heightened the requirements for methods to demonstrate efficiency and enhanced generalization performance. For this purpose, we propose a lightweight building semantic segmentation network, named CaSaFormer. Specifically, we propose an efficient module composed of Cross-attention and Self-attention Blocks connected in series (CaSa Block), to extract valuable semantic information from the feature pyramid. Furthermore, a novel Cross-Attention Gate Fusion (CAGF) module was developed to effectively integrate complementary components from global semantic features and local spatial features. Experiment results have demonstrated that our CaSaFormer outperforms state-of-the-art (SOTA) lightweight methods with best trade-off between accuracy and efficiency, showing a 1.92 % improvement in IoU and 16 % of the computation complexity. When compared to non-lightweight methods under equivalent computational resources, an impressive 1.69 % IoU gain is also achieved with only 1.7 % of the computation complexity. The code is available at: https://github.com/ YpingHu/CaSaFormer.",Large-scale building extraction,Remote sensing,Lightweight network,Attention mechanism,Semantic segmentation,,,,,,,,,,,,,,,,,,,,,
Row_1054,"Panboonyuen, Teerapong","Charoenphon, Chaiyut","Satirapod, Chalermchon",MeViT: A Medium-Resolution Vision Transformer for Semantic Segmentation on Landsat Satellite Imagery for Agriculture in Thailand,REMOTE SENSING,NOV 2023,1,"Semantic segmentation is a fundamental task in remote sensing image analysis that aims to classify each pixel in an image into different land use and land cover (LULC) segmentation tasks. In this paper, we propose MeViT (Medium-Resolution Vision Transformer) on Landsat satellite imagery for the main economic crops in Thailand as follows: (i) para rubber, (ii) corn, and (iii) pineapple. Therefore, our proposed MeViT enhances vision transformers (ViTs), one of the modern deep learning on computer vision tasks, to learn semantically rich and spatially precise multi-scale representations by integrating medium-resolution multi-branch architectures with ViTs. We revised mixed-scale convolutional feedforward networks (MixCFN) by incorporating multiple depth-wise convolution paths to extract multi-scale local information to balance the model's performance and efficiency. To evaluate the effectiveness of our proposed method, we conduct extensive experiments on the publicly available dataset of Thailand scenes and compare the results with several state-of-the-art deep learning methods. The experimental results demonstrate that our proposed MeViT outperforms existing methods and performs better in the semantic segmentation of Thailand scenes. The evaluation metrics used are precision, recall, F1 score, and mean intersection over union (IoU). Among the models compared, MeViT, our proposed model, achieves the best performance in all evaluation metrics. MeViT achieves a precision of 92.22%, a recall of 94.69%, an F1 score of 93.44%, and a mean IoU of 83.63%. These results demonstrate the effectiveness of our proposed approach in accurately segmenting Thai Landsat-8 data. The achieved F1 score overall, using our proposed MeViT, is 93.44%, which is a major significance of this work.",semantic segmentation,deep learning,remote sensing imagery,transformer,Landsat,,,,,,,,,,,,,,,,,,,,,
Row_1055,"Sun, Xiao","Qian, Yurong","Cao, Ruyi",BGFNet: Semantic Segmentation Network Based on Boundary Guidance,IEEE GEOSCIENCE AND REMOTE SENSING LETTERS,2024,2,"Over the past few years, there have been significant advancements in deep learning technology, leading to remarkable progress in the field of image analysis. However, when it comes to handling complex remote sensing images, current semantic segmentation methods still face challenges and do not perform as well as desired. How to obtain both spatial detail information and semantic information at the same time is an urgent problem to be solved. This letter proposes a context fusion network based on boundary guidance (BGFNet), which incorporates the patch attention module (PAM), the feature maps are enriched with contextual information, improving their ability to capture spatial dependencies. In order to alleviate boundary ambiguity, a boundary guidance module (BGM) is used to weight features with rich semantic boundary information. Furthermore, the compatible fusion module (CFM) is employed to merge high-order and low-order features, creating novel features. Channel attention is then applied to the obtained features allows us to select the desired features by filtering out irrelevant information. We validate our model on the Vaihingen and Potsdam datasets reached 81.65% and 86.94% mean intersection over union (mIoU), respectively, indicating the superiority of the proposed model.",Semantics,Feature extraction,Remote sensing,Semantic segmentation,Computer architecture,"Tuerxun, Palidan",,"Hu, Zhehao",Image edge detection,,,Convolution,Boundary guidance,compatible fusion,patch attention,remote sensing,semantic segmentation,,,,,,,,,
Row_1056,"He, Zhe","Tao, Yuxiang","Luo, Xiaobo",Road Extraction from Remote Sensing Image Based on an Improved U-Net,LASER & OPTOELECTRONICS PROGRESS,AUG 2023,2,"Road information extracted from remote sensing images is of great value in urban planning, traffic management, and other fields. However, owing to the complex background, obstacles, and numerous similar nonroad areas, high -quality road information extraction from remote sensing images is still challenging. In this work, we propose HSA-UNet, a road information extraction method based on mixed -scale attention and U -Net, for high -quality remote sensing images. First, an attention residual learning unit, composed of a residual structure and an attention feature fusion mechanism, is used in the coding network to improve the extraction ability of global and local features. Second, owing to roads with the characteristics of large spans, narrowness, and continuous distribution, the attention -enhanced atrous spatial pyramid pooling module is added to the bridge network to enhance the ability of road features extraction at different scales. Experiments were performed on Massachusetts roads dataset, and the results showed that HSA-UNet significantly outperformed D-LinkNet, DeepLabV3+ , and other semantic segmentation networks in terms of F1, intersection over union, and other evaluation indicators.",remote sensing,remote sensing image,semantic segmentation,road extraction,scale attention,"Xu, Hao",,,attentional feature fusion,,,,,,,,,,,,,,,,,
Row_1057,"Sun, Jun","Yang, Shiqi","Gao, Xuesong",MASA-SegNet: A Semantic Segmentation Network for PolSAR Images,REMOTE SENSING,JUL 2023,5,"Semantic segmentation of Polarimetric SAR (PolSAR) images is an important research topic in remote sensing. Many deep neural network-based semantic segmentation methods have been applied to PolSAR image segmentation tasks. However, a lack of effective means to deal with the similarity of object features and speckle noise in PolSAR images exists. Thisstudy aims to improve the discriminative capability of neural networks for various intensities of backscattering coefficients while reducing the effects of noise in PolSAR semantic segmentation tasks. Firstly, we propose pre-processing methods for PolSAR image data, which consist of the fusion of multi-source data and false color mapping. Then, we propose a Multi-axis Sequence Attention Segmentation Network (MASA-SegNet) for semantic segmentation of PolSAR data, which is an encoder-decoder framework. Specifically, within the encoder, a feature extractor is designed and implemented by stacking Multi-axis Sequence Attention blocks to efficiently extract PolSAR features at multiple scales while mitigating inter-class similarities and intra-class differences from speckle noise. Moreover, the process of serialized residual connection design enables the propagation of spatial information throughout the network, thereby improving the overall spatial awareness of MASA-SegNet. Within the decoder, it is used to accomplish the semantic segmentation task. The superiority of this algorithm for semantic segmentation will be explored through feature visualization. The experiments show that our proposed spatial sequence attention mechanism can effectively extract features and reduce noise interference and is thus able to obtain the best results on two large-scale public datasets (the AIR-POlSAR-Seg and FUSAR-Map datasets).",PolSAR image,semantic segmentation,multi-axis sequence attention,,,"Ou, Dinghua",,"Tian, Zhaonan",,"Wu, Jing","Wang, Mantao",,,,,,,,,,,,,,,
Row_1058,"Ulku, Irem",,,ResLMFFNet: a real-time semantic segmentation network for precision agriculture,JOURNAL OF REAL-TIME IMAGE PROCESSING,JUL 2024,0,"Lightweight multiscale-feature-fusion network (LMFFNet), a proficient real-time CNN architecture, adeptly achieves a balance between inference time and accuracy. Capturing the intricate details of precision agriculture target objects in remote sensing images requires deep SEM-B blocks in the LMFFNet model design. However, employing numerous SEM-B units leads to instability during backward gradient flow. This work proposes the novel residual-LMFFNet (ResLMFFNet) model for ensuring smooth gradient flow within SEM-B blocks. By incorporating residual connections, ResLMFFNet achieves improved accuracy without affecting the inference speed and the number of trainable parameters. The results of the experiments demonstrate that this architecture has achieved superior performance compared to other real-time architectures across diverse precision agriculture applications involving UAV and satellite images. Compared to LMFFNet, the ResLMFFNet architecture enhances the Jaccard Index values by 2.1% for tree detection, 1.4% for crop detection, and 11.2% for wheat-yellow rust detection. Achieving these remarkable accuracy levels involves maintaining almost identical inference time and computational complexity as the LMFFNet model. The source code is available on GitHub: https://github.com/iremulku/Semantic-Segmentation-in-Precision-Agriculture.",Real-time semantic segmentation,Remote sensing,Precision agriculture,,,,,,,,,,,,,,,,,,,,,,,
Row_1059,"Marmanis, D.","Schindler, K.","Wegner, J. D.",SEMANTIC SEGMENTATION OF AERIAL IMAGES WITH EXPLICIT CLASS-BOUNDARY MODELING,,2017,1,"In this work we propose an end-to-end trainable supervised Deep Convolutional Neural Network (DCNN) targeting the task of semantic-segmentation with the addition of class-aware boundary detection. Through this explicit modeling of the class-boundaries, we enforce the network to extract coherent and complete objects, suppressing the uncertainty influencing these regions. Importantly, we show that class-boundary networks in conjunction with DCNN performs optimally, achieving over 90% overall accuracy (OA) on the challenging ISPRS Vaihingen Semantic Segmentation benchmark.",semantic-segmentation,CNN,FCN,VHSR,aerial imagery,"Datcu, M.",2017 IEEE INTERNATIONAL GEOSCIENCE AND REMOTE SENSING SYMPOSIUM (IGARSS),"Stilla, U.",,,,,,,,,,,,,,,,,,
Row_1060,"Ayala, Christian","Aranda, Carlos","Galar, Mikel",Multi-Class Strategies for Joint Building Footprint and Road Detection in Remote Sensing,APPLIED SCIENCES-BASEL,SEP 2021,4,"Building footprints and road networks are important inputs for a great deal of services. For instance, building maps are useful for urban planning, whereas road maps are essential for disaster response services. Traditionally, building and road maps are manually generated by remote sensing experts or land surveying, occasionally assisted by semi-automatic tools. In the last decade, deep learning-based approaches have demonstrated their capabilities to extract these elements automatically and accurately from remote sensing imagery. The building footprint and road network detection problem can be considered a multi-class semantic segmentation task, that is, a single model performs a pixel-wise classification on multiple classes, optimizing the overall performance. However, depending on the spatial resolution of the imagery used, both classes may coexist within the same pixel, drastically reducing their separability. In this regard, binary decomposition techniques, which have been widely studied in the machine learning literature, are proved useful for addressing multi-class problems. Accordingly, the multi-class problem can be split into multiple binary semantic segmentation sub-problems, specializing different models for each class. Nevertheless, in these cases, an aggregation step is required to obtain the final output labels. Additionally, other novel approaches, such as multi-task learning, may come in handy to further increase the performance of the binary semantic segmentation models. Since there is no certainty as to which strategy should be carried out to accurately tackle a multi-class remote sensing semantic segmentation problem, this paper performs an in-depth study to shed light on the issue. For this purpose, open-access Sentinel-1 and Sentinel-2 imagery (at 10 m) are considered for extracting buildings and roads, making use of the well-known U-Net convolutional neural network. It is worth stressing that building and road classes may coexist within the same pixel when working at such a low spatial resolution, setting a challenging problem scheme. Accordingly, a robust experimental study is developed to assess the benefits of the decomposition strategies and their combination with a multi-task learning scheme. The obtained results demonstrate that decomposing the considered multi-class remote sensing semantic segmentation problem into multiple binary ones using a One-vs.-All binary decomposition technique leads to better results than the standard direct multi-class approach. Additionally, the benefits of using a multi-task learning scheme for pushing the performance of binary segmentation models are also shown.",Sentinel-1,Sentinel-2,remote sensing,building detection,road detection,,,,deep learning,,,convolutional neural networks,multi-class semantic segmentation,binary semantic segmentation,multi-task semantic segmentation,,,,,,,,,,,
Row_1061,"Akodad, Sara","Gbodjo, Yawogan Jean Eudes","Lassalle, Pierre",Leveraging Physical Augmentations From Multiview Remote Sensing Images for Building Segmentation,IEEE GEOSCIENCE AND REMOTE SENSING LETTERS,2025,0,"Building segmentation from remote sensing data has been boosted in recent years by the advances in data processing algorithms and the improved ability of sensors to capture very high spatial resolution (VHSR) images. The prevailing approaches to this task are built upon deep semantic segmentation networks learned on ortho geometry, i.e., orthorectified images. In this study, we propose to deal with the building segmentation using multiview Pl & eacute;iades satellite images at the perfect sensor (PS) geometry instead of the ortho geometry. This has two main advantages: 1) it frees the segmentation workflow from geometric imprecision that may arise after the image rectification step and 2) it allows the physical augmentations of the ground truth (GT) by reprojecting building objects on each of the multiview acquisitions. The GT reprojection process makes use of rational polynomial coefficients (RPCs) provided as image metadata and a fine scale digital surface model (DSM). We assess the benefit of our proposal using a U-Net encoder-decoder learned on a dataset composed of tri-stereo Pl & eacute;iades acquisitions over six French cities. Experimental results demonstrate the significance of the proposal especially an enhanced generalization capability for the building segmentation.",Geometry,Sensors,Buildings,Image segmentation,Image sensors,"Brunet, Pierre-Marie",,,Spatial resolution,,,Remote sensing,Polynomials,Location awareness,Training,Image geometry,perfect sensor,,,,,Pl & eacute;iades,rational polynomial coefficients (RPCs),tri-stereo views,U-Net,
Row_1062,"Miao, Shoukuan","Xia, Min","Qian, Ming",Cloud/shadow segmentation based on multi-level feature enhanced network for remote sensing imagery,INTERNATIONAL JOURNAL OF REMOTE SENSING,AUG 18 2022,47,"In the application of remote sensing, cloud blocking brings trouble to the analysis of surface parameters and atmospheric parameters. Due to the complexity of the background, the influence of some cloud-like interferences (such as ice, snow, buildings, etc.) and the complexity of the cloud shape, the traditional deep learning method is difficult to segment the edge information of cloud and cloud shadow accurately, resulting in misjudgement at the edge. In order to solve these problems, a multilevel feature enhanced network is proposed for cloud/shadow segmentation. In this work, ResNet-18 is used as the backbone to extract all levels of semantic information, and Feature Enhancement Module is proposed to strengthen the feature information to obtain more effective feature information. Multiscale Fusion module is constructed to fuses multiscale features of deep information to obtain global feature information while considering local feature information. Finally, through the Feature Guidance module, low-level features are used to guide the high-level features to guide the recovery of spatial information and improve the efficiency of upsampling. On the data collected by Landsat-8, Sentinel-2, and HRC_WHU data set, the experimental results show that this method is superior to the existing methods.",Cloud,shadow segmentation,Remote-sensing images,Feature enhanced network,Deep learning,"Zhang, Yonghong",,"Liu, Jia",,"Lin, Haifeng",,,,,,,,,,,,,,,,
Row_1063,Yang Xiaoyu,Wang Xili,,Building Segmentation Model of Remote Sensing Image Combining Multiscale Attention and Edge Supervision,LASER & OPTOELECTRONICS PROGRESS,NOV 2022,3,"Remote sensing image segmentation is a crucial application in the field of remote sensing image processing. A semantic segmentation network MAE-Net combining multiscale attention and edge supervision is proposed based on the deep learning network U-Net to address the phenomena of building missing classification, missing segmentation. and inaccurate building contour segmentation in the building segmentation of remote sensing images via convolution neural network. First, a multiscale attention module is introduced into each layer during the coding stage. The module separates the input feature map into equal channels and employs the convolution kernels of various sizes for feature extraction in each group. Thereafter, the channel attention mechanism is used in each group to gain more efficient features through self-learning to solve the problem of inaccurate feature extraction of buildings of various sizes. Second, in the decoding stage, the edge extraction module is introduced to build the edge supervision network. The error between the learning edge label and expected edge is supervised by the loss function to aid the segmentation network in better learning the building edge features and make the building boundary's segmentation result more continuous and smoother. The experimental findings show that MAE-Net can completely segment buildings from remote sensing images with complicated and diverse backgrounds and large-scale changes, and the segmentation accuracy is higher.",image processing,neural network,remote sensing image,multiscale feature extraction,attention mechanism,,,,edge supervision,,,,,,,,,,,,,,,,,
Row_1064,"Zhang, Jun","Qiang, Zhenping","Lin, Hong",Research on Tobacco Field Semantic Segmentation Method Based on Multispectral Unmanned Aerial Vehicle Data and Improved PP-LiteSeg Model,AGRONOMY-BASEL,JUL 2024,2,"In recent years, the estimation of tobacco field areas has become a critical component of precision tobacco cultivation. However, traditional satellite remote sensing methods face challenges such as high costs, low accuracy, and susceptibility to noise, making it difficult to meet the demand for high precision. Additionally, optical remote sensing methods perform poorly in regions with complex terrain. Therefore, Unmanned Aerial Vehicle multispectral remote sensing technology has emerged as a viable solution due to its high resolution and rich spectral information. This study employed a DJI Mavic 3M equipped with high-resolution RGB and multispectral cameras to collect tobacco field data covering five bands: RGB, RED, RED EDGE, NIR, and GREEN in Agang Town, Luoping County, Yunnan Province, China. To ensure the accuracy of the experiment, we used 337, 242, and 215 segmented tobacco field images for model training, targeting both RGB channels and seven-channel data. We developed a tobacco field semantic segmentation method based on PP-LiteSeg and deeply customized the model to adapt to the characteristics of multispectral images. The input layer's channel number was adjusted to multiple channels to fully utilize the information from the multispectral images. The model structure included an encoder, decoder, and SPPM module, which used a multi-layer convolution structure to achieve feature extraction and segmentation of multispectral images. The results indicated that compared to traditional RGB images, multispectral images offered significant advantages in handling edges and complex terrain for semantic segmentation. Specifically, the predicted area using the seven-channel data was 11.43 m(2) larger than that obtained with RGB channels. Additionally, the seven-channel model achieved a prediction accuracy of 98.84%. This study provides an efficient and feasible solution for estimating tobacco field areas based on multispectral images, offering robust support for modern agricultural management.",multispectral,unmanned aerial vehicle,semantic segmentation,remote sensing,,"Chen, Zhuqun",,"Li, Kaibo",,"Zhang, Shuang",,,,,,,,,,,,,,,,
Row_1065,"Zheng, Chen","Chen, Yuncheng","Shao, Jie",An MRF-Based Multigranularity Edge-Preservation Optimization for Semantic Segmentation of Remote Sensing Images,IEEE GEOSCIENCE AND REMOTE SENSING LETTERS,2022,8,"Semantic segmentation is one of the most important tasks in the field of remote sensing image processing. Many methods have been proposed to realize it at the pixel granularity or object granularity. Specifically, the pixel-based methods usually can effectively extract the detailed information and edges, and the object-based methods can keep the internal consistency of each land cover or land use. The Markov random field (MRF) model provides a statistical way to combine the advantages of both pixel and object granularities together. However, current MRF-based methods still face a problem, that is, how to ensure that the advantages of different granularities will complement each other, not that disadvantages will affect advantages. To solve this problem, a new multigranularity edge-preservation optimization is proposed in this letter. The proposed method first represents the image with a series of granularities from the object to the pixel by downsampling. Then, the MRF model is defined on each granularity. By defining an edge set for each granularity, during the process of downsampling, the proposed method can continuously correct edges while maintaining intraclass consistency. Experiments of Gaofen-2 and SPOT5 demonstrate the effectiveness of the proposed method. Moreover, the proposed method can be also used as the postprocessing step for deep learning. The experiment of the Pavia University hyperspectral image illustrates it for an instance of DeepLab v3+.",Biological system modeling,Image edge detection,Image segmentation,Markov processes,Data models,"Wang, Leiguang",,,Spatial resolution,,,Semantics,Edge preservation,granularity,Markov random field (MRF),object analysis,segmentation,,,,,,,,,
