Unnamed: 0,abstract,author1,author2,author3,author4,author5,author6,author7,author8,author9,author10,author11,author12,author13,author14,author15,author16,author17,author18,citation,journal/conference/book,keyword1,keyword2,keyword3,keyword4,keyword5,keyword6,keyword7,keyword8,keyword9,keyword10,keyword11,keyword12,keyword13,keyword14,keyword15,keyword16,keyword17,keyword18,keyword19,keyword20,keyword21,keyword22,keyword23,keyword24,keyword25,publish time,title
Row_323,"Understanding the impacts of climate change and human activities on ecosystem services (ESs) and taking actions to adapt to and mitigate their negative impacts are of great benefit to sustainable regional development. In this paper, we integrate the System Dynamics Model (SD), the Future Land Use Simulation (FLUS) model, the Integrated Valuation and Trade-offs of ESs (InVEST) model, and the Structural Equation Model (SEM). We select three scenarios, SSP1-1.9, SSP2-4.5, and SSP5-8.5, from the Coupled Model Intercomparison Project 6 (CMIP6) to forecast future changes under these scenarios in the Yellow River Basin (YRB) by 2030. We predict future changes in water yield (WY), carbon storage (CS), soil retention (SR), and habitat quality (HQ) in the YRB. The results show that: (1) Under the SSP1-1.9 scenario, ecological land types such as forests, grasslands, and water bodies are protected and restored to a certain extent; under the SSP2-4.5 scenario, the degree of land spatial development occupies an intermediate state among the three scenarios; and under the SSP5-8.5 scenario, there is an obvious increase in the artificialization of the watershed's land use. (2) Under scenario SSP1-1.9, there is a comprehensive approach to sustainable development that significantly improves all ESs in the watershed, while the SSP5-8.5 and SSP2-4.5 scenarios demonstrate an increase in trade-offs between WY, HQ, and CS, especially in the downstream area. (3) Anthropogenic factors having more significant impacts in the SSP5 - 8.5 scenario. In this paper, we not only summarize the differences in trade-offs among various ESs but also provide an in-depth analysis of the key factors affecting future ESs, providing new ideas and insights for the sustainable development of ES in the future. In summary, we propose a prioritized development pathway for the future, a reduction of trade-offs between ESs, and an improved capacity to respond to challenges.","Zhang, Kaili","Fang, Bin","Zhang, Zhicheng","Liu, Tan","Liu, Kang",,,,,,,,,,,,,,9,SCIENCE OF THE TOTAL ENVIRONMENT,Ecosystem services (ESs),SSP-RCP scenario,CMIP6 climate change,Land use simulation,Contributing factors,LAND-USE,SOIL-EROSION,COVER CHANGE,IMPACTS,CLIMATE,URBAN,MODEL,SCENARIOS,STORAGE,REGION,,,,,,,,,,,MAY 20 2024,"Exploring future ecosystem service changes and key contributing factors from a ""past-future-action"" perspective: A case study of the Yellow River Basin"
Row_324,"Enhancing urban resilience represented a viable strategy to mitigate flooding induced by intense human activities and climate change. However, existing studies often concentrated on system attributes or isolated resilience characteristics, failing to offer a holistic evaluation of urban flood resilience performance. Thus, it was imperative to develop a comprehensive flood resilience framework that incorporated the resilience evolution process including resistance, economic and function recovery. Consequently, this study endeavored to devise a synthesized framework for evaluating urban flood resilience, subsequently employing a Convolutional Neural Network (CNN) model for simulation. The findings indicated that: (1) Guangzhou's maximum resistance capacity diminished from 0.52 to 0.50 as rainfall return periods altered, while Dongguan exhibited the lowest resistance, decreasing from 0.42 to 0.40. Regarding functional recovery capacity, Guangzhou ranked highest (0.35) and Foshan lowest (0.19); (2) according to Triangular Fuzzy Number-based AHP (TFN-AHP) analysis, the area classified as highest in resilience decreased from 15.6% to 12.1% of the total, whereas the low resilience area increased from 7.6% to 8.7%; (3) Zhuhai and Zhaoqing were primarily clustered along the resistance axis, in contrast, Dongguan was distinguished by its advancement along the axis of functional recovery.(4) CNN simulations yielded precise outcomes, with the Area Under the Receiver Operating Characteristic Curve (AUC) and predictive accuracy (ACC) values exceeding 0.8,respectively. The insights provided by this research were crucial for entities tasked with flood risk management.","Wang, Yongyang","Zhang, Pan","Xie, Yulei","Chen, Lei","Cai, Yanpeng",,,,,,,,,,,,,,0,JOURNAL OF HYDROLOGY,Comprehensive framework,Flood resilience,Machine learning,Convolutional Neural Networks,The Pearl River Delta,SYSTEM,,,,,,,,,,,,,,,,,,,,NOV 2024,Machine learning insights into the evolution of flood Resilience: A synthesized framework study
Row_325,"Heavy metal (HM) contamination severely restricts the safe utilization of selenium (Se)-rich soil. Based on 10 HMs in 3933 topsoil samples from Se-rich soils in Hainan Province, we used the enrichment factor (EF) to evaluate the pollution level of soil HMs; moreover, the positive matrix factorization (PMF), multivariate sta-tistical analysis, and geostatistics were utilized to quantify the sources of soil HMs; and potential ecological risk index (RI) and human health risk (HHR) of different sources from five land use types were quantifiably deter-mined via combined HM sources with RI and HHR assessment models. The evaluation results of EF showed that the Se-rich soils were moderate enrichment of Hg and Sb, but they were still characterized by lower content compared to other regions of the world. And four sources were quantitatively identified as natural sources (40.8 %), industrial sources (22.3 %), agricultural sources (23.6 %), and atmospheric sources (13.3 %). For RI, the atmospheric source was the main anthropogenic contributor to plowland, urban land, woodland, and unused land with 24 %, 30 %, 25 %, and 26 %, respectively, and Hg was the most dangerous element. But the contri-bution of industrial sources (25 %) to RI in the garden-land was higher than that of atmospheric sources (23 %). In terms of HHR, industrial sources were the primary anthropogenic contributors. Children were exposed to slight health risks, with Cr, As and Pb being the major contributors, and the cumulative probability of non-cancer and cancer risks for children was 14.93 % and 25.29 %, respectively. The cancer risk for children in garden-land (1.2E-04) and plowland (1.3E-04) exceeded the threshold (1.0E-04), which requires attention. Both non-cancer and cancer risks for adults were all at acceptable levels, with only a 15.89 % cumulative probability of cancer risk. Overall, the health risks of children were clearly higher than those of adults, and plowland and garden-land were at higher HMs risk than other land use types. The HMs risks in the study area were profoundly affected by the basalt, while the input of HMs from anthropogenic activities should be prioritized for the control of industrial activities.","Fu, Zhongbiao","He, Ningjie","Ma, Ming","Bao, Zhengyu","Xie, Shuyun","Gu, Yansheng",,,,,,,,,,,,,7,JOURNAL OF GEOCHEMICAL EXPLORATION,Heavy metals,Selenium-rich soil,Risk assessment,Source apportionment,Monte Carlo simulation,HUMAN HEALTH-RISKS,ATMOSPHERIC EMISSIONS,SPATIAL-DISTRIBUTION,TOXIC ELEMENTS,GUANGDONG PROVINCE,TRACE-METALS,SEDIMENTS,CONTAMINATION,VALUES,COUNTY,,,,,,,,,,,AUG 2023,"Source apportionment and probabilistic risk assessment of heavy metals in selenium-rich soils in Hainan Province, China"
Row_326,"High concentrations of NO3- in water resources are detrimental to both human health and aquatic ecosystems. Identification of NO3- sources and biogeochemical processes is a crucial step in managing and controlling NO3- pollution. In this study, land use, hydrochemical data, dual stable isotopic ratios and Bayesian Stable Isotope Mixing Models (BSIMM) were integrated to identify NO3- sources and estimate their proportional contributions to the contamination of the Karaj Urban Aquifer (Iran). Elevated NO3- concentrations indicated a severe NO3- pollution, with 39 and 52% of groundwater (GW) samples displaying the concentrations of NO3- in exceedance of the World Health Organization (WHO) standard of 50 mg NO3- L-1 in the rainy and dry seasons, respectively. Dual stable isotopes inferred that urban sewage is the main NO3- source in the Karaj Plain. The diagram of NO3-/Cl- versus Cl- confirmed that municipal sewage is the major source of NO3-. Results also showed that biogeochemical nitrogen dynamics are mainly influenced by nitrification, while denitrification is minimal. The BSIMM model suggested that NO3- originated predominantly from urban sewage (78.2%), followed by soil organic nitrogen (12.2%), and chemical fertilizer (9.5%) in the dry season. In the wet season, the relative contributions of urban sewage, soil nitrogen and chemical fertilizer were 87.5, 6.7, and 5.5%, respectively. The sensitivity analysis for the BSIMM modeling indicates that the isotopic signatures of sewage had the major impact on the overall GW NO3- source apportionment. The findings provide important insights for local authorities to support effective and sustainable GW resources management in the Karaj Urban Aquifer. It also demonstrates that employing Bayesian models combined with multi-parameters can improve the accuracy of NO3- source identification.","Zaryab, Abdulhalim","Alijani, Farshad","Knoeller, Kay","Minet, Eddy","Musavi, Seyedeh Fatemeh","Ostadhashemi, Zohreh",,,,,,,,,,,,,1,ENVIRONMENTAL GEOCHEMISTRY AND HEALTH,Groundwater,Nitrate,Stable isotopes,Karaj urban aquifer,Sensitivity analysis,DUAL-ISOTOPE APPROACH,STABLE-ISOTOPES,LAND-USE,UNCERTAINTY ANALYSIS,CONTAMINANT SOURCES,POLLUTION SOURCES,DRINKING-WATER,MIXING MODEL,DELTA-O-18,DELTA-N-15,,,,,,,,,,,MAR 2024,"Identification of groundwater nitrate sources in an urban aquifer (Alborz Province, Iran) using a multi-parameter approach"
Row_327,"This study utilizes the Weather Research and Forecasting model coupled with an atmospheric chemistry model, a multi-layer urban canopy model (UCM), and a building energy model to simulate the extreme rainfall event influencing the Guangzhou city in South China on 7 May 2017. By employing small variations in the longwave emissivity of buildings within the UCM, 11 convective-permitting experiments are conducted. The maximal 18-hr and hourly rainfall accumulation vary from a 2-year return period to as high as a 20 or 40-year return period with notable spatial differences. Comparisons between the more accurate group (GOOD) and less accurate group (POOR) simulations highlight that some minor differences in the near-surface air thermodynamic conditions in urban area could lead to substantial differences in local convection and its impacts on subsequent convective systems. With persistent transportation of warm, moist airflows from the northern South China Sea, formation of a slow-moving mesoscale outflow boundary to the north of the urban agglomeration leads to the development of a quasi-stationary, compactly structured meso-gamma-scale rainstorm in the GOOD simulations. The stronger low-level to near-surface convergence and mid-level cyclonic shear within this system substantially enhance low-level updrafts, leading to increased microphysical production and stronger horizontal advection of rainwater within the system. These findings offer some process-based understanding about the uncertainties in simulating urban extreme rainfall and underscore the need to develop ensemble forecasting methods for convection-permitting numerical models that incorporate increasingly complicated representations of anthropogenic influences.Precise forecasting of extreme precipitation in cities is an urgent need for hazards mitigation, but very challenging. It is unclear how well the state-of-the-art numerical models with the most advanced representations of natural and anthropogenic physical processes can simulate urban extreme precipitation. Therefore, we conduct 11 experiments with small variations in a physical parameter of buildings to simulate an extreme rainfall influencing Guangzhou city using a state-of-the-art coupled model with very high resolutions to resolve the initiation and propagation of extreme rainfall-producing convection. We find the small changes in the setting led to substantial differences in the location and intensity of rainfall, for example, the simulated rainfall accumulations vary from once every 2 to 40 years. By comparing those experiments with good and poor results, we illustrate why the simulated rainfall differ so much in the new perspective of convection evolution. The small differences in near-surface air conditions over cities can lead to huge bifurcation in convection development. Whether the continuous lifting of warm onshore airflows can be reproduced dictates whether a well-organized rainstorm can subsequently form. The dynamical structure of the rainstorm can substantially modulate the microphysical production and transportation of rainwater and thus the maximal hourly rain rates.The simulated rainfall shows high uncertainties in 11 experiments with only minor changes in an urban canopy parameter Small differences in the urban near-surface air conditions lead to huge variations in local convection and subsequent rainstorms The uncertainties in simulating mesoscale and convective-scale processes lead to the uncertainties in predicting extreme rainfall","Li, Zhenghui","Luo, Yali","Chen, Feng",,,,,,,,,,,,,,,,0,JOURNAL OF GEOPHYSICAL RESEARCH-ATMOSPHERES,extreme rainfall,simulation uncertainty,convective processes,anthropogenic influences,multiply layer urban canopy model,RECORD-BREAKING RAINFALL,URBAN CANOPY MODEL,HEAVY RAINFALL,LAND-USE,HOURLY PRECIPITATION,EMISSION INVENTORIES,MOIST CONVECTION,SOUTH CHINA,LARGE-EDDY,SENSITIVITY,,,,,,,,,,,MAY 16 2024,Analysis of Uncertainties and Associated Convective Processes in Simulations of Extreme Precipitation Over Cities With a Regional Earth System Model: A Case Study
Row_328,"Comparing the near-surface wind speeds obtained from the most recent global circulation model (GCM) simulations to well-known benchmark datasets like the European Centre for Medium-Range Weather Forecasts reanalysis Version 5 (ERA5) and the Modern-Era Retrospective analysis for Research and Applications, Version 2 (MERRA2), is necessary to make a critical assessment. Using 28 Coupled Model Intercomparison Project Phase 6 (CMIP6)-based monthly surface wind predictions, the multi-model ensemble (MME) approach in this study generates these predictions using random forest (RF) and multiple linear regression (MLR) methods over seven geographical regions in Turkiye with varying topographic complexity between 1980 and 2014, along with an offshore region. Benchmark datasets, station observations, and individual GCM predictions are used to compare the performances of MME predictions. The analysis showed that individual and the simple mean of GCM simulations are highly biased in spatial and temporal wind means. On the other hand, the MMEs formed by using groups of GCMs have significant skill for representing temporal variability in wind speed as well as for producing annual climatology and anomaly range for topographically complex regions. In MME predictions, the correlation improvements are 38-45% for RF and 22-34% for MLR. Moreover, the effect of the model group with dynamic vegetation growth on improvement remains only marginal.","Cetin, I. I.","Yucel, I.","Yilmaz, M. T.","Onol, B.",,,,,,,,,,,,,,,1,THEORETICAL AND APPLIED CLIMATOLOGY,,,,,,,,,,,,,,,,,,,,,,,,,,MAY 2024,Historical variability of Coupled Model Intercomparison Project Version 6 (CMIP6)-driven surface winds and global reanalysis data for the Eastern Mediterranean
Row_329,"The storage tank in storm water management model(SWMM) is proposed as an alternative model for low impact development(LID) facilities to simulate storm flood.In engineering applications,usually under the condition of no specific LID parameters,the studied model is used to replace LID to simulate urban stormwater runoff processes.First of all,the difficulty to conduct LID is judged according to the nature of land use,construction year,building density of the study area,and the fuzzy comprehensive evaluation method is adopted to divide the areas into five kinds of plots.Then,LID measures are set on the 5 plots,and the LID optimal combination paradigm of different blocks is given according to the size of the storage depth per unit area(the ratio of the storage volume of the plot to the plot area).The LID schemes of various areas are replaced by surrogate models.The surrogate model is applied to engineering examples for simulation to obtain the processes of rainfall and runoff in this drainage area under different recurrence periods,and to evaluate the application effect of LID measures in drainage areas under different recurrence periods.","Li, J.","Jiang, Y.","Li, Y.","Lin, J.",,,,,,,,,,,,,,,0,Engineering Journal of Wuhan University,,,,,,,,,,,,,,,,,,,,,,,,,,2023,Application study on the model of replacing LID measures with storage tank
Row_330,"Over the past decades, China's rapid economic growth and industrialization have led to serious ecological concerns. To combat ecological degradation and promote ecosystem sustainability, China has made substantial investments in ecological restoration in recent decades. Nevertheless, a comprehensive analysis of the effec-tiveness and driving mechanisms of these efforts are still lacking. Therefore, this study aims to bridge this gap by employing national land-use survey data to evaluate the effectiveness and driving mechanisms of China's ecological restoration efforts during 2009-2019, with a specific focus on ecological land preservation, land use structure, and their contribution to ecosystem services. Additionally, the Geodetector model was used to detect potential influencing factors and driving mechanisms of these efforts. The results of this study revealed that: (1) Between 2009 and 2019, a total of 585,492.61 km2 of non-ecological land was successfully transformed into ecological land through various ecological restoration efforts. Most of these areas were previously unused or cultivated land. (2) Forest and grass plantations were the major ecological restoration efforts in China, ac-counting for 47.35% and 41.91% of the total restored ecological land, respectively. Grassland restoration clus-tered northwest of the Hu Line, while forest restoration concentrated mainly to the southeast. Water and wetlands restoration were mainly distributed around China's major rivers, such as the Yangtze River and Yellow River. (3) China's ecological restoration efforts contributed to a 2.53 trillion CNY yuan increase in ecosystem service value during 2009-2019, with over 65% of the increase attributed to ecosystem regulating services. (4) China's ecological restoration efforts were mainly influenced by anthropogenic factors, such as population, land use, and urbanization, while the non-linearly enhanced interaction between natural and other factors also de-serves attention. China should balance urban expansion, agricultural development, and ecological preservation, aligning restoration with socioeconomic trends while establishing effective inter-regional ecological compen-sation mechanisms.","Zhang, Yiqing","Zhao, Xiang","Gong, Jian","Luo, Fang","Pan, Yupiao",,,,,,,,,,,,,,32,SCIENCE OF THE TOTAL ENVIRONMENT,Ecological restoration,Effectiveness evaluation,Ecosystem service value,Driving mechanisms,CLIMATE-CHANGE,VEGETATION RESTORATION,ECOSYSTEM SERVICES,RIVER BASIN,LAND,DESERTIFICATION,REGION,PM2.5,,,,,,,,,,,,,,FEB 1 2024,Effectiveness and driving mechanism of ecological restoration efforts in China from 2009 to 2019
Row_331,"The visual landscape plays a pivotal role in urban planning and healthy cities. Recent studies of visual evaluation focus on either objective or subjective approach, while describing the visual character holistically and monitor its evolution remains challenging. This study introduces an embedding-driven clustering approach that integrates both physical and perceptual attributes to infer the spatial structure of the visual environment, and investigates its spatio-temporal evolution. Singapore, a highly urbanised yet green city, is selected as a case study. Firstly, a visual feature matrix is derived from street view imagery (SVI). Then, a graph neural network is constructed based on road connections to encode visual features and spatial dependency leading to a clustering algorithm that is used to discover the underlying characteristics of the visual environment. The implementation characterises streetscapes of the city-state into six types of clusters. Finally, taking advantage of historical SVI, a longitudinal analysis reveals how visual clusters have evolved in the past decade. Among them, one of the clusters represents high-density visual experience, affirming the work as such streetscape dominates the central business district and it is evolving elsewhere, mirroring the expansion of new towns. In turn, another identified cluster, indicating sparse landscapes, decreased, while areas that are considered to be in the most visually pleasant cluster, increased. For the first time, this study demonstrates a novel method to understand the urban visual structure and analyse its spatio-temporal evolution, which could support future planning decision-making and urban landscape betterment.","Liang, Xiucheng","Zhao, Tianhong","Biljecki, Filip",,,,,,,,,,,,,,,,40,LANDSCAPE AND URBAN PLANNING,Computer vision,Urban perception,Street-level,Urban pattern,Change detection,GraphSAGE,LANDSCAPE,PERCEPTION,DENSITY,DESIGN,PREFERENCES,AESTHETICS,QUALITIES,PATTERNS,CANYONS,SPACES,,,,,,,,,,SEP 2023,Revealing spatio-temporal evolution of urban visual environments with street view imagery
Row_332,"Snow accumulations, especially if of great intensity, as is the case in northern countries, for example, can be very damaging, especially if they occur in urban environments. The damage provoked by snow is not only related to the weight of the accumulations, causing damage to structures but also to the pollution retained by the structure of the snowflakes. However, snow weight monitoring is a complex task, both because of the placement of the sensors and the specific operating ranges they must have in terms of operating temperature. These complications can be overcome by the design and use of a soft sensor, that is, a sensor capable of making indirect measurements from other parameters related to the measurement under consideration. This paper presents the design and metrological validation of a soft sensor for indirect weight measurement of snow accumulations. The designed soft sensor has been based on Artificial Neural Network and achieved, as a result, a Root-Mean-Square Error (RMSE) of 114g and a maximum extended uncertainty, evaluated by Monte Carlo simulation, of 300g in a measurement range from 150g to 5200g.","Carratu, M.","Gallo, V.","Liguori, C.","Shallari, I.","Lundgren, J.","O'nils, M.",,,,,,,,,,,,,0,2024 IEEE International Instrumentation and Measurement Technology Conference (I2MTC),,,,,,,,,,,,,,,,,,,,,,,,,,2024,Design and Evaluation of a Soft Sensor for Snow Weight Measurement
