Unnamed: 0,abstract,author1,author2,author3,author4,author5,author6,author7,author8,author9,author10,author11,author12,author13,author14,author15,author16,author17,author18,citation,journal/conference/book,keyword1,keyword2,keyword3,keyword4,keyword5,keyword6,keyword7,keyword8,keyword9,keyword10,keyword11,keyword12,keyword13,keyword14,keyword15,keyword16,keyword17,keyword18,keyword19,keyword20,keyword21,keyword22,keyword23,keyword24,keyword25,publish time,title
Row_221,"In late July 2019, an extreme heatwave swept across the European regions. This study focused on examining the collective impacts of urbanization and this extreme heatwave on Paris's thermal environment. To achieve this, high-resolution simulations were performed using the urbanized version of the Weather Research and Forecasting (WRF) model. The inclusion of enhanced urban canopy parameters and improved spatial resolutions significantly improved the near-surface meteorological variables and the spatial-temporal patterns of the urban heat island in Paris. The impervious surface sensitivity study revealed that during the full-day sunlight conditions and low wind scenarios that characterized the extreme heatwave, the urban underlayer contributed to a 0.4 degrees C rise in daytime temperature and 1 degrees C increase during nighttime hours in the downtown area. Among the various representative Local Climate Zones (LCZ) types in Paris, namely compact mid-rise, large low-rise, and sparsely built, the contributions to temperature increase were about 0.3 degrees C (0.7 degrees C), 0.3 degrees C (0.5 degrees C), and 0.3 degrees C (0.6 degrees C) for daytime (nighttime) temperatures, respectively. The surface energy budget analysis further indicated that the augmented heat storage within urban impervious surfaces is one of the main causes of the enhanced urban heat island effect, particularly during the nighttime periods during heatwaves.","Ma, Xiaojiao","Miao, Shiguang","Masson, Valery","Wurtz, Jean","Zhang, Yizhou","Wang, Jie","Huang, Xiang-Yu","Yan, Chao",,,,,,,,,,,5,URBAN CLIMATE,Heatwave,Urban thermal environment,Numerical simulation,Hundred-meter-scale,Surface energy budget,BOUNDARY-LAYER,NUMERICAL-SIMULATION,MODEL,MORTALITY,IMPACTS,WAVE,ISLANDS,,,,,,,,,,,,,,JAN 2024,The synergistic effects of urbanization and an extreme heatwave event on urban thermal environment in Paris
Row_222,"Land use planning has the potential to diminish carbon storages and exacerbate carbon emissions, and therefore improving its contribution to achieve carbon neutrality should be a priority. In this study, we proposed an integrated framework to reveal the interrelation between land use and carbon neutrality. We employed the Linear Programming Model (LPM), Markov, Future Land Use Simulation (FLUS), emission coefficients and the Integrated Valuation of Ecosystem Services and Trade-offs (InVEST) to predict land use patterns in Hainan Island, China and assessed the potential for reducing carbon emissions and increasing carbon storages under four scenarios: natural development (ND), spatial planning (SP), low-carbon emission (LE), and high-carbon storage (HS) by 2035. The results demonstrate that the new Territory Spatial Planning in 2035 can effectively reduce carbon emissions and increase carbon sinks. Specifically, compared to the ND scenario, carbon emissions will decrease by 5.37 % and carbon storages increase by 0.11 % in the SP scenario. Furthermore, the optimized land use patterns in the low-carbon scenarios will result in a greater reduction in carbon emissions and a larger increase in carbon sinks than the SP scenario. Specifically, compared to the SP scenario, carbon emissions will decrease by 11.83 % in the LE scenario, and carbon storages increase by 4.81 % in the HS scenario. Through the integration of planning and carbon neutrality via land use optimization, this study broadened the theoretical analysis framework and deepened our comprehension of the relationship between land use and carbon neutrality. Moreover, the insights derived from our findings offer valuable information to policymakers on carbon neutrality policy-making and land use planning in Hainan and other regions facing the similar challenges.","Li, Long","Huang, Xianjin","Yang, Hong",,,,,,,,,,,,,,,,31,LAND USE POLICY,Carbon emission,Carbon storage,Carbon neutrality,Land use optimization,Low carbon development,FLUS,InVEST,TERRESTRIAL ECOSYSTEMS,CULTIVATED LAND,CLIMATE-CHANGE,URBAN-GROWTH,EMISSIONS,EXPANSION,STORAGE,CHINA,IMPACTS,URBANIZATION,,,,,,,,,DEC 2023,Optimizing land use patterns to improve the contribution of land use planning to carbon neutrality target
Row_223,"In this article the program for simulation of ""PowerSim"" was used. It built a simulation-dynamic model to measure the impact of natural disasters on people and migration levels. Three types of natural disasters were considered: hurricane, fire and earthquakes. The necessary constants for the operation of models have been identified, as well as models of the impact of various natural disasters on urban damage have been built. General models have been developed to illustrate the groups of factors influencing the destruction of the housing sector, including the population sector. For the ability to change results, constant switches were added to regulate earthquake severity, fire severity and hurricane strength. A graph has been constructed that can be used to visualize the number of destroyed houses from various natural disasters. The results were analyzed, on the basis of which four graphs were constructed: percentage of population growth, population, population, proportion of built-up land, in addition to graphs: table of calculation and emigration. In the course of the work, it was determined that the model was suitable for calculating the population size taking into account natural disasters.","Lobkov, K.","Eremeev, D.","Rubinskaya, A.","Melnikova, E.","Panfilov, I.",,,,,,,,,,,,,,0,2023 22nd International Symposium INFOTEH-JAHORINA (INFOTEH),,,,,,,,,,,,,,,,,,,,,,,,,,2023,Determination of the Degree of Impact of Natural Disasters on the Level of Migration of the Population by Simulation Modelling
Row_224,"Urban waterlogging poses a severe threat to lives and property globally, making it crucial to identify the distribution of urban value and waterlogging risk. Previous research has overlooked the heterogeneity of value and risk in spatial distribution. To identify the overlay effect of urban land value and risk, this study employs the Entropy Weighting Method (EM) to assess urban value, Principal Component Analysis (PCA) to determine waterlogging risk and key areas (RK), local Moran's I (SC) to identify key areas (HK), and finally Bivariate local Moran's I (DC) to comprehensively evaluate urban value and waterlogging risk to delineate key areas (BH). The results indicate that waterlogging risk is primarily influenced by proximity to water systems (PCA coefficient: 0.567), population density (0.550), and rainfall (0.445). There is a positive correlation between urban value and waterlogging risk, with a global Moran's I of 0.536, indicating that areas with higher urban value also face greater waterlogging risk. The DC method improved identification precision, reducing the BH area by 6.42 and 3.51 km2 compared to RK and HK, accounting for 25.50 % and 15.76 % of the RK and HK identified areas, respectively. At present, rescue resources can access less than one-third of the area within 5 min, but with the DC method, during the centennial rainfall scenario, the accessibility rate within 5 min for the BH area reaches 63 %, and all BH key areas can be covered within 15 min. This study provides a new methodology for identifying key areas of waterlogging disasters and can be used to enhance urban rescue efficiency and the precision management of flood disasters.","Ding, Yi","Wang, Hao","Liu, Yan","Chai, Beibei","Bin, Chen",,,,,,,,,,,,,,0,SCIENCE OF THE TOTAL ENVIRONMENT,Urban waterlogging,Land use value,Risk assessment,Bivariate spatial autocorrelation,Value -risk overlay,SCENARIO SIMULATION,DISASTERS,DISTRICT,CHINA,,,,,,,,,,,,,,,,,OCT 15 2024,The spatial overlay effect of urban waterlogging risk and land use value
Row_225,"In recent years, due to urbanization and human activities, groundwater overexploitation has become increasingly severe, resulting in some degrees of land subsidence and, consequently, causing a series of geological disasters and other environmental issues. Therefore, large-scale and high-precision land subsidence prediction is of great importance for the prevention and control of geological disasters. However, the existing prediction models and methods ignore the effects of the spatiotemporal non-stationary relationships between the influencing factors and the accumulated land subsidence, causing the poor accuracy of the predicted land subsidence results. In this context, a Geographically and Temporally Weighted Regression combined with the Long Short-Term Memory (LSTM)-multivariable and Attention Mechanism (AM) (GTWR-LSTMm-AM) was proposed to more accurately predict the deformation of time series land subsidence in this study. The small baseline subset-interferometric synthetic aperture radar (SBAS-InSAR) was used to reveal the temporal deformation information of Zhengzhou's main urban area, then the GTWR model was used to assess the spatiotemporal non-stationarity","Yuan, Yonghao","Zhang, Dujuan","Cui, Jian","Zeng, Tao","Zhang, Gubin","Zhou, Wenge","Wang, Jinyang","Chen, Feng","Guo, Jiahui","Chen, Zugang","Guo, Hengliang",,,,,,,,9,SCIENCE OF THE TOTAL ENVIRONMENT,Land subsidence,SBAS-InSAR,Attention mechanism,Spatiotemporal heterogeneity,GTWR-LSTMm-AM,DEFORMATION,SAR,,,,,,,,,,,,,,,,,,,JAN 10 2024,Land subsidence prediction in Zhengzhou's main urban area using the GTWR and LSTM models combined with the Attention Mechanism
Row_226,"Anthropogenic activities have dramatically altered land use/land cover (LULC), leading to ecosystem service (ES) degradation and further ecological risks. Ecological risks are particularly serious in ecologically fragile regions because trade-offs between economic development and ecological protection are prominent. Thus, ways in which to assess the response of ecological risks to LULC change under each development scenario in ecologically fragile regions remain challenging. In this study, future LUCC and its impact on ESs under four development scenarios in 2040 in western Jilin Province were predicted using a patch-generating land use simulation model and the Integrated Valuation of Ecosystem Services and Trade-offs (InVEST) model. Ecological risk was assessed based on future LUCC possibilities, and potential ES degradation and potential drivers of ecological risks were explored using a geographic detector. The results showed that the cropland development scenario (CDS) would experience large-scale urbanization and cropland expansion. Carbon storage (CS), habitat quality (HQ), and water purifi- cation (WP) degraded the most under the CDS, and grain yield (GY) and water yield (WY) degraded the most under the ecological protection scenario (EPS). The LUCC probability under the CDS (14.37 %) was the highest, while the LUCC probability under the comprehensive development scenario (CPDS) (8.68 %) was the lowest. The risk of WP degradation was greatest under the CDS, but the risk of soil retention (SR) degradation was greatest under the natural development scenario (NDS), EPS, and CPDS. Ecological risk coverage was the largest (98.04 %), and ecological risks were the highest (0.21) under the CDS, while those under the EPS were the opposite. Distance to roads and population density had a higher impact on ecological risks than other drivers. Further attention should be given to the ecological networks and pattern establishment in urbanized regions. This study will contribute to risk prevention and sustainable urban and agricultural development.","Deng, Guangyi","Jiang, Haibo","Zhu, Shiying","Wen, Yang","He, Chunguang","Wang, Xue","Sheng, Lianxi","Guo, Yue","Cao, Yingyue",,,,,,,,,,21,SCIENCE OF THE TOTAL ENVIRONMENT,Landscape evolution,Ecosystem degradation,Ecological risk,Development scenario,Driving factors,ECOSYSTEM SERVICES,CHINA,HEALTH,,,,,,,,,,,,,,,,,,MAR 1 2024,Projecting the response of ecological risk to land use/land cover change in ecologically fragile regions
Row_227,"Earthquakes are natural events that affect the spatial and temporal dynamics of land use/land cover. Here, we have focused on the city of Duzce, NW of Turkey, which has experienced the M > 7 doublet earthquakes in 1999. In order to conduct land cover change analysis and future projection, we have utilized integrated the multilayer perceptron neural network-based Markov chain model combined with geographical information systems. Our results show that most of the land use in 1990 was 77,601 hectares (65.89% of the region) consist of forest and shrubs. By 2020, agricultural land was the most expanding land class in the region with 48.80%. The 1999 earthquake caused the city to grow horizontally in the long run, and this expansion has ended the occupation in grade-one-agricultural lands that prevailed in the region. This horizontal development also caused the residential areas that covered 2.76% of the study area in 1999 expand to the ratio of 20.37% in 2050. It has been determined that the most effective driver in these changes in the land cover is the distance from urban with a Cramer's value of 0.4299. For this reason, the area that is most exposed to land cover change is the forest and shrub areas occupied by the city, which has spread to the northeast due to the earthquake. It is concluded that the earthquakes can change the land cover of the city significantly in various aspects in the long term, contrary to the approved zoning plans.","Karadeniz, Enes","Sunbul, Fatih",,,,,,,,,,,,,,,,,2,ENVIRONMENTAL EARTH SCIENCES,Artificial neural network,Multilayer perceptron,Markov chain,LULC prediction,1999 Duzce Earthquake,Duzce Plain,NORTH ANATOLIAN FAULT,CELLULAR-AUTOMATA,NEURAL-NETWORK,URBAN-GROWTH,WATER-QUALITY,STRONG-MOTION,1999 IZMIT,MODEL,GIS,TURKEY,,,,,,,,,,MAY 2023,Land use and land cover change in Duzce region following the major earthquake: implications for ANN and Markov Chain Analysis
Row_228,"Extreme stormwater and high-impervious area, caused by climate change and high-urbanization, are widely considered as the essential factors for causing urban flood. Understanding the response law of urban inundation to characteristics of rainstorms is helpful to implement integrated flood mitigation measures. Therefore, this paper is focused on exploring the urban inundation response law based on designed rainstorms by coupled hydrodynamic and rainfall-tracking model. Pilot area of Guyuan sponge city, which is divided into 5 source areas, is adopted to conduct 36 types of rainfall scenario simulations with the combination of different rainfall amounts and durations as well as peak coefficients. Inundation analysis methods is used to obtain the relationship between maximum inundation maps and characteristics of rainstorms, and source tracking analysis method is novelty proposed to excavate the response law of the connectivity among source areas to characteristics of rainstorms. First, Results of inundation analysis reveal that rainfall amount, duration and peak value are the first, second and third critical rainstorm characteristics that determine the severity of disasters, the variation of inundation volume are 140 %, 30 % and 4.2 % when precipitation and duration as well as peak value double. Second, the inundation area that water depth more than 0.5 m increases quickly is the major reason that inundation volume varies with 2 times as the increasing of precipitation; the transferring runoff volume between source areas and land use reaches 0-6 % and 0-10 % of inundation volume. Third, SA 1 and 2 are the critical subareas to manage the runoff, when precipitation equals to 200 mm, SA 1 contributes 19.5-33.7 % of inundation volume in SA 2, and SA 2 contributes 28-30 % of inundation volume in SA 3. The study is helpful to further understand the response law of inundation and relationship among source areas to characteristics of rainstorms, provide novel insights for constructing integrated flooding intervention practices.","Wang, Xinghua","Hou, Jingming","Gao, Xujun","Wang, Tian","Zhou, Qingshi","Li, Yamin","Sun, Xueliang",,,,,,,,,,,,1,JOURNAL OF HYDROLOGY,Urban inundation,Response law,Characteristics of rainstorms,Source tracking,SIMULATION,,,,,,,,,,,,,,,,,,,,,MAR 2024,Urban inundation response law analysis to characteristics of designed rainstorms based on coupled hydrodynamic and rainfall-tracking model
Row_229,"Origin-Destination (OD) flow, as an abstract representation of the object's movement or interaction, has been used to reveal the movement patterns of human activities and the coupling process of the human-land system. As a developing spatial analysis method, OD flow clustering can be used to identify the dominant trends and spatial structures of urban mobility. However, urban flow exhibits universal heterogeneity, which is mainly manifested in irregular shapes, uneven distribution, and obvious scale differences. The existing methods are constrained by specific spatial scales and sensitive parameter settings, making it difficult to reveal heterogeneous urban mobility patterns within travel OD data. In this paper, we propose an OD flow analysis method that integrates spatial statistics and density clustering. This method can determine parameter values from datasets without manual intervention and adaptively identify multi-scale mixed OD flow clusters. In the simulation experiment, the proposed method accurately detects all preset OD clusters with less noise. It outperforms the baseline methods in terms of Silhouette Coefficient, V-measure, and Fowlkes Mallows index. As a case study, this method is applied to OD data from Chengdu, China, extracting 63 representative flow clusters and revealing the trends of heterogeneous urban mobility across different lengths and densities for public transit optimization.","Guo, Xiaogang","Fang, Mengyuan","Tang, Luliang","Kan, Zihan","Yang, Xue","Pei, Tao","Li, Qingquan","Li, Chaokui",,,,,,,,,,,0,JOURNAL OF TRANSPORT GEOGRAPHY,OD flow clustering,OPTICS,Spatial statistics,Density heterogeneity,Urban mobility,PATTERNS,SHUTTLE,DESIGN,,,,,,,,,,,,,,,,,,FEB 2025,An adaptive OD flow clustering method to identify heterogeneous urban mobility trends
Row_230,"This study is an effort of geo-spatial assessment of pluvial floods in District Lahore, Pakistan, caused by urban expansion and the growing frequency and intensity of high-intensity rainfall events. The use of geospatial techniques such as watershed modeling, maximum likelihood image classification, and weighted overlay analysis based on secondary data has enabled the researchers to assess the extent and severity of pluvial floods in the study area. The study's findings highlight the high risk of pluvial floods in the central part of the study area, which is dominated by built-up land and concrete roads. The increase in the area of built-up land from 34.913 km2 in 2018 to 37.442 km2 in 2022 has further intensified the risk of pluvial floods. The findings of this study can assist policymakers in developing effective strategies to reduce the risks associated with pluvial floods. Alongside, it also highlights the importance of geospatial techniques to better understand and address the complex challenges of urbanization and climate change. Flood risk zone-specific strategies are recommended to reduce the risk of pluvial floods.","Ali, Muhammad","Mahmood, Shakeel",,,,,,,,,,,,,,,,,0,ENVIRONMENTAL MONITORING AND ASSESSMENT,Pluvial flood,Assessment,Urban flood,Built-up land,Rainfall,Drainage system,GIS,Lahore,,,,,,,,,,,,,,,,,,FEB 2024,"Geo-spatial assessment of pluvial floods in city district Lahore, Pakistan"
Row_231,"Coastal megacity like Shanghai is continuously challenged with natural-anthropogenic geo-environmental hazards and risks which possess high correlations between land subsidence (LS), socio-economic development, current and future underground space development (UUS). This research focuses on comprehensive evaluation geo-environmental risks and scenario spatial planning model towards economic impact (EI) resilience of UUS the context of large subsidence hazard prone coastal megacity. Newly established factors are used as indicators to understand the relations and scenario prediction by 2035. The cause-effect relations are analysed via structural equation modelling (SEM), spatiotemporal and scenario spatial modelling in ArcGIS platform based on the secondary big open multisource data. Spatiotemporal pattern basis between year 1960-2020 and urban planning growth theories, results indicate expansion of subsidence and UUS in parallel with economic impact from city centre to new five suburb districts by 2035 with prediction of 75% of areas in medium to high hazard risk assessment category areas. This research can be referred to coastal megacities with land subsidence issues for economic resilient multidisciplinary geo-environmental hazard management, UUS development and urban planning policies formulation.","Bin Hishammuddin, Muhammad Akmal Hakim","Wang, Jianxiu","Wu, Fan","Bin Ismail, Muhammad Azizol","Abidin, Hasanuddin Zainal","Siong, Ho Chin","Huang, Xinlei","Yang, Tianliang","Kanniah, Kasturi Devi",,,,,,,,,,0,ENVIRONMENTAL EARTH SCIENCES,Geo-environmental hazards risks,Land subsidence,Urban underground space,Spatial planning,Urban growth theory,Economic disaster resilience,Structural equation modelling (SEM),Scenario spatial modelling,LAND SUBSIDENCE,,,,,,,,,,,,,,,,,AUG 2024,Scenario spatial planning evaluation model for subsidence-economic resilience environment in geohazard prone-coastal megacities: urban underground space (UUS) development in Shanghai by year 2035
Row_232,"The purpose of this study is to investigate the influence of the urban environment of the Paris region on an isolated convective cell that formed downwind of the city on May 7, 2022, using the Meso-NH research atmospheric model at a horizontal scale of 300 m. To account for all sources of forecast uncertainty, the initial and lateral boundary conditions of the simulations are provided by an ensemble prediction system. A multi-layer urban scheme is used to represent the influence of buildings on the airflow accurately. Two sets of ensemble simulations are performed: the first set (URB) uses a fine-scale surface description of the city, while the second set (NOURB) replaces urban surfaces with vegetation. This sensitivity test shows that, despite the high variability of simulated precipitation within the ensemble, the city of Paris plays a statistically significant role in the initiation of convection in this case. Convective cells are initiated over the city for several members of the URB ensemble, while almost no precipitation is simulated for the same members of the NOURB ensemble. The mean 6-h rainfall accumulation of the URB ensemble is increased by 70% over Paris (compared with the NOURB ensemble) and no statistically significant trend is found around the city. The analysis reveals that the capital experiences a higher sensible heat flux due to drier and warmer air, resulting in enhanced vertical velocities and an increase in boundary-layer height in the URB ensemble. Additionally, the total water content and cloud fraction over Paris are intensified, leading to more precipitation. These findings suggest that urbanisation has a notable impact on convection and precipitation processes in this case.An ensemble of hectometric numerical simulations with (URB) and without (NOURB) description of the urban environment have been performed for a specific convective case, in the Paris region. An increase in precipitation is observed over the urban environment when the urban scheme is activated. Analysis of the processes reveals a significant effect of the city on near-surface temperature, sensible heat flux, boundary-layer height, and vertical velocities, which helps trigger convection over the city in this case. The difference between URB and NOURB ensemble mean 6-h precipitation accumulation is shown. image","Forster, Arnaud","Augros, Clotilde","Masson, Valery",,,,,,,,,,,,,,,,0,QUARTERLY JOURNAL OF THE ROYAL METEOROLOGICAL SOCIETY,ensemble simulations,precipitation,urban meteorology,CITY SIZE,LAND-USE,RAINFALL,MODEL,URBANIZATION,MESOSCALE,CLIMATE,IMPACT,PARAMETERIZATION,THUNDERSTORMS,,,,,,,,,,,,,JUL 2024,Urban influence on convective precipitation in the Paris region: Hectometric ensemble simulations in a case study
