Unnamed: 0,abstract,author1,author2,author3,author4,author5,author6,author7,author8,author9,author10,author11,author12,author13,author14,author15,author16,author17,author18,citation,journal/conference/book,keyword1,keyword2,keyword3,keyword4,keyword5,keyword6,keyword7,keyword8,keyword9,keyword10,keyword11,keyword12,keyword13,keyword14,keyword15,keyword16,keyword17,keyword18,keyword19,keyword20,keyword21,keyword22,keyword23,keyword24,keyword25,publish time,title
Row_120,"Construction land development suitability (CLDS) assessment holds paramount importance in contemporary urban planning and management. Previous CLDS studies have faced challenges such as insufficient evaluation indicators, model complexity, and limited interpretability. To address these gaps, this study applies three simplistic yet mature models from the field of geological hazard assessment - Weight of Evidence (WOE), Information Value (IV), and Frequency Ratio (FR) - to evaluate the CLDS in Wuhan, China, and examine their feasibility. In parallel, a comparative analysis with the Patch-generating Land Use Simulation (PLUS) model was conducted. The WOE, IV, and FR models demonstrate a gradual decrease in CLDS from the city center and the Yangtze and Han rivers towards the periphery. Conversely, the PLUS model indicates the highest suitability around the city's development boundaries, followed by the city center, with suburbs displaying lower suitability. In terms of accuracy, the PLUS model's CARS module outperforms others, particularly for micro-level urban expansion simulations. The IV and WOE models follow closely, manifesting a preference for macro-level urban planning. Additionally, this study pinpoints key drivers influencing CLDS, notably population density, distance to social service Points of Interest (POI) and proximity to road networks. The cross-validation of the WOE, IV, and FR models underscores their reliability, with their straightforward principles positioning them as valuable tools in urban development planning. This comparative study validates the application of geological hazard models in urban contexts and diversifies CLDS assessment methodologies.","Zhang, Zhong","Gong, Jian","Li, Jingye","Yang, Jianxin","Chen, Guang","Ren, Yingjian","Plaza, Antonio",,,,,,,,,,,,2,ENVIRONMENTAL IMPACT ASSESSMENT REVIEW,Construction land development suitability,Probabilistic statistical models,Driving force analysis,PLUS model,Model comparison,Wuhan,MULTICRITERIA DECISION-ANALYSIS,ANALYTICAL HIERARCHY PROCESS,URBAN-GROWTH,ECOSYSTEM SERVICES,GENETIC ALGORITHM,WUHAN CITY,GIS,AREA,URBANIZATION,AGRICULTURE,,,,,,,,,,JUL 2024,Comparative study of construction land development suitability assessment: Insights from multiple models and driving forces
Row_121,"In the context of climate change and rapid urbanization, there have been unparalleled changes in land use and land cover (LULC), resulting in substantial impacts on the surrounding habitat quality (HQ), particularly in ecologically vulnerable arid regions. However, previous studies on the influencing mechanisms of HQ in arid urban agglomerations and future multi-scenario simulations remain limited. To fill this knowledge gap, this study aimed to reveal the influencing mechanisms in HQ changes and to develop a multi-scenario HQ assessment framework within arid urban agglomerations. We assessed the spatiotemporal variations in HQ using the InVEST model and three periods of LULC data for the urban agglomeration on the northern slope of the Tianshan Mountains (UANSTM), and the partial least squares structural equation model was introduced to explore the interactions between natural and non-natural factors and their impacts on HQ. Additionally, we coupled multi-objective programming and PLUS models to predict the LULC under different optimization scenarios (natural development scenario (NDS), ecological protection scenario (EPS), ecological-economic coordinated scenario, and economic development scenario) for the UANSTM in 2030, and to assess HQ. Results show that (1) the HQ index of the UANSTM was 0.507, 0.520, and 0.495 in 2000, 2010, and 2020 respectively, with a spatial distribution pattern of high values in the west, low values in the east, and high in the central and low in the north and south; (2) geomorphic, climatic, and LULC factors have direct positive effects on HQ, while socio-economic factors have a direct negative effect on HQ. In addition, geomorphic, socio-economic, and climatic factors also influence HQ through potential indirect paths. Climatic and LULC factors enhance the positive effect of geomorphic on HQ while counteracting the direct negative effect of socio-economic factors on HQ. Climatic factors have the largest negative effect on HQ through their influence on LULC; (3) according to the four scenarios in 2030, the highest HQ index (increased by 0.13%) was found under the EPS, which also aligns more closely with SDGs. Conversely, NDS showed the lowest HQ index (declined by 2.59%). The research results could provide a scientific basis for promoting sustainable land management and ecological conservation for the UANSTM.","Han, Chuqiao","Zheng, Jianghua","Han, Wanqiang","Lu, Binbin","Yu, Wenjie","Wang, Zhe","Yang, Juan","Wu, Jiale",,,,,,,,,,,0,LAND DEGRADATION & DEVELOPMENT,habitat quality (HQ),influencing mechanism,land management,multi-objective programming (MOP),sustainable development,LAND-USE CHANGES,ECOSYSTEM SERVICES,MODEL,CHINA,BIODIVERSITY,DYNAMICS,IMPACTS,AREAS,,,,,,,,,,,,,APR 15 2024,Research on habitat quality in arid urban agglomerations: Influencing mechanisms and multi-scenario simulations
Row_122,"Land-use changes are the result of individuals' interactive decisions and are directly affected by stakeholders' preferences. For a better understanding of land-use change processes and to support the development of an adequate land-use plan, simulating stakeholders' interactions is a key challenge. This study aims to develop a Game-Theoretic Interactive Decision Making (GTIDM) framework to simulate the interrelated behavior of stakeholders with imperfect information in a land-use change process. GTIDM considers consequences of the any possible decision taken by actors and support the best possible payoff for all decision-makers in conflicted and competitive situations. The proposed framework was implemented and analyzed using data from the 22nd municipal region of Tehran. We compared the results from GTIDM with Multi-Agent System (MAS) and Con-ventional Multi-Criteria Decision Making-based (CMCDM) frameworks to demonstrate the effects of considering or ignoring the interactive decision-making process. The results obtained indicate that the interactive decision -making situation can be efficiently simulated by GTIDM and the outputs are more similar to stakeholders' de-cisions in the real world. The MAS-and CMCDM-based frameworks are less focused on interactive situations. Finally, GTIDM provides insight into interactive decision-making in land-use change process and can lead us toward a feasible solution in urban land-use planning.","Abolhasani, Somaie","Taleai, Mohammad","Lakes, Tobia",,,,,,,,,,,,,,,,1,HABITAT INTERNATIONAL,Strategic form game,Conflicted and competitive decision -making,Multi -agent systems,Multi -criteria decision -making,Land -use dynamics,SIMULATION,GROWTH,MODEL,CONSTRUCTION,RATIONALITY,ALLOCATION,AGENTS,LOGIC,,,,,,,,,,,,,NOV 2023,Developing a game-theoretic interactive decision-making framework for urban land-use planning
Row_123,"Aiming at the problem of urban waterlogging caused by heavy rainstorms in coastal cities, this paper takes Fuzhou City as an example and constructs a fined coupling model of urban one-dimensional drainage network and two-dimensional land surface hydrodynamics based on Infoworks ICM. The model was applied to the analysis of rainstorm waterlogging in Gutian Road area of Fuzhou during Typhoon ""Lubi"" in August 2021, which verified the high simulation accuracy of the model. Based on this model, the rainstorm waterlogging process in Gutian area under different recurrence periods was analyzed, and two ""sponge"" reconstruction schemes were proposed. It is found that increasing the pipe diameter is more conducive to improving the waterlogging situation in the study area. The study can be used to accurately calculate the process of urban underground drainage and land area water in Fuzhou City, which provide technical support for the real-time decision of flood control and drainage in coastal cities.","Feng, T.-Y.","Lei, X.-H.","Wang, J.-B.","Zhang, Y.-B.",,,,,,,,,,,,,,,0,Water Resources and Power,,,,,,,,,,,,,,,,,,,,,,,,,,2023,Analysis of Rainstorm Waterlogging in Coastal Cities Based on Infoworks ICM Model
Row_124,"The 21st century is marked by urbanization, with global focus on horizontal city expansion. Yet, vertical growth lacks research due to data scarcity. This study investigates the fusion of urban building height predictions with conventional sprawl projections to offer a holistic 3D urban expansion foresight. We constructed a model for projecting urban building volume using socio-economic factors includes GDP, population, and urbanization indicators, enabling the anticipation of China's 2010-2100 building volume demand across five Shared Socioeconomic Pathways (SSPs). Furthermore, deep learning -based neural networks were harnessed for estimating land conversion probabilities and building heights. By aggregating the projected demand, we estimated spatial expansion and building heights for each scenario at ten-year intervals from 2010 to 2100. Compared to other products, our proposed method excels in spatial granularity and temporal continuity, which includes height properties in the 3D structure. According to the projections of this study, considering various SSPs, China's building volume is expected to reach approximately 4500 km3 to 6500 km3 by 2050, representing 1.3-1.9 times increase compared to 2010. Furthermore, forecasts for 2050-2100 anticipate a notable decline to 60 % of the 2050 demand. At a more local level, potential spatial imbalances may arise, as the projections indicate significant urban expansion in the eastern areas and a heightened density of urban land within existing city clusters. This approach surpasses the constraints of 2D analysis, pioneering the prediction of fine -resolution, long-term spatiotemporal urban expansion in China (2010-2100), contributing a model and data support for future sustainable urban development pursuits.","Wang, Kechao","He, Tingting","Xiao, Wu","Yang, Runjia",,,,,,,,,,,,,,,3,LANDSCAPE AND URBAN PLANNING,Urban 3D expansion,Spatiotemporal projection,Shared Socioeconomic Pathways (SSPs),Convolutional Neural Network (CNN),LAND-USE SIMULATION,RESOLUTION,LANDSCAPE,SCENARIOS,,,,,,,,,,,,,,,,,,JUL 2024,Projections of future spatiotemporal urban 3D expansion in China under shared socioeconomic pathways
Row_125,"Global warming and land-use type shifting lead to the degradation of natural habitats. The research on the ecological and environmental impact of the subtropical monsoon climate zone on food crop cultivation is not systematic enough. An Integrated Valuation of Ecosystem Services and Trade-offs (InVEST)-Patch-generating Land Use Simulation (PLUS)-Maximum Entropy (MaxEnt) model was created to provide a comprehensive assessment of the spatiotemporal variations for food crop habitat quality (HQ) in China's subtropical monsoon climate zone from 2010 to 2030. The HQ degradation trend was obvious during 2010-2030 under the influence of land-use change. The expansion of lower habitat areas was larger than that of medium and higher habitat areas. The shared socio-economic pathways SSP-CP and SSP-EP increased the mean total area of suitable areas compared with the SSP-ND scenario for food crops by 9% and 17.8%, respectively. Land-use shifts increased the suitable range of food crops and mitigated the negative impacts of urban expansion on food growth. This research has theoretical guidance for land-use planning for food crop production in subtropical monsoon climate zones.","Zuo, Xiaokang","Zhi, Rui","Tang, Ruiqian","Wang, Hanxi","Zang, Shuying",,,,,,,,,,,,,,0,SUSTAINABILITY,land-use,habitat quality (HQ),potential habitat suitability (PHS),InVEST-PLUS-Maxent,LAND-USE,CHINA,SIMULATION,MODEL,BIODIVERSITY,SUITABILITY,DYNAMICS,FLUS,,,,,,,,,,,,,,DEC 2024,Study on the Impact of Spatiotemporal Changes in the Ecological Environment on Grain Crops in the Subtropical Monsoon Climate Zone
Row_126,"In recent years, numerous multitemporal global land use and land cover products have been published acting as valuable source for training spatially explicit geosimulation models forecasting urban growth. However, there is a notable gap in research that specifically addresses the sensitivity of models traing with those data sets when it comes to regional modeling purposes. Accordingly, the objectives of this study were to calibrate, validate, and employ global urban input datasets for the regional simulation of urban growth by the year 2030. The SLEUTH urban growth model, focused on the metropolitan area of the Ruhr, Germany, was calibrated using the Global Human Settlement Layer, World Settlement Foot-print Evolution, historical OpenStreetMap data, and a Digital Land Cover Model for Germany. The goal was to compare the results in terms of accuracy, certainty, quantity, and allocation, particularly in urban areas susceptible to floods and heat. While all models achieved high accuracy levels concerning quantity and allocation, the extent of new settlements varied from 40.77 km2 to 477.91 km2. The models based on World Settlement Footprint and OpenStreetMap exhibited higher certainty and lower stochasticity. As the simulated urban growth increased, there was a corresponding rise in the likelihood of allocating new settlements in areas affected by natural hazards. While all models presented a similar relative portion of new settlement areas impacted by floods, variations emerged in terms of areas affected by unfavorable thermal conditions. This study underscored the potential use of historical OpenStreetMap data in training cellular automation for geosimulating future settlement growth. Furthermore, it highlighted the applicability of global Earth observation-based urban datasets for regional geosimulation and explored the impacts of diverse input data on the accuracy, certainty, quantity, and allocation performances in simulating future conditions.","Rienow, Andreas",,,,,,,,,,,,,,,,,,1,ERDKUNDE,Urban development,SLEUTH,OpenStreetMap,Ruhr Metropolitan Area,Global Human Settlement Layer,World Settlement Footprint,CELLULAR-AUTOMATON,VALIDATION,GERMANY,SLEUTH,COVER,MODEL,,,,,,,,,,,,,,JAN-MAR 2024,FORECASTING URBAN FUTURES: EVALUATING GLOBAL LAND USEDATA SENSITIVITY FOR REGIONAL GROWTH SIMULATIONIN THE RUHR METROPOLITAN AREA
Row_127,"Fine spatial resolution urban vegetation datasets are crucial for monitoring change in green space and guiding planning and policy initiatives to promote liveable and sustainable cities. Previous studies have demonstrated that finer spatial resolution products are more suited to monitoring urban vegetation than coarse spatial reso-lution datasets. However, there are differences in the generation of fine spatial resolution datasets that could affect how urban vegetation is represented. To explore how sensitive monitoring and analysis tasks are to the choice of vegetation dataset, a series of comparative analyses were undertaken using three fine spatial resolution datasets in Perth, Western Australia. A technique for quantitative comparison of spatial pattens was used to compare vegetation datasets. There were large areas of Perth where spatial patterns of vegetation were sub-stantially different across datasets. The level of differences in spatial patterns between datasets varied with geographic context such as land use. Elements of a spatial pattern related to grass and tree composition were similar across datasets but there were differences in how shrubs and the configuration of vegetation features were captured. There were differences in the temporal change detection of vegetation patterns across datasets. Spatial patterns of vegetation and land cover generated using the three datasets were used as predictor variables of surface temperatures in machine learning workflows. In some cases, the models learned dataset specific re-lationships between elements of a vegetation pattern and surface temperature outcomes. In a final modelling analysis, spatial patterns of vegetation were considered as an outcome responding to a disturbance event, a change in dwelling density. The size of the effect of dwelling density change on vegetation patterns varied across vegetation datasets.","Duncan, John M. A.","Boruff, Bryan",,,,,,,,,,,,,,,,,12,LANDSCAPE AND URBAN PLANNING,Urban forests,Urban vegetation,Urban green space,Remote sensing,Image analysis,LAND-SURFACE TEMPERATURE,LANDSCAPE PATTERN,HEAT-ISLAND,COVER,TREE,GREENSPACE,METRICS,RETRIEVAL,AREAS,BETA,,,,,,,,,,,MAY 2023,Monitoring spatial patterns of urban vegetation: A comparison of contemporary high-resolution datasets
Row_128,"Urban spatial structure factors can have considerable effects on traffic noise distribution. This study aimed to describe the spatial distribution characteristics of traffic noise and influencing factors in high-density cities. Fifteen indexes were selected from the three aspects of building layout, road organization and land use to analyse the influence of urban spatial structure factors on the noise spatial distribution. This paper selected the central area of Tianjin as the study area. The noise level was generated by the noise simulation software CadnaA, and the numerical statistics were determined by ArcGIS. The correlation between various urban indexes and the spatial distribution of traffic noise were determined with correlation analysis, and multiscale geographically weighted regression (MGWR) analysis was used to determine the degree and scope of influence of various urban indexes on the spatial distribution of traffic noise. The results indicate that there are significant differences in the spatial agglomeration forms of high, medium, and low noise areas among research units, and the spatial agglomeration of low noise areas in each unit is stronger. The building layout indexes, except for the average building height (ABH), are significantly negatively correlated with the noise levels in low noise areas (L70-L90). The road length index (RLI), road area density (RAD), road landscape shape index (RLSI), trunk road length index (TRLI), proportion of traffic land (PT), and degree of land mixing (DLM) are significantly positively correlated with the noise levels of all areas within the unit (L10-L90). Among the three aspects of building layout, road organization, and land use, the architectural landscape shape index (ALSI), RAD, and DLM have the greatest influence on the average spatial sound pressure level (Lavg), with mean regression coefficients of -0.254, 0.520, and 0.174, respectively. The ground space index (GSI), ALSI, proportion of residential land (PR) and PT are the global factors influencing Lavg.","Zhou, Zhiyu","Zhang, Meng","Gao, Xuming","Gao, Jinfeng","Kang, Jian",,,,,,,,,,,,,,2,APPLIED ACOUSTICS,Traffic noise,Spatial structure,Road organization,High-density cities,ENVIRONMENTAL NOISE,URBAN FORM,STATISTICAL-ANALYSIS,SMART CITIES,INDICATORS,MORPHOLOGY,MODEL,CITY,,,,,,,,,,,,,,FEB 15 2024,Analysis of traffic noise spatial distribution characteristics and influencing factors in high-density cities
Row_129,"Air pollution is an inevitable negative environmental externality in the process of industrialization and urban-ization in countries around the world. Land misallocation in the process of urbanization and industrialization and the resulting urban sprawl exacerbates the above problems. As a major country in the stage of rapid urbanization and industrialization, China also faces severe air pollution problems. Therefore, this paper will systematically study the impact of land misallocation and urban sprawl on air pollution. We first set up the utility maximization problem of each economic entity in the process of land misallocation in the mathematical model, and form a general equilibrium theory model to analyze the relationship between land misallocation, urban sprawl and air pollution, and then put forward the research hypotheses. We further use the big data of land market transactions of China Land Market Network and LandScan global population data to build the land misallocation index and urban sprawl index respectively, and use an extended mediating effect model to empirically test the hypotheses. The results suggest that the effect of land misallocation on air pollution is significantly positive, and the impact of land misallocation on urban sprawl largely depends on the return rate of land relative to labor (RRIRL). When the RRIRL is relatively low, the impact is weak, or even has a negative effect to some extent. At this time, low transportation costs are conducive to reducing air pollution. On the contrary, when the RRIRL is relatively high, land misallocation has a significant role in promoting urban sprawl. At this time, high traffic costs are conducive to reducing air pollution. In addition, we also find that there is an inverted U-shaped relationship between urban sprawl and air pollution. When the urban sprawl level is low, its impact on air pollution increases with the increase of its level, but once it exceeds a specific node, the impact will decrease. Based on the characteristics of the relationship among land misallocation, urban sprawl and air pollution under different RRIRL, we summarize four environmentally friendly urban development paths. We bring the land bid rent theory and environmental pollution research into a same theoretical model framework, which provides a modeling idea and research perspective with a micro-foundation for subsequent research on land misallocation. We integrate the research conclusions of existing literature and unify them under the research frameworks concerning different RRIRL in the empirical results, which greatly improving their applicability. The four urban development paths summa-rized in this paper will also provide inspiration for future researchers and policy makers.","Wang, Yuwei","Fan, Jianshuang","Liu, Dongtao","Fu, Jian","Ding, Liang","Zhang, Junshen",,,,,,,,,,,,,9,JOURNAL OF ENVIRONMENTAL MANAGEMENT,Land misallocation,Urban sprawl,Air pollution,INDUSTRIAL-STRUCTURE,,,,,,,,,,,,,,,,,,,,,,NOV 1 2023,"Air pollution outcomes, land misallocation, and the transmission through urban sprawl"
Row_130,"During the past two decades discussions on urban shrinkage have been increasing in intensity, mainly due to the irresistible trends of migration, economic transformation, and the so-called ""siphon effect"" of large and mega cities. Yet, very few studies have tried to understand urban shrinkage from the perspective of local microscopic unit evolution. This study develops a novel model for simultaneous simulation of expansion and shrinkage (MSSES) of urban built-up areas. Starting from a microscopic basis, our MSSES can simulate both the processes and the states that lead to spatial expansion or shrinkage. A MaxEnt model is further used to investigate the driving factors of microspatial changes and compute the probabilities of shrinkage (or expansion) of urban built-up areas. Finally, it simulates the explicit layout of the spatial distribution of shrinkage (or expansion) patches with the help of a sorting cellular automata (CA) model. The validity of MSSES is verified using multisourced data from the Wuhan agglomeration, China. We show that (1) MSSES can more accurately simulate urban expansion or shrinkage than the currently widely used neighborhood-based Logistic-CA (NL-CA) and (2) MSSES has advantage in solving the commonly seen problem of ""diffusion-coalescence,"" especially for the simulation of outlying expansion. Against the context of the Wuhan metropolitan area, we also found that overall the shrinkage trend is slowing down significantly, presenting three types of shrinkage at city-scale: remote shrinkage, peripheral shrinkage, and international shrinkage. Our study has contributions to the body of knowledge as well as practical implications for urban management and improving the sustainable development of urban areas in both China and abroad.The city we live in may be experiencing a situation where expansion and shrinkage are happening simultaneously. Hence, the simulation and prediction of temporal and spatial changes in urban expansion and shrinkage hold great importance in formulating urban policies. In this study, we propose a model capable of simultaneously predicting urban growth and shrinkage, and apply this model to the urban morphological changes in the Wuhan metropolitan area from 2000 to 2035. The simulation results demonstrate the effectiveness of this model in predicting the locations of urban expansion and contraction in advance. Furthermore, we discovered that the overall shrinkage trend is projected to significantly decelerate in the future. These findings offer support for intervention in urban planning, guiding the development of urban spaces and advancing the scientific aspects of urban planning.","He, Qingsong","Wang, Bo","Mou, Yanchuan","Tan, Ronghui","Zheng, Linzi",,,,,,,,,,,,,,4,JOURNAL OF URBAN PLANNING AND DEVELOPMENT,MaxEnt,CA,Shrinkage,Diffusion-coalescence,Wuhan agglomeration,MSSES,SPATIALLY EXPLICIT,GROWTH PATTERNS,CITIES,FORM,VITALITY,REGION,,,,,,,,,,,,,,DEC 1 2023,Simultaneous Simulation of Urban Shrinkage and Expansion Using Cellular Automaton and Maximum Information Entropy Models: Case Study of Urban Evolution in Wuhan Metropolitan Area
